,text,label
269,该活动推出以来广受欢迎，备受用户的好评和肯定。 杭州的李 小姐 周末自驾游时就选择了这一服务，“一嗨的这个服务真是十分贴心，虽然省下的钱并不是个大数目，但是取车时不用跑去加油站加油，还车时无需顾虑油箱是否满油，这一点十分人性化，充分考虑了用户的体验，可以看出一嗨十分了解我们最需要什么，从各个方面帮助我们省钱省心，所以我们这些人才会成为一嗨的忠实“粉丝”嘛。 ”另一位用户杨先生也表示十分满意，“我经常出差，每次都选择一嗨租车，九折预购油活动真的很优惠，比如我上次租了一辆大众朗行自排1.6L，满箱油价格大约是328元，选择这个优惠活动后，实际只需支付295元。,0
270,二是通过财政补助、社保补贴、创业实训补贴等政策，鼓励扶持高校毕业生自主创业。 三是使用就业专项资金给予全省29家人才培养评价试点企业高技能人才培训补贴；对 下岗 职工基本生活保障与失业保险并轨后部分困难企业“4050”职工给予社会保险补贴，实现精准帮扶。,1
271,交警李克东表示，当时轿车里充满了浓烈的酒味儿，于是他的同事向轿车副驾驶上的一名女子询问司机去向，对方却谎称“自己就是司机”。 随后，交警也走进面馆，最终在 卫生间 紧锁的一扇门后找到了轿车司机。 面对交警的盘查，该男子终于承认当时开车的就是他本人，而且自己的驾驶证于今年1月末因毒驾被吊销。,1
272,"但如果结合自己使用地图软件的体验来讲，小编真的不得不吐槽高德！ 周末从北京开车到承德，高德地图带给我一次""心塞无极限服务""：导航像路痴一般，带着我 走了 将近1小时的泥泞路；走泥泞路的时候因为看不见前方的石块，车子底盘全被擦烂了；开到半路，碰到前方修路，导航不提示，多等了 1小时。 出发的时候朋友特地嘱咐我用高德地图导航。",0
273,昨天对于民谣界是个悲喜交加的日子中国的民谣歌手有点悲剧但国外的民谣界却是欢声一片没错，民谣大师BobDylan拿下诺贝尔奖啦！ 当然此次诺贝尔文学奖 有喜 自然也有忧，那就是——村上春树大叔又陪跑again了呢 要知道，连小李子都终破奥斯卡魔咒了哇言归正传如今闪耀文坛的Dylan大叔可是一直都驰骋乐坛呢 虽然今年的Dylan已是75岁“高龄”然而在出道之初Dylan可是嫩少年一枚 大概是因为音乐特有的魅力Dylan的号召力从来就是有增无减更是收获了一票娱乐圈的迷妹们 其中首当其冲的是Ke ha在今年的Billboard音乐奖上Ke,0
274,尽管阿花用刀的样子看上去相当吓人，千惠还是忍住没出声，也没伸手…… “万一我怎么样了，我不想别人觉得，因为没有妈妈这孩子什么都不会。 我想趁现在多教她一点，这样就算以后我 不在了 ，她也能好好走下去。 就算她说害怕，就算被她讨厌，我也要坚持下去。,1
275,长期只吃单一品种的油现在，一般家庭还很难做到炒什么菜用什么油，但我们建议最好还是几种油交替搭配食用，或一段时间用一种油，下一段时间换另一种油，因为很少有一种油可以解决所有油脂需要的问题。 血脂不正常的人用油没有区别对于血脂不正常的人群或体重不正常的 特殊人群 来说，我们更强调的是选择植物油中的高单不饱和脂肪酸。 在用油的量上，也要有所控制。,1
276,”假如你真正懂得了积福的必要，哪怕已怔悟空性，甚至获得了佛果，也仍不会放弃行善积福。 往昔，佛陀的弟子阿那律尊者双目 失明 ，衣服破了也没办法补，于是他大喊：“谁求福德？ 来帮我缝衣服吧。,1
277,半地下室还可以作为储藏间使用。 一层设有客厅、餐厅、厨房、库房、 卫生间 和老人间。 二层室U形围合，在客厅的周围分布着三个带独立卫生间的卧室，其中一个卧室还带有衣帽间。,1
278,N海都记者陈盛钟马俊杰海都讯昨日，在莆田当地网络论坛上，一则“北高镇党委书记因病在单位去世”的消息引发网友关注。 昨晚，记者从莆田市委宣传部证实，荔城区北高镇党委书记李旸确系突发疾病 离世 ，目前，善后工作正在处理中。 昨晚，莆田市委宣传部发布消息：3月26日凌晨1时许，荔城区北高镇党委书记李某在该镇政府机关三楼宿舍内被发现去世。,1
279,魔兽和科比在本赛季揭幕战时还曾对喷北京时间3月28日，根据《体育画报》的报道，近日霍华德在接受采访时表示，他已经准备好为火箭争冠做出 牺牲 ，并且全力支持詹姆斯 - 哈登拿到MVP。 另外谈及当年在湖人与科比的矛盾时，霍华德称自己跟科比一样好胜，但是不愿意冲着队友发火。,0
280,4、貔貅忌血污和强光，有这些的地方尽量远离，拍照如果需要开闪光灯，要先把貔貅摘下来收好。 5、洗澡和 房事 的时候要将貔貅取下来。 6、摸貔貅的时候，切勿摸它的眼睛和嘴巴，这两者是招财叼财的关键所在，挡住就不灵了。,1
281,女孩子 胸部 发育慢，我们一般人都会认为这并不是什么严重的事情，殊不知，长期这样下去可能是某些疾病所导致的，因此，出现这情况朋友可要警惕，今天小编给大家介绍女孩子胸部发育慢该怎么办？ 1、适当的减轻平时的疲劳度，多休息，保证充足的睡眠，尽量的放松自己；2、充分保持乳房局部的卫生，最好每天晚上睡觉前，用温开水最柔软的胸部进行清洗；3、平时饮食上要注意，尽量科学的去调整饮食，多吃些营养丰富的食物，丰富餐桌上的食量，辛辣和寒凉的食物要少吃或不吃。,1
282,而且新的设备配套后，现有的收费项目和收费标准都将严格按照政府核定的标准执行，不会随意调整。 针对城市低保人群、优抚对象、农村“五保户”等 特殊人群 ，有关部门对其办丧事给予1000元的补助，昆明市殡仪馆对其收费为960元 / 位，包含一个骨灰盒。 而其他在馆丧事的办理费用则从2000元起，按照不同标准收费。,1
283,个八字其实喜欢水，但是也怕水入墓，入墓则是凶，所以和母亲有点相克。 母亲 走了 感情才会好转。 这里是老杨说命理，谢谢您的阅读老杨老师微信：yang102203,1
284,华人富翁俱乐部（zll43210）——不一样的新闻，不一样的故事，数百万人订阅的微信 大号 。 点击标题下蓝字“华人富翁俱乐部”免费关注，我们将为您提供有价值、有意思的延伸阅读。,0
285,但是，如果卵巢早衰，女性的雌性激素和孕激素在体内的含量下降，患者容易患骨质疏松，非常容易骨折。 影响女性的性生活卵巢早衰会给女性的性生活带来非常消极的影响，雌性激素的下降会让女性性欲降低，在 夫妻生活 中出现不和谐的因素，并且因此影响夫妻感情。 由于阴道干涩，还会出现阴道黏膜破损，引发阴道危害女性健康。,1
286,两家公司注册成立后，将合作开展业务、协同发展，由泛海担保为民金所互联网金融产品提供担保并获取资本回报，以提升民金所平台价值，增强其业务拓展能力。 同时，通过引入互联网思维及技术，实现传统金融产业基于互联网发展趋势的业务对接和 结构优化 ，助推公司金融业务的跨越式发展。,1
287,”有限的生命里，许帅把救助他人作为毕生的追求，照亮别人，燃尽自己。 许帅 走了 ，但他撒向人间的爱永存，他生命不息、奋斗不止的崇高精神永存。,1
288,10月18日，市委宣讲团同时赴横峰县宣讲。 广大干群倾情聆听，认真记录，表示要切实学习贯彻落实好市党代会精神，结合工作实际，发扬奉献精神和苏区干部好作风，牢牢把握“经济 结构优化 、民生发展优先、生态环境优美”的发展主题，传承红色基因，决胜全面小康，为加快建设“幸福新横峰”而努力奋斗。 宣讲团成员在弋阳县围绕“决胜全面小康、打造大美上饶”这一主题，从过去五年的成绩、未来五年的战略目标和中心工作及如何贯彻落实党代会精神等方面，对市第四次党代会精神进行了详尽的解读和诠释。,1
289,（资料图）“如果说啤酒肚和喝酒有什么关系，那就是一定要喝酒导致菜肴的摄入量增加，长期喝酒，自然会让食物摄入量过大，而导致肥胖。 ”她介绍，啤酒肚的产生有很多原因，首先还是因为饮食过量造成的肥胖问题，其实和年龄也有一定的关系，一般来说，中年人更容易出现啤酒肚，这和饮酒者的体质、内分泌、运动情况都有很大的关系，人到中年就会 发福 ，啤酒肚就是一个很明显的现象。 市区某健身房的健身教练李先生说，男性最容易堆积脂肪的地方就在腹部，主要原因是长时间坐着办公，缺乏运动。,1
290,拥有丰满的 胸部 女性魅力会大增，那么，怎样丰胸美胸呢？ 看看下面的美人丰胸计，配合丰胸按摩，轻松就能拥有C罩杯。,1
291,报考国外院校又有一番趣谈。 “在回国途中，我正在等 洗手间 ，偶然和边上的女士聊起来，发现她在我所报的曼哈顿音乐学院教授小提琴。 更巧的是，得知我来美国参加钢琴考试，她叫来了他的先生，正是我所报考的导师—曼哈顿音乐学院钢琴教师杰弗里·科恩教授。,1
292,原标题：俄外交部称联合国涉乌人权报告内容片面国际在线报道：综合新华社电，俄罗斯外交部发言人卢卡舍维奇18日表示，联合国人权事务高级专员办公室（人权高专）发布的涉乌人权报告对今年5月至6月初乌克兰局势的论述片面，俄方对此 表示遗憾 。 根据俄外交部网站发布的消息，卢卡舍维奇当天表示，联合国人权高专办公室发布的报告毫无根据地将乌克兰东部流血冲突的责任完全归于顿涅茨克州和卢甘斯克州两地民间武装，这种做法“不可接受”。,1
293,但创业板中多数企业的股票价值被严重高估，未来股价回落可能性较大。 尽管创业板存在着较大的成长空间，但是这些企业由于缺乏成熟的管理体系和稳定的盈利模式，也更易在残酷的市场竞争中 夭折 。 而作为投资者，不应该沉浸在自己的尅好预期之中，对于现今的创业板走势需谨慎入市。,1
294,昨日上午，经朋友介绍，他准备去洞井商贸城的一家按摩店应聘。 由于 失明 加上人生地不熟长沙晚报讯（记者陈暄通讯员曾扬）昨日，来长沙10多天的怀化的邓先生在找工作途中迷了路，幸好遇上了一位好的哥，才顺利找到目的地。 邓先生今年27岁，是一位盲人按摩师。,1
295,何洁 发福 疑似怀三胎和闺蜜现身医院做B超,1
296,想旺财运，正北方位正北方位十一月份是财位，作圣也的或者是创业的、销售等工作的，好好地利用这个方位会旺财的。 可以再 洗手间 正北的或正北有水龙头的地方，都是有利于财运的。 如果没有的话可以在正北方放三盆水在那，起到旺财的作用。,1
297,伸髋是指支撑时骨盆以支撑腿的髋关节为轴作向前转动，其目的是加大后蹬结束时两大腿之间的角度和缩小蹬角。 两大腿夹角大，说明摆动越积极，有利于增加步长，从而提高跑速，如果两大腿夹角小，则前蹬距离短，这样以 牺牲 步长来缩短支撑时间，则得不偿失。 三、缓冲阶段支撑腿的膝角缓冲是后蹬的前提条件，人体并非刚体，着地时身体各关节必然产生相应的缓冲。,0
298,每个警察看到这样的消息心情都极为不好。 一年到头辛辛苦苦，周而复始风雨兼程，用世界上人口比例最小的警力，管理这世界上人口最多国家的治安，时时有流血，天天有 牺牲 ，目前的中国是世界上最安全的国家，结果还被人骂得狗血喷头。 从表面上看侮辱的是警察个体，其实质就是根本没把国家法律当回事儿，是对国法和国家行为的藐视。,1
299,记者了解到，溺亡小伙贝贝16号凌晨溺水，直到29号民警才找到尸体，现在遗体放在了当地殡仪馆。 贝贝只有20岁，他的 去世 让全家悲痛欲绝。 贝贝的父亲郭大叔茶不思饭不想，母亲刘大婶哭得身体虚脱，只能靠打吊瓶维持。,1
300,如果是涮着吃，鱼肉必须变成白色、不透明，有红肉的要变成暗红色。 烧熟煮透无疑是最保险的办法，虽然需要 牺牲 一点鲜嫩的口感，但还是健康更重要。 如果将鱼放在冰箱冷冻室1~7天，寄生虫也可以被杀死。,0
301,即使打不破，二代可以跟他耗一波啊，等你没查克拉再与你一战。 当然，这一战要排除外界的干扰，你非要说大蛇丸解除秽土转生二代就 挂了 ，那我没话可说。 但是啊，连秽土转生都是二代开发的，你觉得大蛇丸还能左右二代吗？,1
302,关于赛轮金宇集团股份有限公司2014年度非经营性资金占用及其他关联资金往来情况的专项说明中兴华报字(2015)第SD - 3 - 003号赛轮金宇集团股份有限公司全体股东：我们接受委托，依据中国注册会计师审计准则审计了赛轮金宇集团股份有限公司(以下简称“贵公司”)2014 年 12 月 31 日的合并及母公司资产负债表，2014 年度的合并及母公司利润表、合并及母公司现金流量表、合并及母公司股东权益变动表，以及财务报表附注，并于 2015 年 4 月 1 日签发中兴华审字 2015)(第 SD - 3 - 059 号标准无 保留意见 审计报告。 根据中国证券监督管理委员会和国务院国有资产监督管理委员会《关于规范上市公司与关联方资金往来及上市公司对外担保若干问题的通知》(证监发[2003]56 号文)的要求，贵公司编制了后附的赛轮金宇集团股份有限公司 2014年度非经营性资金占用及其他关联资金往来情况汇总表 (以下简称“汇总表”)。,1
303,第一名：李健 ;第二名：谭维维 第三名：胡彦斌 ;第四名：郑淳元第五名：陈洁仪 ;第六名：古巨基 ;第七名：萧煌奇 ;第八名：李佳薇 ;第九名：李荣浩 。 我是歌手第三季陈奕迅southmoney自首季《我是歌手》以来，陈奕迅将加盟的消息就不绝于耳，但一直未见其踪影，而此前陈奕迅在接受采访时也几度表示《我是歌手》淘汰压力太大，自己有点不敢登台，故而早前网传陈奕迅将登台帮唱时，不少网友持 保留态度 ，将信将疑。 近日，陈奕迅将以帮唱嘉宾登台的消息得到《我是歌手》官方证实，这一重磅消息顿时引发歌迷们脑洞大开的猜想，“终于知道为什么Eason四月份要在长沙开演唱会了，肯定早就算好了要去《我是歌手》”、“Eason这是提前来《我歌》试水的节奏吗，难道准备加盟下一季？,1
304,那由此就断定肥胖一定会导致内分泌失调？ 有一种肥胖完全是因为饮食的不当以及不健康的生活方式，导致热量摄入过多囤积在体内，久而久之 发福 引发肥胖，因肥胖导致内分泌的紊乱，这种肥胖是起因，内分泌是结果；而内分泌也可引起肥胖，如甲状腺功能低下、多囊卵巢综合征、皮质功能减退等疾病也可能引起肥胖，这就是由病生胖。 所以说，一个好的饮食习惯和健康的生活方式是多么重要！,1
305,废话不多说，上图。 其它热点新闻 曝黄晓明10月法国娶Baby 6克拉戒指浪漫求婚视频 长沙小伙同时交17个女友 吃软饭的最高境界 《新娘大作战》杨颖倪妮因婚礼撞期展开闺蜜大战 22.8克世界最小百度戒指投影仪 问世 《非诚勿扰》观众上台暴揍男嘉宾 被保安强行拖走视频 张国荣 去世 12周年挚爱唐鹤德新男友曝光本周日即将推出新的一期，看点绝对让观众血脉喷张，志玲姐姐在水中身穿黑色吊带，大胆露酥胸，真的让人不知道看美颜好还是酥胸好。 根据自己爱好自动切换吧。,1
306,杜深江任市关工委常务副主任，不再担任市委、市政府特邀咨询职务。 祖传虎、李玉文、杨少华、陈兰钦、张化琴5名 同志 任市关工委副主任，杨少华兼任秘书长。 吴翠云在讲话中代表市委、市政府向上一届关工委班子老领导、老同志多年的辛勤付出表示崇高敬意和衷心感谢，向调整后的市关工委新领导班子表示祝贺。,0
307,天山网讯（记者金浩摄影报道）4月4日，新疆2015乙未年清明公祭大典活动在新疆福寿园文化广场隆重举行，500多位社会各界人士参加了公祭典礼，共同缅怀中华民族的人文始祖——轩辕黄帝。 当日11时许，随着法师们空灵的诵经声响起，参加公祭的群众表情凝重，向 长眠 于此的逝者默哀，并敬献鲜花，新疆福寿陵园股份有限公司总经理张金良恭读祭文，整个公祭仪式简短庄重。 随后，新疆福寿园的工作人员向现场群众免费发放祈福卡和孔明灯，用放飞孔明灯向逝者寄托哀思。,1
308,之后，天顺提议将付某的尸体分解后扔掉。 天顺、薛红安共同将尸体抬至聊吧的 卫生间 碎尸，然后遗弃。 后天顺让薛红安到外地取款，薛红安到郑州、广州、北京将付某银行卡上剩余的3.73万元取走，两人分赃。,1
309,说了这么多一句话，探客TANK007LED手电筒尽管用，比白炽灯的手电筒省电的多，对眼睛也无损害，当然你不要正对眼睛，强光对眼睛还是有一定的灼伤的。 补充：看到有人说：“探客TANK007LED产生的光强度比较高，强度超过人眼所能承受能力就会烧伤眼睛使其 失明 .它可以作为激光器的光源。 ”总是该补充一下：激光器为LD，发光二极管为探客TANK007LED，看来他是弄错了。,1
310,我女朋友是属于那种家里普通穷，在我的事业及财务上没帮上我忙的一个人，但我女朋友就比较听我话，本时周未去她家租房地方他都有帮我洗衣服煮饭都是他做，长得还算可以，带出去见朋友面子还可以。 但我女朋友是一个懂得回报的人，他帮我洗衣服做饭做家务，就要求我必须出钱，出到外面吃饭消费什么的，他基本叫我给钱，除了他买衣服跟化妆品他自己给，其他的开支都是我出，她还说以后结完婚几年后最好让他转做 家庭主妇 ，不想做事。 然后要求明年结婚一定要交首付在杭州买房，二只金手环，她老家拜一次酒跟我家也拜一次酒，总共三次。,1
311,卡瓦略希望用自己的行动唤起人们对丧婴家庭的关注。 Sands Australia是一家非营利机构，旨在为那些经历过流产、死婴和婴儿在28天内 夭折 的家庭提供全天候特殊援助。 为了提高人们对丧婴家庭的关注，身为该机构首席执行官的卡瓦略将于24日在墨尔本Box Hill开始24小时不间断步行。,1
312,因为据国外科学家研究，儿童乳牙里面的干细胞，比脐带血的干细胞更为“奇特”，因乳牙里面干细胞的多能性最强，与其他干细胞相比，增殖的速度更快。 它具有下面诸多超神奇的作用 可用于再生出身体组织，以替代身体不健康或受损的器官，比如可再生骨骼、再生心脏、再生牙齿； 可再生眼睛组织，以治愈 失明 ； 促进皮肤伤口愈合及再生，治疗烧伤有奇效，延缓衰老； 再生免疫系统，治疗足癣、白癜风、湿疹等； 再生脑细胞，治疗阿尔茨海默症，帕金森症、老年痴呆症等神经系统疾病； 还可以治疗类风湿性关节炎，再生血管，治疗心脏病，还被预测未来可治疗成人白血病…… 据悉，中国首家GMP级口腔干细胞库已成立，具体是将乳牙的干细胞保存在冷冻的液氮中，储存时间能长达30年，未来可用于治疗儿童成长过程中遇到的意外或疾病。 所以对于孩子身体某些遗传性或先天的疾病，储存孩子的乳牙是个不错的选择，比如先天性心脏病、先天性失明等。,1
313,大马哈鱼是一条母爱之鱼。 第二条是微山湖的乌鳢据说此鱼产子后便双目 失明 ，无法觅食而只能忍饥挨饿，孵化出来的千百条小鱼天生灵性，不忍母亲饿死，便一条一条地主动游到母鱼的嘴里供母鱼充饥。 母鱼活过来了，子女的存活量却不到总数的十分之一，它们大多为了母亲献出了自己年幼的生命。,1
314,目前，长安警方已受理学生家长的报案。 关键录像碰巧缺失据小予的妈妈郭女士回忆，当天晚饭后她查看女儿 私处 后震惊地发现上面有破损，并伴有少量流血。 随后到长安医院检查，医院诊断为“外阴外伤”。,1
315,但是央视的记者赶到本溪体育馆却发现，情况并不像俱乐部预期的那样。 早上9点的本溪体育馆门前，庞大的购票大军已经 不在了 。 这几天，俱乐部收回之前预订门票并加价出售的行为，批评声不断。,0
316,4月4日，承认制造了这起袭击的“青年党”威胁称将对肯尼亚发动更多血腥的袭击。 而肯尼亚总统4日也放了狠话，肯尼亚在打击恐怖主义的问题上永远不会改变，“我们的祖先为这个国家流血 牺牲 ，我们将尽一切努力捍卫我们的生活方式”。,1
317,画风太清奇！ 实在不行，那就做 家庭主妇 吧！ 对此，妈妈们表示不高兴了为啥非得我辞职带娃？,1
318,一生整容300次，毕生的积蓄都花在脸上！ 他 去世 前脸已成这样…是不是也被萌到了呢？ 点赞吧！,1
319,新加坡前总理李光耀3月23日 逝世 。 他是“新加坡经验”的开创者，在他的领导下，新加坡只用一代人的时间就跻身于发达国家行列，举世称奇。,1
320,国学文化，传承经典。 官网：https: / / shop73239665.taobao.com请复制网址至浏览器打开 10月19日是鲁迅先生 逝世 80周年纪念日。 大师之言，句句值得共勉。,1
321,这些不容置疑的事实形成了足够的控诉证据，法官在马德里对这四起案件的犯罪嫌疑人安东尼奥·奥特里斯结束了审问。 根据法官的判决，该嫌疑人触犯了四条非法居留的罪行，四条 性侵 犯的罪行，以及三条伤害罪。 根据当地法律，每一次非法居留应被处于5~6年的监禁，每次性侵将被处于12~15年监禁，每次伤害罪将被处于6个月至3年的监禁，由此可得：该犯人面临的，是69.5年~105年的监狱生涯。,1
322,有一种增龄的恶魔叫法令纹，讨厌的法令纹怎么消除呢，不管你多小年纪，只要你脸上出现了法令纹，别人就会认为你上了年纪，青春 不在了 ，我相信你肯定不愿意这样的事就这样发生在你身上，显年轻的女人，几乎可以看不到法令纹，可是一旦出现法令纹给人第一眼的印象就是岁月不饶人，因此每个爱美女性都急切的想知道法令纹怎么消除，想找到去法令纹最好的方法。 去法令纹最好的方法一：避免丰富的表情丰富的表情会加速法令纹的出现，所以MM们要注意了，乐观的心态固然重要，但别经常大笑，或者做其它一些太过于丰富的表情哦。,0
323,盗墓这个行当由来已久，各大墓地为了防止遭盗墓贼的光顾各式各样的防盗措施也是层出不穷，可这并没有让他们死后真的得以 长眠 ，中国的“十墓九空”这个说法果然是名不虚传。 但是并非所有的墓都被盗墓贼所挖掘，其中原因有很多。,1
324,网友“李二”1022晒出大量与乔任梁的微博，随后又删除了该条微博 网友上传的自拍照9月16日，28岁的男星乔任梁突然 离世 ，很多网友和他的圈中好友都发文表达了不舍与悼念之情。 这中间一名叫“李二1022”的微博网友多次发博表示自己对Kimi的思念。,1
325,朴有天因 性侵 形象跌落谷底回演艺圈几乎无可能,1
326,春运中，许许多多的铁路人坚守在自己的岗位上，除了我们熟知的客运人员、火车司机、售票员，在舞台的幕后，还有许多不为人知的铁路人为了旅客的出行在默默的付出。 2.95亿的旅客发送量，是铁人了 牺牲 了自己的除夕，牺牲了自己陪家人的时间换来的。 暴风雪中，火车之所以还能畅通开行，是铁路人冒雪铲除道岔积雪得来的，风雪中，即使腰酸了，手麻了，腿僵了，他们仍然坚守在自己的岗位上，兢兢业业的做好自己的工作。,0
327,最近央视的毕姥爷火了，同时也暂时 下岗 了，这位擅长在节目上调侃别人的毕姥爷领略了什么叫做祸从口出。 其实在美国，因出言不慎遭遇下岗的电视节目主持人也大有人在。,1
