,text,label
558,跟实体店不同，一些互联网装修公司都没有自己固定的装修队伍，而是采取网上招聘制，为了压低报价，对施工人员要求并不是太高，有些装修人员没有什么经验。 其结果是装修质量整体不高，尤其是水电线路、 洗手间 地面处理存在一些缺憾。 如果全包，对装修的耗材也不要当甩手掌柜，全听互联网装修公司的安排，而要亲自察看。,1
559,一名女性在祈祷，她朋友在抽烟看电视。 在两伊战争中 牺牲 的烈士的母亲，正在儿子墓地周围祈祷着，周围是他们的肖像。 伊朗亚兹德中某家庭的女性成员，最小的女孩抱着一个娃娃，娃娃也带着头巾。,1
560,“应该是前天晚上被砸坏的，昨天早晨我打扫卫生时发现站牌已经坏了。 ”附近一名 环卫工人 说。 “破坏公共设施，太没有公德了。,1
561,此时除了恶露不净，还有出血量时多时少，内夹血块，并伴有阵阵腹痛。 2宫腔感染可因产后洗盆浴，或卫生巾不洁，或产后未满月即行 房事 ，也可因手术操作者消毒不严密等原因致使宫腔感染。 此时恶露有臭味，腹部有压痛，并伴有发热，查血象可见白细胞总数升高。,1
562,在小孙的叙述里，从1月2日到她逃脱的1月8日这段时间里，她受到了非人的待遇。 她说，男子多次对她实施了 性侵 ，并且不准她穿任何衣服，还拍了裸照。 此外，男子还动不动就对她拳打脚踢，她的脸部都被打肿了。,1
563,但如过度吸烟，氰化物在体内蓄积过多，便引起慢性中毒，使视神经及视网膜受损害，称为烟草中毒性弱视。 一旦发生，病人视力急剧减退，辨色能力差，视敏度下降，重者可双目 失明 。 所以，为了保护你的眼，请远离烟草。,1
564,从法律上讲，夫妻离婚后还住一起算是同居，但并不具备婚姻合法性。 那么，离婚不离家引发纠纷又该如何解决呢?“警察 同志 ，我遭人强奸了!”16日午夜，重庆九龙坡区公安分局巴福派出所接到70后女子蒋艳(化名)的报警。 然而通过现场调查，民警发现这起“强奸案”实则是一起因“离婚不离家”而引发的闹剧。,0
565,导报讯（记者艳娜惠玲）6月14日10时45分，爷爷奶奶将高烧不退的孙女小瑾轩送到龙海市第一医院急诊室内，因为病情严重，医生要求办理住院并输液。 到了13时，小瑾轩开始出现身体僵硬、呕吐，17时20分许，小瑾轩因抢救无效 离世 。 患者家属认为，龙海市第一医院“因不给钱就不及时输液”，延误了治疗时间，负有不可推卸的责任。,1
566,更让人惊喜的是，中共中央政治局委员、省委书记汪洋，商务部部长陈德铭、商务部副部长高虎城，省委常委、常务副省长黄龙云等领导广交会大会副主任兼秘书长王俊文及相关负责人的陪同下，来到珠海交易分团的展区视察参观。 汪洋强调，当前世界经济贸易环境更加严峻复杂，广交会也面临前所未有的机遇和挑战，要深入贯彻落实习近平总书记对广交会的重要指示和李克强总理的批示精神，牢固树立发展新理念，居安思危、奋发图强，创新体制机制、商务模式，更好地支持企业开拓市场、做强品牌，为促进外贸回稳向好和 结构优化 升级作出更大贡献。 同时，他对于参加此次展会的企业坚持品牌战略开拓国际市场，给予了充分肯定。,1
567,怎么打呢？ 如果没有冰心可能要挂一次了， 挂了 就可能导致小怪逃跑，所以，有条件还是组个冰心。 天牢副本是这样的，地图分为上左右三路，小怪按波次刷新，其实他们就是想搬迁而已，当小怪在没有被吸引仇恨的前提下，他们走到地图中间的传送点时就可以顺利逃脱了。,1
568,无性别厕所内部，隔板很高很厚，门上有显示装置 浦东南路无性别公厕设计有6个座便隔间、4个蹲便隔间，另外还有男性小便间。 考虑到隐私和安全，隔间面积较普通公厕更大，进入隔间后，门板上会提醒其他 如厕 游客“里面有人”，同时，隔间之间设计了高达2.30米以上的挡板。 傅丽萍表示，设立无性别公厕，是为了科学配置男女厕位比，解决女性如厕排队时间过长的问题。,1
569,2014年，上海市单位生产总值综合能耗、碳排放下降率均超过8％，超额完成全年工作目标，能源消耗比上一年减少近270万吨，各项主要污染物排放量削减率也高于年初国家下达的目标；完成产业结构调整644项，年减少能源消耗47万吨标煤。 会议透露，2015年，上海将继续实施总量和强度“双控”制度，实现能源 结构优化 、污染总量持续下降。 锁定1000个项目，锁定4＋X(南大、桃浦、吴淞、高桥及其他)区域，聚焦重点区域、重点行业、重点企业，推动节能减排。,1
570,常见的微信容易被封号的10种原因①频繁切换微信帐号，频繁转帐都有封号风险②在多开上注册的微信号③频繁使用 敏感词 ，异常登入提示，在9月是特别严重的④ 经常集赞、诱导分享，朋友圈禁止4天⑤ 安装加人软件、抢红包插件、虚拟定位软件⑥ 安装多开数量过多⑦ 被封号的微信之前被封过⑧ 使用多开时开定位，使用相关定位功能⑨ 新注册的微信号直接使用多开登陆⑩ 买别人的号，或在软件上生成的号会被检测是非法注册。 9月新的一批可能导致封号的原因使用抢红包功能刚注册的微信就立马使用转发软件胡乱使用虚拟定位异常登入提示是9月最多，最严重的，最恶心的一个提示未卸载腾讯管家和应用宝未卸载360手机卫士和杀毒软件未关闭软件后台刷新一、微信解封后又被封了这时候我们要什么办：a、把手机上的微信删除，然后重新下载官方最新版本微信。,1
571,几个人都以为水会较浅，约好一同下河，但到现场发现与预想不同，三名工友不识水性，想回去，46岁的字某祥说，自己识水性，下水布网没问题。 他拿着挂网往河中走，边走边布网， 走了 几步就没顶了，他踩水，慢慢往对岸靠近。 工友看到，字某祥游得较吃力，甚至无法说话。,0
572,顾翔华特别指出，商用车（包括所有载货汽车和９座以上客车）长期以来一直被看做“宏观经济晴雨表”。 2014～2015年，中国商务车销售连续两年出现 负增长 ，去年销量为345万辆，负增长9%。 “但今年实现正增长，说明中国宏观经济正呈现积极变化。,1
573,7月26日，县委常委、组织部长田维胜带领县总工会、公安局、城管执法局、住建局等单位有关人员，为辛勤工作在高温一线的职工矿泉水、风油精、人丹等防暑降温物品。 田维胜一行先后看望慰问了县城区值班交警、 环卫工人 、县重点工程一线职工，送上慰问品，叮嘱他们保重身体。 田维胜对广大职工战高温、斗酷暑，坚守岗位、奋战在生产建设一线，为全县经济建设、道路畅通、城市管理辛勤工作表示由衷的敬意。,1
574,京华时报记者王俭摄京华时报讯(记者易小燕)昨天，港式惊悚影片《三更车库》在京举行了港式惊悚“三更归来”首映发布会，导演周耀武携影片主演方力申、林家栋出席。 现场，方力申更是自曝因拍戏而不敢上 洗手间 ，林家栋则分享了自己的“撞鬼”经历。 《三更车库》发生在市中心地下车库，车库保安罗坤由方力申饰演，其另一个身份则是一个道行高深的“捉鬼道士”，利用特殊的身份，他与林家栋饰演的保安包子着手调查“车库杀人”事件背后的恐怖真相。,1
575,记者随后又走访了上海大众、长安福特等4S店，情况和一汽大众差不多，销售人员均表示，最近的车价都有不同程度的降幅，即便如此，他们还是难以完成一季度的销售任务。 中汽协数据同样显示，2015年一季度，轿车市场连续两个月同比 负增长 ，2月轿车销售同比下降1.48%，3月轿车销售107.28万辆，同比下降1.43%。 市民更看重汽车性能和售后服务不过，4S店的优惠似乎仍难引发消费者的购车热情，一方面是上个月月底举办的车展已经消耗了一些市民的购车需求，另一方面则是相比价格，不少消费者更看重汽车的性能和售后服务。,1
576,现实中的情况可真不是这么乐观啊。 下岗 在家的我生活完全失去了重心。 不知道未来的生活应该如何进行下去。,1
577,除了担任教练，他还出任过多个ATP和WTA巡回赛的赛事主管，出任过多家电台、电视台的嘉宾解说员。 多明格斯在巴黎的一家医院病逝，据总统府公报称，他此前已与病魔搏斗一段时间，最后是在家人的陪伴中 离世 的。,1
578,【环球网综合报道】据日本时事通信社4月2日报道，日本首相安倍晋三3月27日在接受《华盛顿邮报》的采访中谈到 慰安妇 问题时，称慰安妇是“人口买卖的牺牲品”，美国国务院发言人当地时间4月1日称，对安倍此言表示欢迎。 据报道，该发言人表示：“安倍自2015年以来就历史问题和战后日本的和平贡献做出了很多积极发言，我们一直对此表示欢迎。,1
579,报告表示，目前来看，A股的风险主要体现在五个方面。 第一，基本面方面，8月新增人民币贷款9487亿元，虽然超过市场预期，但主要亮点在于非银贷款的增涨，考虑到企业贷款的 负增长 态势，实体经济需求并没有出现明显好转。 第二，流动性方面，继14天逆回购后，上周央行又重启28天逆回购，逆回购利率为2.55%，相比上次逆回购利率下降5bp。,1
580,二人刻意断后，远离大队，原本只需5分钟的路程，但张柏芝同胡须男足足走了10分钟，才到众人集合的停车场。 一向穿衣服都有独特个人品味的张柏芝，身上只穿着件薄如蝉翼的背心，但 下身 就离奇配条十足男装沙滩裤，再加对白鞋，身型全无，背心之下竟然离奇凸肚子。 等孙佳君同两个孩子离去后，张柏芝先接回Lucas同Quintus上宝马车，同胡须男一行四人坐车返回张柏芝位于中环半山世纪大厦。,0
581,在愉快轻松的环境中更容易怀孕，在焦虑紧张的环境中怀孕的几率会下降。 4、找准受孕时机研究表明下午4点到晚上7点是女性最佳排卵时间，把握好这个时间段进行 夫妻生活 ，怀孕的几率会更高。 每个人的体质不一样，有些人在任何时间内都可以怀孕，而有些人努力了很多次也可能怀不上孩子。,1
582,殊不知，欢乐的聚会背后，是神秘组织精心筹划的阴谋:人们无法逃离别墅!童桦得知林怀之等人的危机，化妆成男人被抓到别墅当中。 她的到来，是否能改变众人的命运?ZANK作为《再见X先生》第三季独家 同志 支持平台，与你一样，对该剧充满期待。,1
583,男子 性侵 13岁女生被其母亲当街扒光暴打,1
584,”记者俯身试图撕掉小广告，但它被胶水粘得很牢，根本撕不掉。 采访中，不少市民表示，之前是“包 小姐 ”的小招贴，现在“包小妹”又来了，这种野广告太露骨，出现在人流密集的公共场所很不应该，希望相关部门及时清理。,1
585,14、《武清日报》始末1958年初，武清县委为了推动党的建设，加强基层党支部的战斗堡垒作用，创办了《武清支部》小报，由县委宣传部李玉山 同志 负责，既是编辑又是记者，第一期是县委面向基层党组织发行的内部刊物。 同年8月1日，随着社会主义建设总路线的贯彻，县委把支部小报改为《武清报》，每逢周三、周六出刊，由天津市一家印刷厂承印，公开向全县发行。,0
586,“这支铅笔恰好贴着左眼巩膜划过，离眼球只有约一两毫米的距离，好在没有刺穿眼球。 ”吴劲松告诉记者，如果铅笔刺穿眼球，小鑫的视力将受严重影响，甚至可能 失明 。 该院眼科专家表示，每年他们都要救治不少被异物弄伤眼睛的孩子。,1
587,分析人士称，相关产业链或将受到关注。 文件中称，针对新兴生物基材料即将大规模爆发式增长的发展需求，培育一批拥有核心关键技术、创新能力强、具有国际竞争力的骨干企业，建设一批布局合理、 结构优化 、特色鲜明、产学研用有机结合、引领示范作用显著的产业集群。 而根据其专项支持原则，将针对传统石化材料带来的资源环境问题，围绕大众消费领域重大应用需求，鼓励用于传统日用塑料制品替代的新产品规模化生产应用，取得标志性重大产业成果，在促进循环经济发展、减少塑料白色污染等方面形成社会影响。,1
588,"它是杰克逊自1997年HIStory World Tour后最大型的演唱会，被视为全年最重要的音乐节目。 然而在开场前三星期，杰克逊因急性心脏病 身故 ，以至演唱会流产。 以此次演唱会命名的杰克逊的遗作单曲""This Is It""、专辑""This Is It”以及音乐电影《迈克尔·杰克逊：就是这样》于2009年10月在全球发行或公映。",1
589,搜狐娱乐讯7月20日下午，冯小刚在微博晒出新戏《我不是潘金莲》海报，并配文阐述拍摄前对范冰冰已经打了“预防针”，坦言出演这部新剧 牺牲 会很大。 最后冯导不忘盛赞范冰冰：“她做到了。,0
590,"做一个骁勇善战的角色是每个男性的梦想，也是每个妻子对丈夫的期望.然而，总有人会因为自己打不了""持久战""而导致妻子不能心满意足，而作为丈夫也往往会无比失落，性生活这首美妙的乐曲因此出现一些不和谐的音符。 只要不能持久，男人自然会想到""早泄"".早泄算是一种病态，然而，真正患有早泄的人很少，千万不要给自己带上""早泄""的帽子，无谓增加心理压力.目前关于早泄还没有统一的定义，一般来说，医生将做爱短于1分钟(从进入阴道开始计时)即发生不可控制的射精现象称为早泄，实际上，真正患有早泄的人非常少.专家认为自己早泄的人只有不到1 / 10是真正的早泄，多数只是对自己射精过早不满而已，并不符合早泄的诊断标准.归纳起来，困扰男性的问题集中在以下三个方面:1、一直存在 房事 时间过短，每次都是意犹未尽甚至""一触即发"";2、以前做爱时间长，近来缩短;3、每次妻子还没有感觉或者兴致刚起即射精，女方难有性高潮.专家指出，男性性交时间的长短与心境、环境、年龄、体质以及性经验、双方配合密切相关，不可仅仅归咎于自己""不厉害""而忧心忡忡，譬如初次性交、久别重逢一般都会很快射精，这些经过一段时间调整即可延长性交时间，不必总是担心再次失败.想了解更多相关知识，还可以阅读：《 男人的早泄治疗期间需要注意什么?》。",1
591,李光耀1959年至1990年担任新加坡总理，执政期间推动新加坡经济快速发展，使这一城市国家跻身“亚洲四小龙”。 3月23日凌晨，李光耀因病 逝世 ，享年91岁。 他的葬礼于3月29日举行，当天数万民众冒雨涌上街头，最后送别这名开国总理。,1
592,【本报讯】3月26日，记者从省民政厅获悉，我省被确定为 低收入 家庭生活状况监测项目试点地区。 目前，我省正在按项目实施方案，开展监测县区名单确认、人员培训等前期准备工作。,1
593,10月13日下午，邯郸市实验小学副校长张京祥、办公室主任王德霞专程来到市公安交警一大队将一面上书：“感谢人民好交警，情系师生保平安”的锦旗送到交警一大队大队长温丁君 同志 的办公室对一大队二中队保校园一方平安的多项举动提出了表扬。 今年9月初，全市中小学生陆续开学，特别是地处光明北大街区域的市验小学区域，车流量急剧增加，2700多名师生上下学面临拥堵，给师生的出行造成了隐患，新任大队长温丁君同志得知情况后与主管勤务的副大队长杨兴林，辖区二中队中队长袁伟康先后三次实地进行调研，现场制定了疏导措施，即：由二中队每天早晚高峰定点派出警力2名进行疏导，每天早7点由一名民警提前赶到学校周边区域摆放锥筒对过往车辆及接送孩子的车辆实行分道通行并全力进行疏导。,0
594,2、貔貅喜好干净的环境，不要让貔貅沾染体液、血液等，沾染体液会使其无法发挥效果，且貔貅沾血会冲血煞。 因此 房事 、洗澡等时间，最好暂时取下。 3、因为貔貅忌光煞，所以遇到强光的时候要取下来，比如：拍照时的闪光灯。,1
595,图片来自网络针对“四川广安华蓥市豪迈国际广场一女孩坠楼”事件，华蓥市公安局政工科一唐姓工作人员7月20日告诉澎湃新闻，坠楼女孩王某因身体不好，她奶奶因封建迷信思想严重，找“八字先生”李某某为孙女治病。 李某某称治疗需要“圆房”，在征得唐某某同意后对王某实施 性侵 ，王某产生轻生念头遂跳楼自杀。 目前两名涉案人员被刑拘。,1
596,【环球网综合报道】据美国《赫芬顿邮报》3月24日报道，美国弗吉尼亚州一所高中的28岁女教师埃里卡?琳恩?梅萨(EricaLynnMesa)因 性侵 2名男学生被起诉。 强奸罪成立后，她将面临22年的牢狱之刑。,1
597,” 精彩内容 源自《本草纲目》 （李俊孙子图） 长按二维码大家可以和我孙女交流 感谢小黄提供的照片 长按二维码大家可以和我孙女交流 感谢小廖提供的照片 孙女得我真传长按二维码大家可以和我孙女交流据《本草纲目》记载的详细说明 注意事项 长按二维码大家可以和我孙女交流 写留言?boss方20看起来很不错的样子，管不管用先加上看看吧，不差试这一次了昨天作者回复试试吧，产品管不管用，问问自家媳妇就知道啦！ 讲葡萄牙语24看到不用控制 夫妻生活 ，就默默的已经加上，把朋友圈翻了一遍的举手昨天大鹏展翅358李老师是小黄的贵人呀，贵人，也救救我吧！ ！,1
598,小张：放在床上就爆炸了，前两天左右发生的事情，放在床上就冒烟，手机发烫就炸成这个样子。 小张说当时手机并没有充电，就放在床上，当时她从 洗手间 出来，就看到了这奇特的一幕。 小张：刚从厕所出来，就看到手机在冒烟，没有声音，我们不敢用水泼，怕把东西烧坏。,1
599,10月11日，中国青年网题为《山西长治8岁女童疑遭男老师 性侵 警方：已移送检方起诉》的报道刊发后，在社会上引起强烈反响。 人民网、新华网、中国新闻网、澎湃新闻、新浪新闻、网易新闻等上百家媒体转载，并引发诸多网友关注，各网评论达数十万。,1
600,李阵郁洗清涉嫌 性侵 罪名公司发文感谢粉丝支持,1
601,”“聊你妈蛋，处就说，不处你瞎巴巴JB！ ”.....然后对方把电话 挂了 。,0
602,蓝天救援队接警后将女子打捞上岸，目前，仍未联系到死者家属。 据悉，女孩身高约1.62米，体征中等，圆脸长发，上身穿黑色短袖T恤， 下身 穿白色牛仔短裤，目测年龄约15~20岁。 遇难者的身份尚未确定，也没有联系上家属。,0
603,跑步并不是为了锻炼身体，而是不久前该院系出台的一项规定：“挂一科跑1000米”。 据了解，该系2013级共有80余人，仅上学期期末考试就有30多人挂科，挂科最多的一名男生共 挂了 五门课，被罚跑5000米。 去年该校也曾有院系采取类似做法，并取得了一定的效果，但不少同学对类似的处罚持反对态度，认为不值得推广。,0
604,建议：对于梨形身材的妹子，上身可以选择牛仔衣或者夹克，下身考虑伞裙或者合体的裤装可以有效避免臀部宽大。 2.草莓型身材： 草莓型身材的突出特点：与梨形正好相反，其重心主要集中在上身，上身拥有宽阔的肩膀和丰满的 胸部 ，下身则是纤细的双腿。 建议：上身不要穿出太过张扬个性的衣服，比如衬衫、收腰T恤或中长版西装外套为最好；下身则可以选择颜色亮一些，带有扩张效果的纹格裤裙会很好的调整别人的关注重心！,1
605,林志玲据报道，39岁的林志玲就曾为自己的性感 胸部 投了很大的保单，价值100万。 大S大S的身体：1亿元台币（为让害怕古装戏大s接拍《倩女幽魂》，剧组开出为上亿新台币保单）。,1
606,孕妈妈的妊高症要是严重了，爆血管不是不可能的呀！ 失明 、肝损伤、肾衰竭，恐怕会一个接着一个来！ 最可恶的是，妊高症连宝宝都不放过啊，发育不良，这对宝宝的损伤那是一生的。,1
607,当地政府日前对64岁的阿布达乌赫进行表彰，称其是“模范母亲”。 报道称，她还怀着孕时，丈夫 去世 ，为了生计，阿布达乌赫只好女扮男装外出工作。 为了能更像一名男人，总是穿着宽松衣物、全身长袍，而这一扮就是40多年。,1
608,一个双臂截肢，一个双目 失明 ;既买不起五毛钱一株的树苗，也用不起除草剂，河北省石家庄市井陉县两残障人士却在14年时间里栽下了上万棵树。 井陉县村民贾海霞和贾文其他们互为手眼，买不起树苗，就爬树削枝;用不起除草剂，就挥舞镰刀。,1
609,湖北日报讯（记者甘勇、通讯员邓金龙、实习生陈杰）昨从东风汽车公司获悉，上半年东风汽车累计销售192.69万辆，下半年东风公司将千方百计稳增长，确保400万辆销量目标。 产品 结构优化 提升市场竞争力。 去年下半年以来，东风在乘用车领域投放14款新品，东风日产新逍客、东风风神AX3等SUV产销两旺，东风本田新思域、东风日产新轩逸等轿车销量超越上一代产品，东风小康风光、东风柳汽S500等MPV市场取得突破。,1
610,提醒：在外出行时提前准备好纸巾和小垃圾袋，避免随地吐痰、扔垃圾。 带孩子出行的游客，应多留意或询问当地的公共 洗手间 ，需要时可以尽快找到。 （叶欣）,1
611,经市场调研，徐汇苑周边小区每月地下停车价格已涨至八九百元，最高达2500元。 王淑珍介绍，徐汇苑是“全国物业管理示范住宅社区”“全国物业管理示范大厦”，多年来开发商不断投资提升车库“软硬件”：入口装有LED视频显示器、道路墙面整洁如新、标牌清晰易辨，配有智能出入管理系统和 盥洗室 等高端设施。 同时，每天有保洁清洗、24小时保安监控、值班和巡逻。,1
612,8人中4人下跪，旁边有一名女老师在说什么。 目前当事老师已被学校 辞退 ，校长将被追责。 每一个行业，总免不了有少数害群之马，学生受辱即使是偶尔发生，已经让人不能接受。,1
613,“烈士为国献身，应该永远受到尊敬和祭奠！ ”某边防团政委朱海林说，“今天，我们要仰望他们用血性筑起的精神丰碑，继承先烈遗志，维护好边防稳定，让 长眠 在这里的烈士安息……”配图：王建川家人和部队官兵一同祭奠烈士。,1
614,我听说日本人都不太在意后面的身体，所以反而很在意了。 ”（30岁 / 保险 / 专职）■ 胸部 “胸部的大小。 从年龄而言，我已经有点下垂了，因此比较在意周围的人。,1
615,有个媳妇你就知足吧，我都23了我的择偶标准长得像@女的就行，可是我还是没找到 @奢蜜董事婕芙CEO：傻孩子，化上妆一个样子，卸了妆又一个样子，就好像你娶了两个老婆，真是不知道珍惜 @赵镇铭：自己结的婚 含着泪也要过完 其实，颜值这玩意真不是盖的，很多妹子妆前妆后的差距还是蛮大的……心理承受能力比较差的，还是长点心吧…来源：成都商报（ID：cdsb86612222）综合新浪微博、中国新闻网关注海峡导报微信（hxdbwx）毁三观！ 少女遭多人 性侵 5年生3娃，亲妈和外婆不报警！ 还纵容强奸犯到家里来！,1
