,Euphemisms,literal translation,euphemistic meanings,category,Rating,text,source,,always eup,,,,,,,,,,,,,,,,,,,,,,,,,,,,,,,,,,,,,,,,,,,,,,,,,,
,iranu,rubbish,sex,Sexual Activity,0,"Ṣugbọn ero ọkan awọn eeyan to gbọ ohun ti DPP fẹẹ ṣe fun Yọmi Fabiyi ko ri bakan naa, awọn kan n sọ pe ijọba wulẹ fẹẹ nawo ara Eko lori iranu ni. Wọn ni ki lo kan ijọba Eko pẹlu awọn onitiata, ti wọn yoo fi maa fowo ilu ṣe ẹjọ fiimu ‘Ọkọ Iyabọ’ kan. ",https://alaroye.org/kootu-fee-pe-yomi-fabiyi-lejo-nitori-sinima-oko-iyabo/,,,,,,,,,,,,,,,,,,,,,,,,,,,,,,,,,,,,,,,,,,,,,,,,,,,,
,iranu,rubbish,sex,Sexual Activity,1,"O kọ ọ sibẹ pe: “O buru gan-an o, o riiyan lara gidi ni. Oṣere onitiata Yoruba, Baba Ijẹṣa, to lọọ b’ọmọ ọlọmọ ṣeṣekuṣe lọmọ ọdun meje, to tun pada waa ba a ṣeranu lọmọ ọdun mẹrinla, ha! Ta lo mọ iye eeyan ti oniranu ọkunrin yii aa ti ba laye jẹ ka sọ pe ọwọ o tẹ ẹ. Emi ni mo n ṣagbatẹru ofin ta ko ṣiṣe ẹnikẹni baṣubaṣu. O kere tan, ọdun mẹrinla lẹni to ba jẹbi ẹsun bẹẹ maa lo lẹwọn.",https://alaroye.org/iwa-ti-baba-ije%e1%b9%a3a-hu-buru-o-si-riiyan-lara-pelu-abike-dabiri/,,,,,,,,,,,,,,,,,,,,,,,,,,,,,,,,,,,,,,,,,,,,,,,,,,,,
,iranu,rubbish,sex,Sexual Activity,0,"A ti lọọ tọrọ iyawo Akin. N ko le sọ pe o dun mi tabi ko dun mi, nitori inawo naa ko lọ bi mo ṣe fẹ. Niṣe ni pasitọ to jẹ baba iyawo wa n ṣe bii ẹni pe nnkan eewo ni ọmọ oun ṣe, to ṣaa n ṣe balubalu kiri bii ẹyẹle Subaina. Iyawo ẹ lo pero, tipatipa lo fi mu awọn mẹta ti wọn ni ẹbi ẹ ni wa. Ṣugbọn sibẹ naa, awọn ẹbi iyawo ẹ ṣe bẹbẹ, nigba to si fẹẹ maa ṣe iranu, wọn gba yẹyẹ si ẹgbẹ kan, a yaa n ṣe nnkan wa lọ. ",https://alaroye.org/igbeyawo-akin-%e1%b9%a3e-aye-mi-daa-tabi-ko-daa/,,,,,,,,,,,,,,,,,,,,,,,,,,,,,,,,,,,,,,,,,,,,,,,,,,,,
,iranu,rubbish,sex,Sexual Activity,0,"Emi o kuku tiẹ wo oju ẹ, nitori gbogbo ohun to ti ba jẹ mọ iranu bẹẹ yẹn, paapaa lori ọrọ ẹsin, ko ba emi nile, mo koriira rẹdẹrẹdẹ.",https://alaroye.org/igbeyawo-akin-%e1%b9%a3e-aye-mi-daa-tabi-ko-daa/,,,,,,,,,,,,,,,,,,,,,,,,,,,,,,,,,,,,,,,,,,,,,,,,,,,,
,iranu,rubbish,sex,Sexual Activity,0,"Bi Tinubu ba fẹẹ du ipo aarẹ, ẹ jẹ ko jade, ko kọkọ sọ bẹẹ, eyi lawọn araalu yoo fi mọ eyi ti wọn yoo ṣe. Gbogbo eyi ti ẹ n ba kiri yii, iranu ni o; ẹ jẹ ki Tinubu jade ko fẹnu ara ẹ sọrọ.",https://alaroye.org/o-%e1%b9%a3oju-mi-koro-apa-keji-21/,,,,,,,,,,,,,,,,,,,,,,,,,,,,,,,,,,,,,,,,,,,,,,,,,,,,
,iranu,rubbish,sex,Sexual Activity,1,"Ọkunrin ọlọkada yii ṣalaye pe “Baba nla oniranu lobinrin tẹ ẹ n wo yii. Ọlọpaa lo n yan lale. Koda, mo ti ka awọn mejeeji mọ ori ara wọn ri. Lanlọọdu ọlọpaa yẹn gan-an ti lu mi nigba ti mo sọ ọrọ yẹn di wahala ko too mọ pe iyawo mi ni tẹnanti oun n ba laṣepọ",https://alaroye.org/kinni-o%cc%a3lo%cc%a3paa-dun-mo%cc%a3-mariam-lo-ba-ko%cc%a3-o%cc%a3ko%cc%a3-e%cc%a3-sile%cc%a3-nibadan/,,,,,,,,,,,,,,,,,,,,,,,,,,,,,,,,,,,,,,,,,,,,,,,,,,,,
,iranu,rubbish,sex,Sexual Activity,0,Gbogbo iranu yi o ba mi l'ara mu rara,,,,,,,,,,,,,,,,,,,,,,,,,,,,,,,,,,,,,,,,,,,,,,,,,,,,,
,iranu,rubbish,sex,Sexual Activity,1,Oniranu ni bobo yen,,,,,,,,,,,,,,,,,,,,,,,,,,,,,,,,,,,,,,,,,,,,,,,,,,,,,
,iranu,rubbish,sex,Sexual Activity,1,Mi o ni fe si gbogbo iranu ti o ma ba mi se,,,,,,,,,,,,,,,,,,,,,,,,,,,,,,,,,,,,,,,,,,,,,,,,,,,,,
,iranu,rubbish,sex,Sexual Activity,1,"Boda Kunle, iranu yin ti po ju",,,,,,,,,,,,,,,,,,,,,,,,,,,,,,,,,,,,,,,,,,,,,,,,,,,,,
,iranu,rubbish,sex,Sexual Activity,1,Asewo yen ma n se iranu pupo ju,,,,,,,,,,,,,,,,,,,,,,,,,,,,,,,,,,,,,,,,,,,,,,,,,,,,,
,iranu,rubbish,sex,Sexual Activity,1,"Ma foju oniranu wo mi Ife re lo n pami bi oti Mi o kise oniranu obinrin Bose nse ako, bena lo nse abo Bi ife sema nse okunrin toba ri obinrin towu Be gele na lose ma nse obinrin na tan bari okunrin to wu won Bakanna ni ife sejo ma nse wa Pipe timo ma n pe o Biba soro timo ma n ba e soro Sise aferi re timo ma nse aferi re Kise tipe moya didirin Be sini kise pe ori mi ope Ife re lo n pami bi oti Fifun timo n fun e ni nkan Fifi ife han si e ni gbogbo igba Titele oro ati ase enu re Bimo ba n gba ere ife fun e nigbakugba Timo nse ohun timo lagbara fun e lati fi ran e lowo Ki kuku sepe moya didirin Ife re lo n pami bi oti Bimo ba nse ode fun e Timo nse bi eni ti o le soro Timo nse igbiyanju lati je koda fun e Kise pe moya didirin Ife re lo n pami bi oti Bimi o bale se ki n ma pe e lojo kan Gbogbo igba nimo ma nfe lati ri e Bimi o ba ri e lojo kan, tabi ki n gbo ohun re Ara mi o ni bale Bimo ba nfi owo ara mi pe e Ki kuku sepe moya didirin Ife re lo n pami bi oti Boba n semi biki n di mo e",https://www.facebook.com/search/top?q=sere%20ife,,,,,,,,,,,,,,,,,,,,,,,,,,,,,,,,,,,,,,,,,,,,,,,,,,,,
,iranu,rubbish,sex,Sexual Activity,1,"O salaye pe wọn maa n fi ọkọ bu oun nibi isẹ, ti wọn si maa n lero pe oun ti se iranu ati isekuse ni oun ko se bimọ.",https://www.bbc.com/yoruba/afrika-56911789,,,,,,,,,,,,,,,,,,,,,,,,,,,,,,,,,,,,,,,,,,,,,,,,,,,,
,iranu,rubbish,sex,Sexual Activity,0,E diwo ere iranu ti e n se,,,,,,,,,,,,,,,,,,,,,,,,,,,,,,,,,,,,,,,,,,,,,,,,,,,,,
66,dawo tele,to place hands on the ground,to defecate,Bodily Function,1,Omokunrin naa dawo tele ni eyin ile iwe,,,always,,,,,,,,,,,,,,,,,,,,,,,,,,,,,,,,,,,,,,,,,,,,,,,,,,
,dawo tele,to place hands on the ground,to defecate,Bodily Function,1,Mo fe dawo tele,,,,,,,,,,,,,,,,,,,,,,,,,,,,,,,,,,,,,,,,,,,,,,,,,,,,,
,dawo tele,to place hands on the ground,to defecate,Bodily Function,1,"O da bi m pe, eyan ka dawo tele si ibi bayi o tori pe o n run",,,,,,,,,,,,,,,,,,,,,,,,,,,,,,,,,,,,,,,,,,,,,,,,,,,,,
67,ro efo fun ,make vegetable soup for him ,bewitched someone,,1,"Oti ife n pa gidi gan ni, omoge yen ti ro efo fun e je",,,sometimes,,,,,,,,,,,,,,,,,,,,,,,,,,,,,,,,,,,,,,,,,,,,,,,,,,
,ro efo fun ,make vegetable soup for him ,bewitched someone,,1,"O ma wa ga o, awon ololufe yii n sebi pe won ti ro efo fun arawon je",,,,,,,,,,,,,,,,,,,,,,,,,,,,,,,,,,,,,,,,,,,,,,,,,,,,,
,ro efo fun ,make vegetable soup for him ,bewitched someone,,1,"Se iwo nikan lo ma koko nife eyan ni, abi omo yen ti ro efo fun e je?",,,,,,,,,,,,,,,,,,,,,,,,,,,,,,,,,,,,,,,,,,,,,,,,,,,,,
,ro efo fun ,make vegetable soup for him ,bewitched someone,,1,o ti ro efo ife fun je,,,,,,,,,,,,,,,,,,,,,,,,,,,,,,,,,,,,,,,,,,,,,,,,,,,,,
,ro efo fun ,make vegetable soup for him ,bewitched someone,,0,"Mo fe teba, bami ro efo fun mi je",,,,,,,,,,,,,,,,,,,,,,,,,,,,,,,,,,,,,,,,,,,,,,,,,,,,,
,ro efo fun ,make vegetable soup for him ,bewitched someone,,1,Asake ti ro efo fun mi Mo de je Mo de gbemi ,,,,,,,,,,,,,,,,,,,,,,,,,,,,,,,,,,,,,,,,,,,,,,,,,,,,,
,ro efo fun ,make vegetable soup for him ,bewitched someone,,0,"ba mi ro efo fun mi je, ebi pa mi",,,,,,,,,,,,,,,,,,,,,,,,,,,,,,,,,,,,,,,,,,,,,,,,,,,,,
,ro efo fun ,make vegetable soup for him ,bewitched someone,,1,efo wo lo ro fun oko e to fi je pe o ni fe e pupo ju,,,,,,,,,,,,,,,,,,,,,,,,,,,,,,,,,,,,,,,,,,,,,,,,,,,,,
,ro efo fun ,make vegetable soup for him ,bewitched someone,,0,ro efo riro fun mi je,,,,,,,,,,,,,,,,,,,,,,,,,,,,,,,,,,,,,,,,,,,,,,,,,,,,,
,ro efo fun ,make vegetable soup for him ,bewitched someone,,1,Bayo n se bi eni to ti ro efo ife fun je,,,,,,,,,,,,,,,,,,,,,,,,,,,,,,,,,,,,,,,,,,,,,,,,,,,,,
,ro efo fun ,make vegetable soup for him ,bewitched someone,,0,Efo ti alase yen ro fun mi n mo je,,,,,,,,,,,,,,,,,,,,,,,,,,,,,,,,,,,,,,,,,,,,,,,,,,,,,
68,ọ̀pálámbá,bottle,bottle,**,0,Bàbá Ọ̀pálámbá ló sọ èyí nígbà tí erénáà bẹ̀rẹ̀ tí ó ń ronú lórí ọ̀rọ̀ ìlú jogbo.,,,sometimes,,,,,,,,,,,,,,,,,,,,,,,,,,,,,,,,,,,,,,,,,,,,,,,,,,
69,ìṣekúṣe ,inappropriate actions,sex,Sexual Activity,0,Isekuse lomo yen n se pelu ise ti o sope o n se,Iyanu,,sometimes,,,,,,,,,,,,,,,,,,,,,,,,,,,,,,,,,,,,,,,,,,,,,,,,,,
,ìṣekúṣe ,inappropriate actions,sex,Sexual Activity,0,Ma sesekuse pelu ounje ti mo se. Gbe sile ti o ba fe je,iyanu,,,,,,,,,,,,,,,,,,,,,,,,,,,,,,,,,,,,,,,,,,,,,,,,,,,,
,ìṣekúṣe ,inappropriate actions,sex,Sexual Activity,1,"Amọ nigba ti wọn de isalẹ lo tun ba ọmọ naa se isekuse lẹẹkeji, lati igba naa ni ko ti wa sile mi mọ amọ nigba to ba nilo iranlọwọ, o maa n pe mi.",https://www.bbc.com/yoruba/afrika-49575716,,,,,,,,,,,,,,,,,,,,,,,,,,,,,,,,,,,,,,,,,,,,,,,,,,,,
,ìṣekúṣe ,inappropriate actions,sex,Sexual Activity,0,"Lara awọn eeyan to n gbarata lori bi wọn se n se awọn ọmọ Naijiria ni isekuse ni South Africa ni awọn gbajumọ ati ilu mọọka lawujọ, to fi mọ awọn osere tiata.",https://www.jw.org/yo,,,,,,,,,,,,,,,,,,,,,,,,,,,,,,,,,,,,,,,,,,,,,,,,,,,,
,ìṣekúṣe ,inappropriate actions,sex,Sexual Activity,1,Ṣé Ẹ̀ṣẹ̀ Ni Wíwo Àwòrán Ìṣekúṣe Jẹ́ Lójú Ọlọ́run? Báwo La Ṣe Máa Ń Ṣe Ìkẹ́kọ̀ọ́ Bíbélì? Kí Ló Máa Ń Ṣẹlẹ̀ Nínú Gbọ̀ngàn Ìjọba? Ta Ni Àwa Ẹlẹ́rìí Jèhófà?,https://www.jw.org/yo,,,,,,,,,,,,,,,,,,,,,,,,,,,,,,,,,,,,,,,,,,,,,,,,,,,,
,ìṣekúṣe ,inappropriate actions,sex,Sexual Activity,1,Ọ̀pọ̀ èèyàn títí kan àwọn tó gbà pé èèyàn Ọlọ́run làwọn ò ka wíwo àwòrán ìṣekúṣe sí ẹ̀ṣẹ̀. Ṣé bẹ́ẹ̀ lọ̀rọ̀ rí lóòótọ́?,https://www.jw.org/yo,,,,,,,,,,,,,,,,,,,,,,,,,,,,,,,,,,,,,,,,,,,,,,,,,,,,
,ìṣekúṣe ,inappropriate actions,sex,Sexual Activity,1,Ohun Tó Ń Mú Ọkàn Fà Sí Ìṣekúṣe,https://www.jw.org/yo,,,,,,,,,,,,,,,,,,,,,,,,,,,,,,,,,,,,,,,,,,,,,,,,,,,,
,ìṣekúṣe ,inappropriate actions,sex,Sexual Activity,1,Ǹjẹ́ Bíbélì dẹ́bi fún wíwo ohun tó ń mú ọkàn fà sí ìṣekúṣe?,https://www.jw.org/yo,,,,,,,,,,,,,,,,,,,,,,,,,,,,,,,,,,,,,,,,,,,,,,,,,,,,
,ìṣekúṣe ,inappropriate actions,sex,Sexual Activity,1,"Lóde òní, ó fẹ́rẹ̀ẹ́ máà sí ibi tó o yíjú sí tí kò sí àwọn ohun tó ń mú ọkàn fà sí ìṣekúṣe, ohun tó sì gbòde kan nìyẹn. Àmọ́ tó o bá fẹ́ múnú Ọlọ́run dùn, tó o sì fẹ́ láyọ̀, ó yẹ kó o mọ ojú tí Ọlọ́run fi ń wo àwọn ohun tó ń mú ọkàn fà sí ìṣekúṣe.",https://www.jw.org/yo,,,,,,,,,,,,,,,,,,,,,,,,,,,,,,,,,,,,,,,,,,,,,,,,,,,,
,ìṣekúṣe ,inappropriate actions,sex,Sexual Activity,1,"Lóòótọ́, Bíbélì ò sọ̀rọ̀ nípa àwọn ohun tó ń mú ọkàn fà sí ìṣekúṣe ní tààràtà. Àmọ́ wíwo àwọn ohun tó ń mú ọkàn fà sí ìṣekúṣe kò bá àwọn ìlànà Bíbélì mu.",https://www.jw.org/yo,,,,,,,,,,,,,,,,,,,,,,,,,,,,,,,,,,,,,,,,,,,,,,,,,,,,
,ìṣekúṣe ,inappropriate actions,sex,Sexual Activity,1,"Bí àpẹẹrẹ, Bíbélì sọpé tí ọkùnrin tó ti gbéyàwó bá ń “bá a nìṣó ní wíwo obìnrin kan” tí kì í ṣe aya rẹ̀, tó sì ń wù ú pé kó bá a lò pọ̀, ó lè mú kó ṣe panṣágà. Ìlànà Bíbélì yìí kan gbogbo ẹni tó ti lọ́kọ tàbí aya àtàwọn tí kò tí ì ṣègbéyàwó. Tó bá ń “bá a nìṣó ní wíwo” àwòrán ìṣekúṣe, tó sì ń wù ú pé kó ní ìbálòpọ̀ tí kò tọ́, ìwà tí inú Ọlọ́run kò dùn sí ló ń hù yẹn.",https://www.jw.org/yo,,,,,,,,,,,,,,,,,,,,,,,,,,,,,,,,,,,,,,,,,,,,,,,,,,,,
,ìṣekúṣe ,inappropriate actions,sex,Sexual Activity,1,"Téèyàn ò bá ṣèṣekúṣe ńkọ́, àmọ́ tó ń wo ohun tó ń mú ọkàn fà sí ìṣekúṣe?",https://www.jw.org/yo,,,,,,,,,,,,,,,,,,,,,,,,,,,,,,,,,,,,,,,,,,,,,,,,,,,,
,ìṣekúṣe ,inappropriate actions,sex,Sexual Activity,1,"Ẹnu àwọn tó ń ṣèwádìí ò kò lórí bóyá wíwo àwọn ohun tó ń mú ọkàn fà sí ìṣekúṣe lè mú kéèyàn ṣe ìṣekúṣe. Àmọ́ Bíbélì jẹ́ ká mọ̀ lọ́nà tó ṣe kedere pé inú Ọlọ́run kò dùn sí àwọn ohun tó ń mú ọkàn èèyàn fà sí ìṣekúṣe, kò sì lè jẹ́ kéèyàn sún mọ́ Ọlọ́run. Ìmọ̀ràn Bíbélì ni pé: “Ẹ sọ àwọn ẹ̀yà ara yín di òkú . . . ní ti àgbèrè [àti] ìdálọ́rùn fún ìbálòpọ̀ takọtabo.” (Kólósè 3:5) Àwọn tó ń wo àwọn ohun tó ń mú ọkàn fà sí ìṣekúṣe kò tẹ̀ lé ìmọ̀ràn yìí, ṣe ni wọ́n túbọ̀ ń mú ara wọn gbóná.",https://www.jw.org/yo,,,,,,,,,,,,,,,,,,,,,,,,,,,,,,,,,,,,,,,,,,,,,,,,,,,,
,ìṣekúṣe ,inappropriate actions,sex,Sexual Activity,1,Báwo lo ṣe lè jáwọ́ nínú wíwo ohun tó ń mú ọkàn fà sí ìṣekúṣe?,https://www.jw.org/yo,,,,,,,,,,,,,,,,,,,,,,,,,,,,,,,,,,,,,,,,,,,,,,,,,,,,
,ìṣekúṣe ,inappropriate actions,sex,Sexual Activity,1,"Àwọn kan tó ń ṣèwádìí sọ pé téèyàn bá ń wo àwọn ohun tó ń mú ọkàn fà sí ìṣekúṣe, kò túmọ̀ sí pé ó máa ṣe ìṣekúṣe. Àmọ́, ṣé inú Ọlọ́run dùn sí wíwo àwọn ohun tó ń mú ọkàn fà sí ìṣekúṣe?",https://www.jw.org/yo,,,,,,,,,,,,,,,,,,,,,,,,,,,,,,,,,,,,,,,,,,,,,,,,,,,,
,ìṣekúṣe ,inappropriate actions,sex,Sexual Activity,1,"Bíbélì sọ pé “ìṣẹ̀fẹ̀ rírùn” wà lára àwọn ohun tí inú Ọlọ́run kò dùn sí. (Éfésù 5:3, 4) Torí náà, àwọn ohun tó ń mú ọkàn fà sí ìṣekúṣe kò lè mú inú Ọlọ́run dùn. Lóde òní, lára àwọn ohun tó ń mú ọkàn fà sí ìṣekúṣe ni àwọn fídíò tó ń gbé àwòrán àwọn tó ń ṣe panṣágà jáde àti àwòrán àwọn ọkùnrin méjì tàbí obìnrin méjì tó ń bára wọn lò pọ̀, títí kan oríṣiríṣi ìwà ìṣekúṣe míì. Ó dájú pé téèyàn bá ń wo irú àwọn ìṣekúṣe bẹ́ẹ̀, ó burú jáì lójú Ọlọ́run ju ìṣẹ̀fẹ̀ rírùn lọ pàápàá.",https://www.jw.org/yo,,,,,,,,,,,,,,,,,,,,,,,,,,,,,,,,,,,,,,,,,,,,,,,,,,,,
,ìṣekúṣe ,inappropriate actions,sex,Sexual Activity,1,"Bíbélì sọ pé nígbà kan, àwọn kan wà tí ìṣekúṣe ti jàrábà, àwọn míì jẹ́ ọ̀mùtípara, àwọn míì sì ń jalè; àmọ́ wọ́n jáwọ́ nínú ìwàkíwà yìí. (1 Kọ́ríńtì 6:9-11) Báwo ni wọ́n ṣe ṣe é? Ìmọ̀ràn Bíbélì ni wọ́n tẹ̀ lé tí wọ́n fi lè kórìíra ohun búburú.",https://www.jw.org/yo,,,,,,,,,,,,,,,,,,,,,,,,,,,,,,,,,,,,,,,,,,,,,,,,,,,,
,ìṣekúṣe ,inappropriate actions,sex,Sexual Activity,1,"Téèyàn bá ń ro ìgbẹ̀yìn ọ̀rọ̀, ìyẹn ohun tó lè jẹyọ nídìí wíwo ohun tó ń mú ọkàn fà sí ìṣekúṣe, á rọrùn fún un láti kórìíra ìwàkíwà yìí. Ìwádìí kan tí wọ́n gbé jáde láìpẹ́ yìí ní Ilé Ẹ̀kọ́ Yunifásítì kan lórílẹ̀-èdè Amẹ́ríkà fi hàn pé àwọn kan tí wọ́n máa ń wo àwòrán ìṣekúṣe “máa ń ní ẹ̀dùn ọkàn, wọ́n máa ń fẹ́ dá wà, àjọṣe wọn pẹ̀lú àwọn ẹlòmíì kì í gún régé,” ọ̀pọ̀ nǹkan ìbànújẹ́ míì sì máa ń ṣẹlẹ̀ sí wọn. Bá a sì ti sọ ṣáájú pé wíwo ohun tó ń mú ọkàn fà sí ìṣekúṣe kì í mú inú Ọlọ́run dùn, ó tún máa ń fa aburú tó jù bẹ́ẹ̀ lọ. Kì í jẹ́ kéèyàn lè sún mọ́ Ọlọ́run.",https://www.jw.org/yo,,,,,,,,,,,,,,,,,,,,,,,,,,,,,,,,,,,,,,,,,,,,,,,,,,,,
,ìṣekúṣe ,inappropriate actions,sex,Sexual Activity,1,"Bíbélì jẹ́ ká mọ bá a ṣe lè fẹ́ràn àwọn ohun tó dáa. Bá a bá ṣe tẹra mọ́ Bíbélì kíkà tó, bẹ́ẹ̀ náà ni ìfẹ́ tá a ní fún ìlànà ìwà rere Ọlọ́run ṣe máa jinlẹ̀ tó. Ìfẹ́ yẹn ló máa jẹ́ ká lè kórìíra àwọn ohun tó ń mú ọkàn fà sí ìṣekúṣe, ká sì lè ronú bíi ti onísáàmù tó sọ pé: “Èmi kì yóò gbé ohun tí kò dára fún ohunkóhun ka iwájú mi.”—Sáàmù 101:3.",https://www.jw.org/yo,,,,,,,,,,,,,,,,,,,,,,,,,,,,,,,,,,,,,,,,,,,,,,,,,,,,
,ìṣekúṣe ,inappropriate actions,sex,Sexual Activity,1,Kí Ni Bíbélì Sọ Nípa Àwòrán Oníhòòhò? Ǹjẹ́ Ó Burú Láti Fi Ohun Tó Ń Mú Ọkàn Fà Sí Ìṣekúṣe Ránṣẹ́ Lórí Íńtánẹ́ẹ̀tì?,https://www.jw.org/yo,,,,,,,,,,,,,,,,,,,,,,,,,,,,,,,,,,,,,,,,,,,,,,,,,,,,
,ìṣekúṣe ,inappropriate actions,sex,Sexual Activity,1,"“Olúkúlùkù ẹni tí ń bá a nìṣó ní wíwo obìnrin kan láti ní ìfẹ́ onígbòónára sí i, ti ṣe panṣágà pẹ̀lú rẹ̀ ná nínú ọkàn-àyà rẹ̀.” (Mátíù 5:28) Wíwo àwọn àwòrán ìṣekúṣe lè mú kéèyàn máa ro èròkerò tó lè sún un ṣe àwọn ohun tí kò tọ́.",https://www.jw.org/yo,,,,,,,,,,,,,,,,,,,,,,,,,,,,,,,,,,,,,,,,,,,,,,,,,,,,
,ìṣekúṣe ,inappropriate actions,sex,Sexual Activity,1,"“Kí a má tilẹ̀ mẹ́nu kan àgbèrè àti ìwà àìmọ́ onírúurú gbogbo tàbí ìwà ìwọra láàárín yín.” (Éfésù 5:3) Kò tiẹ̀ yẹ ká máa fi ọ̀rọ̀ ìṣekúṣe ṣàwàdà, ká má ṣẹ̀ṣẹ̀ sọ ti pé ká wò ó tàbí kà nípa rẹ̀.",https://www.jw.org/yo,,,,,,,,,,,,,,,,,,,,,,,,,,,,,,,,,,,,,,,,,,,,,,,,,,,,
,ìṣekúṣe ,inappropriate actions,sex,Sexual Activity,1,Kí Ló Yẹ Kí N Mọ̀ Nípa Fífi Ohun Tó Ń Mọ́kàn Fà sí Ìṣekúṣe Ránṣẹ́ Lórí Fóònù?,https://www.jw.org/yo,,,,,,,,,,,,,,,,,,,,,,,,,,,,,,,,,,,,,,,,,,,,,,,,,,,,
,ìṣekúṣe ,inappropriate actions,sex,Sexual Activity,1,"“Àwọn iṣẹ́ ti ara fara hàn kedere, àwọn sì ni àgbèrè, ìwà àìmọ́, . . . àti nǹkan báwọ̀nyí. Ní ti nǹkan wọ̀nyí ni èmi ń kìlọ̀ ṣáájú fún yín, lọ́nà kan náà gẹ́gẹ́ bí mo ti kìlọ̀ ṣáájú fún yín, pé àwọn tí ń fi irúfẹ́ nǹkan báwọ̀nyí ṣe ìwà hù kì yóò jogún ìjọba Ọlọ́run.” (Gálátíà 5:19-​21) Lójú Ọlọ́run, ìwà àìmọ́ ni àwọn tó bá ń wo àwòrán oníhòòhò, tó ń sọ̀rọ̀ ìbálòpọ̀ lórí fóònù tàbí tó ń fi ohun tó ń mú ọkàn fà sí ìṣekúṣe ránṣẹ́ lórí fóònù tàbí íńtánẹ́ẹ̀tì ń hù. Tí a bá sọ àwọn ìwà yìí dàṣà, a kò ní rí ojúure Ọlọ́run mọ́.",https://www.jw.org/yo,,,,,,,,,,,,,,,,,,,,,,,,,,,,,,,,,,,,,,,,,,,,,,,,,,,,
,ìṣekúṣe ,inappropriate actions,sex,Sexual Activity,1,"Kò síbì tí Bíbélì ti dìídì sọ̀rọ̀ nípa àwòrán oníhòòhò, fífi ohun tó ń mú ọkàn fà sí ìṣekúṣe ránṣẹ́ lórí íńtánẹ́ẹ̀tì tàbí àwọn àṣà míì tó jọ ọ́. Síbẹ̀, ohun tí Bíbélì sọ ṣe kedere nípa ojú tí Ọlọ́run fi ń wo bí àwọn èèyàn ṣe ń gbé ìbálòpọ̀ láàárín àwọn tí kì í ṣe tọkọtaya lárugẹ àti èrò tí kò tọ́ tí wọ́n ní nípa ìbálòpọ̀. Gbé àwọn ẹsẹ Bíbélì wọ̀nyí yẹ̀wò:",https://www.jw.org/yo,,,,,,,,,,,,,,,,,,,,,,,,,,,,,,,,,,,,,,,,,,,,,,,,,,,,
,ìṣekúṣe ,inappropriate actions,sex,Sexual Activity,1,Àwọn èèyàn máa ń fi ohun tó ń mọ́kàn fà sí ìṣekúṣe ránṣẹ́ sáwọn míì látorí fóònù wọn. ,https://www.jw.org/yo,,,,,,,,,,,,,,,,,,,,,,,,,,,,,,,,,,,,,,,,,,,,,,,,,,,,
,ìṣekúṣe ,inappropriate actions,sex,Sexual Activity,1,Fífi ohun tó ń mú ọkàn fà sí ìṣekúṣe ránṣẹ́ lórí Íńtánẹ́ẹ̀tì: Fífi àwọn ọ̀rọ̀ ìṣekúṣe ránṣẹ́ tàbí kéèyàn máa sọ̀rọ̀ ìṣekúṣe lórí Íńtánẹ́ẹ̀tì torí kó lè ru ìfẹ́ ìbálòpọ̀ sókè.,https://www.jw.org/yo,,,,,,,,,,,,,,,,,,,,,,,,,,,,,,,,,,,,,,,,,,,,,,,,,,,,
,ìṣekúṣe ,inappropriate actions,sex,Sexual Activity,1,"Lára ohun tí wọ́n máa ń fi ránṣẹ́ ni àtẹ̀jíṣẹ́, fọ́tò tàbí fídíò tó dá lórí ọ̀rọ̀ ìṣekúṣe.",https://www.jw.org/yo,,,,,,,,,,,,,,,,,,,,,,,,,,,,,,,,,,,,,,,,,,,,,,,,,,,,
,ìṣekúṣe ,inappropriate actions,sex,Sexual Activity,1,Sísọ̀rọ̀ ìbálòpọ̀ lórí fóònù: Kí èèyàn máa sọ̀rọ̀ ìbálòpọ̀ lórí fóònù tàbí kéèyàn máa tẹ́tí sí àwọn ohun tó ń gbé ìṣekúṣe lárugẹ.,https://www.jw.org/yo,,,,,,,,,,,,,,,,,,,,,,,,,,,,,,,,,,,,,,,,,,,,,,,,,,,,
,ìṣekúṣe ,inappropriate actions,sex,Sexual Activity,1,"Ọkùnrin kan sọ pé, “Ohun tó lòde báyìí nìyẹn. Tíwọ àti ẹnì kan bá ti bẹ̀rẹ̀ sí í fọ̀rọ̀ ránṣẹ́ síra yín, ká tó ṣẹ́jú pẹ́, ẹ̀ẹ́ bẹ̀rẹ̀ sí í fi oríṣiríṣi fọ́tò táá máa mọ́kàn yín fà sí ìṣekúṣe ránṣẹ́ síra yín.”",https://www.jw.org/yo,,,,,,,,,,,,,,,,,,,,,,,,,,,,,,,,,,,,,,,,,,,,,,,,,,,,
,ìṣekúṣe ,inappropriate actions,sex,Sexual Activity,1,Fífi ohun tó ń mú ọkàn fà sí ìṣekúṣe ránṣẹ́ lórí fóònù: Fífi àwọn àwòrán ìbálòpọ̀ tàbí kìkìdá ọ̀rọ̀ ìṣekúṣe ránṣẹ́ láti orí fóònù.,https://www.jw.org/yo,,,,,,,,,,,,,,,,,,,,,,,,,,,,,,,,,,,,,,,,,,,,,,,,,,,,
,ìṣekúṣe ,inappropriate actions,sex,Sexual Activity,1,"Kí ló máa ń mú káwọn èèyàn ṣe bẹ́ẹ̀? Ọ̀gá àgbà kan lẹ́nu iṣẹ́ agbẹjọ́rò sọ nínú ìwé ìròyìn The New York Times pé: “Tó o bá ti lè ní fọ́tò ìhòòhò ẹni tẹ́ ẹ jọ ń fẹ́ra yín sórí fóònù ẹ, ṣe lò ń fìyẹn sọ fáwọn èèyàn pé o ò kẹ̀rẹ̀ tó bá dọ̀rọ̀ ìbálòpọ̀. Téèyàn bá ń firú ẹ̀ ránṣẹ́ sẹ́nì kan, bí ẹni ní ìbálòpọ̀ láìfara kanra ló rí.” Ohun tó sì máa ń mú káwọn ọ̀dọ́ kan fi ohun tó ń mọ́kàn ẹni fà sí ìṣekúṣe ránṣẹ́ lórí fóònù nìyẹn. Ọ̀dọ́bìnrin kan tiẹ̀ sọ pé ó jẹ́ “ọ̀nà téèyàn ń gbà ní ìbálòpọ̀ láìfi ẹ̀mí ara ẹ̀ wewu.” Ó ní, “téèyàn bá ń ṣe irú ẹ̀, kò kúkú lè tibẹ̀ lóyún, kò sì lè kó àrùn táwọn èèyàn máa ń tibi ìbálòpọ̀ kó.”",https://www.jw.org/yo,,,,,,,,,,,,,,,,,,,,,,,,,,,,,,,,,,,,,,,,,,,,,,,,,,,,
,ìṣekúṣe ,inappropriate actions,sex,Sexual Activity,1,"Torí pé ẹnì kan ti fi fọ́tò tó ń mọ́kàn ẹni fà sí ìṣekúṣe ránṣẹ́ sí wọn, àwọn náà wá wò ó pé àfi káwọn náà firú ẹ̀ ránṣẹ́ sí onítọ̀hún.’",https://www.jw.org/yo,,,,,,,,,,,,,,,,,,,,,,,,,,,,,,,,,,,,,,,,,,,,,,,,,,,,
,ìṣekúṣe ,inappropriate actions,sex,Sexual Activity,1,Àwọn ohun míì tó máa ń mú káwọn ọ̀dọ́ fi ohun tó ń mọ́kàn ẹni fà sí ìṣekúṣe ránṣẹ́ lórí fóònù rèé:Kí wọ́n lè máa bá ẹni tó wù wọ́n kí wọ́n jọ máa fẹ́ra tage.,https://www.jw.org/yo,,,,,,,,,,,,,,,,,,,,,,,,,,,,,,,,,,,,,,,,,,,,,,,,,,,,
,ìṣekúṣe ,inappropriate actions,sex,Sexual Activity,1,"Tó o bá ti lè fi fọ́tò kan ránṣẹ́ lórí fóònù, ó ti kúrò ní tìẹ nìkan, torí tó bá ti tẹ àwọn míì lọ́wọ́, ohun tó bá wù wọ́n ni wọ́n lè fi ṣe. Wọ́n tiẹ̀ lè fi bà ẹ́ lórúkọ jẹ́. Amanda Lenhart, tó jẹ́ olùṣèwádìí àgbà, sọ̀rọ̀ lórí fífi ohun tó ń mọ́kàn ẹni fà sí ìṣekúṣe ránṣẹ́ lórí fóònù, iléeṣẹ́ Pew Research Center wá gbé jáde ohun tó sọ jáde. Ó ní: “Ó ti wá rọrùn gan-an báyìí kí gbogbo ayé rí ohun tí kò tọ́ téèyàn fi ránṣẹ́ látorí fóònù, ì báà jẹ́ pé ṣe lonítọ̀hún ṣèèṣì ṣe nǹkan ọ̀hún.”",https://www.jw.org/yo,,,,,,,,,,,,,,,,,,,,,,,,,,,,,,,,,,,,,,,,,,,,,,,,,,,,
,ìṣekúṣe ,inappropriate actions,sex,Sexual Activity,1,"ṢÓ O MỌ̀ PÉ lọ́pọ̀ ìgbà, tẹ́nì kan bá fi àwọn fọ́tò ìhòòhò ẹlòmíì ránṣẹ́ sáwọn èèyàn lórí fóònù, wọ́n lè fẹ̀sùn kàn án pé ó bọ́mọdé ṣèṣekúṣe àbí pé ó ń pín àwòrán ìhòòhò ọmọdé, èyí tó ta ko òfin? Kódà, ọwọ́ òfin ti tẹ àwọn ọ̀dọ́ kan tó fi ohun tó ń mọ́kàn ẹni fà sí ìṣekúṣe ránṣẹ́ lórí fóònù.",https://www.jw.org/yo,,,,,,,,,,,,,,,,,,,,,,,,,,,,,,,,,,,,,,,,,,,,,,,,,,,,
,ìṣekúṣe ,inappropriate actions,sex,Sexual Activity,1,Àwọn ẹsẹ Bíbélì tó tẹ̀ lé e yìí tiẹ̀ tún jẹ́ ká rí ìdí tó fi pọn dandan kéèyàn má ṣe fi ohun tó ń mọ́kàn ẹni fà sí ìṣekúṣe ránṣẹ́ sáwọn míì.,https://www.jw.org/yo,,,,,,,,,,,,,,,,,,,,,,,,,,,,,,,,,,,,,,,,,,,,,,,,,,,,
,ìṣekúṣe ,inappropriate actions,sex,Sexual Activity,1,"Òótọ́ kan ni pé: Téèyàn bá fi ohun tó ń mọ́kàn ẹni fà sí ìṣekúṣe ránṣẹ́ sí ẹlòmíì, àwọn méjèèjì ló máa ń ṣàkóbá fún, ẹ̀tẹ́ ló sì máa ń gbẹ̀yìn ẹ̀. Ọ̀dọ́bìnrin kan tí ọ̀rẹ́kùnrin ẹ̀ fi dandan mú un pé kó fi fọ́tò ìhòòhò ara ẹ̀ ránṣẹ́ sóun sọ pé: “Ohun tó ṣẹlẹ̀ dójú tì mí gan-an, inú mi ò sì dùn síra mi rárá.”",https://www.jw.org/yo,,,,,,,,,,,,,,,,,,,,,,,,,,,,,,,,,,,,,,,,,,,,,,,,,,,,
,ìṣekúṣe ,inappropriate actions,sex,Sexual Activity,1,"Ní báyìí tó o ti rí ohun tó máa tẹ̀yìn ẹ̀ yọ téèyàn bá ń fi ohun tó ń mọ́kàn ẹni fà sí ìṣekúṣe ránṣẹ́ lórí fóònù, ìyẹn bó ṣe máa nípa lórí ìwọ àtàwọn míì àti ohun tó lè ṣẹlẹ̀ tọ́wọ́ òfin bá tẹ̀ ẹ́, á dáa kó o tẹ̀ lé ìmọ̀ràn Bíbélì yìí:",https://www.jw.org/yo,,,,,,,,,,,,,,,,,,,,,,,,,,,,,,,,,,,,,,,,,,,,,,,,,,,,
,ìṣekúṣe ,inappropriate actions,sex,Sexual Activity,1,Ko da ki omoluabi ma sesekuse kiri. Ko ye ki o ma ba iyawo oniyawo sun.,iyanu,,,,,,,,,,,,,,,,,,,,,,,,,,,,,,,,,,,,,,,,,,,,,,,,,,,,
