,Euphemisms,literal translation,euphemistic meanings,category,Rating,text,source,,always eup,,,,,,,,,,,,,,,,,,,,,,,,,,,,,,,,,,,,,,,,,,,,,,,,,,
,jáde láyé,left the earth,death,death,1, Omojola jade laye leyin to kopa ninu eto ipade apero l''Akure ,http://www.alaroyeonline.com/searchi.php,,,,,,,,,,,,,,,,,,,,,,,,,,,,,,,,,,,,,,,,,,,,,,,,,,,,
,jáde láyé,left the earth,death,death,1," Aare egbe Musulumi nile Yoruba, Sheik Ajisafe jade laye ",http://www.alaroyeonline.com/searchi.php,,,,,,,,,,,,,,,,,,,,,,,,,,,,,,,,,,,,,,,,,,,,,,,,,,,,
,jáde láyé,left the earth,death,death,1," Kinni kan to je kayeefi ninu oro e ni pe ojo keta ti won bi i saye niya e atawon ti won sun mo on ti n pe e ni Iyalode, oruko yii gan-an ni pupo ninu awon ore mama e n pe e ko too di pe won jade laye . ",http://www.esinislam.com/MediaYoruba/modules.php?name=News&file=article&sid=878&mode=thread&order=0&thold=0,,,,,,,,,,,,,,,,,,,,,,,,,,,,,,,,,,,,,,,,,,,,,,,,,,,,
,jáde láyé,left the earth,death,death,1," Iye odun teeyan n lo nipo Gege bawon ti won ti je saaju mi, ko soro pe won gbodo wa nibe fun iye odun kan, titi teeyan yen yoo fi jade laye ni, afi bi onitohun ba siwahu nikan lo le mu kawon eeyan kowe ehonu nipa e sawon to ye ki won gbo si i. Nidii eyi, eni to wa lori akaba, ko ranti pe oun nikan ko loun ni in, gbogbo eeyan ni. ",http://www.esinislam.com/MediaYoruba/modules.php?name=News&file=article&sid=878&mode=thread&order=0&thold=0,,,,,,,,,,,,,,,,,,,,,,,,,,,,,,,,,,,,,,,,,,,,,,,,,,,,
,jáde láyé,left the earth,death,death,1,Mo gbo pe okunrin to wa lori ibusun aisan ti jade laye,,,,,,,,,,,,,,,,,,,,,,,,,,,,,,,,,,,,,,,,,,,,,,,,,,,,,
,jáde láyé,left the earth,death,death,1,"Ko si eyi ti o so pe ojise mimo ni omobirin mejila tabi omokunrin mokanla, Baba Anabi ku saaju ki ato bi Anabi, iya re si jade laye pelu nigba ti Anabi di omodun mefa",http://www.anti-el7ad.com/site/play-13182.html,,,,,,,,,,,,,,,,,,,,,,,,,,,,,,,,,,,,,,,,,,,,,,,,,,,,
,jáde láyé,left the earth,death,death,1,"Ọjọ Isẹgun, ọjọ kẹtala osu Kejila ọdun 2022 ni Yemi Adegunju jade laye, ti ọpọ awọn osere tiata lede Yoruba si ti n se idaro rẹ, paapaa lawọn oju opo ayelujara wọn. Loju opo Instagram rẹ, gbajugbaja osere tiata kan, Odunlade Adekola lo kọkọ kede oku oloogbe naa, to si ni ko sun re.",,,,,,,,,,,,,,,,,,,,,,,,,,,,,,,,,,,,,,,,,,,,,,,,,,,,,
53,bá sùn ,sleep with,sex,Sexual Activity,0,"Ara rẹ maa n sinmi lasiko ti o ba n sùn, ko si pe oun ronu ohunkohun, ọkan rẹ si le ronu oriṣiriṣi nipa ibalopọ.",https://www.bbc.com/yoruba/awon-iroyin-miran-45042521,,sometimes,,,,,,,,,,,,,,,,,,,,,,,,,,,,,,,,,,,,,,,,,,,,,,,,,,
,bá sùn ,sleep with,sex,Sexual Activity,1,"Ọsẹ to kọja ni aṣiri Pasitọ Oyebọla to ba ọmọ bibi inu ẹ sun fọdun marun-un tu saye nipinlẹ Ogun, pasitọ mi-in torukọ tiẹ n jẹ Oketokun Abiọdun lọwọ awọn ọlọpaa tun tẹ bayii l’Ọdẹda, ipinlẹ Ogun kan naa. Ọmọ ọdun mẹwaa pere loun ki mọlẹ...",Alaroye,,,,,,,,,,,,,,,,,,,,,,,,,,,,,,,,,,,,,,,,,,,,,,,,,,,,
,bá sùn ,sleep with,sex,Sexual Activity,0,"Omo tí ó bá ní kí ìyá òun má sùn, òun na oni foju korun ",yoruba proverb,,,,,,,,,,,,,,,,,,,,,,,,,,,,,,,,,,,,,,,,,,,,,,,,,,,,
,bá sùn ,sleep with,sex,Sexual Activity,0,A kii ri oju eni ti o ba ni sun  l'ona oko,,,,,,,,,,,,,,,,,,,,,,,,,,,,,,,,,,,,,,,,,,,,,,,,,,,,,
,bá sùn ,sleep with,sex,Sexual Activity,1,"Iya ọmọ naa ni ọmọdebinrin sọ fun oun pe ọkọ oun ti ba oun sun lati ọjọ kẹrinla oṣu kẹwaa, ti afurasi naa si n dunkoko pe oun yoo ṣekupa to ba sọ fun ẹnikẹni.""Kete ti iroyin de si agọ ileeṣẹ ọlọpaa ni Yewa ni wọn bẹrẹ iwadi ti ọwọ si ti tẹ ọkunrin afurasi naa""Nigba ti a bẹrẹ ifọrọwerọ pẹlu afurasi naa ni o jẹwọ pe otitọ nipe oun ṣe amọ isẹ eṣu ni",https://www.bbc.com/yoruba/articles/cxx0ld23141o,,,,,,,,,,,,,,,,,,,,,,,,,,,,,,,,,,,,,,,,,,,,,,,,,,,,
,bá sùn ,sleep with,sex,Sexual Activity,1,"Ọwọ Ileeṣẹ ọlọpaa ipinlẹ Ogun ti tẹ ọkunrin kan, Taofeek Sulaiman, ẹni ogoji ọdun lẹyin to fipa ba ọmọ iyawo rẹ, ọmọ ọdun mẹtala sun.",https://www.bbc.com/yoruba/articles/cxx0ld23141o,,,,,,,,,,,,,,,,,,,,,,,,,,,,,,,,,,,,,,,,,,,,,,,,,,,,
,bá sùn ,sleep with,sex,Sexual Activity,1,Taofeek ni èsù ló jẹ́ kí òun fipá bá ọmọ ìyàwó rè tó jẹ́ ẹni ọdún mẹ́tàlá sùn ní Ogun,https://www.bbc.com/yoruba/articles/cxx0ld23141o,,,,,,,,,,,,,,,,,,,,,,,,,,,,,,,,,,,,,,,,,,,,,,,,,,,,
,bá sùn ,sleep with,sex,Sexual Activity,1,"Iroyin naa sọ pe ilana fẹyin lelẹ ki n ba ọ sun, ko o ṣe ninu ere mi ni Adekola n lo.",https://www.bbc.com/yoruba/afrika-58507971,,,,,,,,,,,,,,,,,,,,,,,,,,,,,,,,,,,,,,,,,,,,,,,,,,,,
,bá sùn ,sleep with,sex,Sexual Activity,1,"Odunlade Adekola yarí, ó ní kí àwọn òṣèrébìnrin tí òun bá sùn yọjú síta",https://www.bbc.com/yoruba/afrika-58507971,,,,,,,,,,,,,,,,,,,,,,,,,,,,,,,,,,,,,,,,,,,,,,,,,,,,
,bá sùn ,sleep with,sex,Sexual Activity,0,Oníbárà tí a bá mú lẹ́sẹ̀ títì yóò sùn ẹ̀wọ̀n- ìjọba Ìpínlẹ̀ Kwara,https://www.bbc.com/yoruba/afrika-60081423,,,,,,,,,,,,,,,,,,,,,,,,,,,,,,,,,,,,,,,,,,,,,,,,,,,,
,bá sùn ,sleep with,sex,Sexual Activity,1,Olólùfẹ́ méjì lẹ̀pọ̀ lásìkò tí wọ́n n bá ara wọn sùn nínú adágún odò,https://www.bbc.com/yoruba/58469139,,,,,,,,,,,,,,,,,,,,,,,,,,,,,,,,,,,,,,,,,,,,,,,,,,,,
,bá sùn ,sleep with,sex,Sexual Activity,1,Ní kia la gbe ọmọbìnrin naa lọ sí ile iwosan General Oja Odan níbi awọn dokita ti fi idi rẹ mulẹ pe otitọ ni pe babalawo fi tipatipa ba sun,https://www.bbc.com/yoruba/articles/cjl51830ex3o,,,,,,,,,,,,,,,,,,,,,,,,,,,,,,,,,,,,,,,,,,,,,,,,,,,,
,bá sùn ,sleep with,sex,Sexual Activity,1,Nigba ti a bẹrẹ iforowero ni ọkan lara awọn ọmọbìnrin to jẹ ọmọ ọdun mẹtadinlogun jẹwọ pe babalawo naa ti ba oun sun nigba ti awọn lọ ṣe iwadi lori ẹgbẹrun kan to sọnu.,https://www.bbc.com/yoruba/articles/cjl51830ex3o,,,,,,,,,,,,,,,,,,,,,,,,,,,,,,,,,,,,,,,,,,,,,,,,,,,,
,bá sùn ,sleep with,sex,Sexual Activity,1,"Arabinrin naa ni lẹyin ti ẹni akọkọ ati ẹni kejì wọlé, tí o si kan oun ni Babalawo fẹ fi tipatipa ba sun.",https://www.bbc.com/yoruba/articles/cjl51830ex3o,,,,,,,,,,,,,,,,,,,,,,,,,,,,,,,,,,,,,,,,,,,,,,,,,,,,
,bá sùn ,sleep with,sex,Sexual Activity,1,Ọwọ Ọlọ́pàá tẹ Oníṣègùn tó fipá bá òníbárà rẹ́ sún,https://www.bbc.com/yoruba/articles/cjl51830ex3o,,,,,,,,,,,,,,,,,,,,,,,,,,,,,,,,,,,,,,,,,,,,,,,,,,,,
,bá sùn ,sleep with,sex,Sexual Activity,0,Tí ó kó bá sùn ni àárín aago yìí... Ò ń ṣe àkóbá fún ìlera ọkàn rẹ,https://www.bbc.com/yoruba/afrika-59231125,,,,,,,,,,,,,,,,,,,,,,,,,,,,,,,,,,,,,,,,,,,,,,,,,,,,
,bá sùn ,sleep with,sex,Sexual Activity,0,Àwọn ónímọ̀ sọpé tí ènìyàn bá sùn láàrin aago Mẹ́wàá sì aago mọ́kànlá lọ dára fún ọkàn. Wọ́n fẹnukò lórí àbájáde yìí lẹ́yìn tí wọ́n lo ènìyàn ẹgbẹ̀rún lọ́nà méjìdinlaadọ́run tí wọ́n fi ara wọn sílẹ̀.,https://www.bbc.com/yoruba/afrika-59231125,,,,,,,,,,,,,,,,,,,,,,,,,,,,,,,,,,,,,,,,,,,,,,,,,,,,
,bá sùn ,sleep with,sex,Sexual Activity,0,Àwọn ìgbìmọ̀ to wà lẹ́yìn ìwádìí Bionbank tí wọ́n ṣe ni UK yìí nìgbàgbọ́ pé bí ènìyàn bá sùn gẹ́gẹ́ bí aago àgọ́ ara ènìyàn máa ṣèrànwọ́ láti mọ ìbáṣepọ̀ tó wà láàárín bí ó ṣe lè mú àdínkù bá ààrùn ọkàn àti súròkí.,https://www.bbc.com/yoruba/afrika-59231125,,,,,,,,,,,,,,,,,,,,,,,,,,,,,,,,,,,,,,,,,,,,,,,,,,,,
,bá sùn ,sleep with,sex,Sexual Activity,0,Bi mo ba sun bi mo ba ji iwo lolorun mi o o o ,Tope Alabi's song,,,,,,,,,,,,,,,,,,,,,,,,,,,,,,,,,,,,,,,,,,,,,,,,,,,,
,bá sùn ,sleep with,sex,Sexual Activity,1,"Labe Ofin Mose, ti okunrin kan ba fipa ba odobinrin to ti ni afesona lopo ni “inu oko” ti ... ó sì ṣàgbèrè, torí pé ṣe ló “fi agbára mú un, tó sì bá a sùn.",https://www.jw.org/yo,,,,,,,,,,,,,,,,,,,,,,,,,,,,,,,,,,,,,,,,,,,,,,,,,,,,
,bá sùn ,sleep with,sex,Sexual Activity,1,"Òfin náà wá sọ̀rọ̀ nípa nǹkan míì tó lè ṣẹlẹ̀, ó ní: “Àmọ́ tó bá jẹ́ inú oko ni ọkùnrin náà ká obìnrin tó ní àfẹ́sọ́nà yẹn mọ́, tí ọkùnrin náà sì fi agbára mú un, tó sì bá a sùn, ọkùnrin tó bá a sùn yẹn nìkan ni kí ẹ pa, àmọ́ ẹ ò gbọ́dọ̀ ṣe ohunkóhun fún obìnrin náà. Obìnrin náà kò dá ẹ̀ṣẹ̀ tó gba pé kí ẹ pa á. Ṣe ni ọ̀rọ̀ yìí dà bíi ti ọkùnrin kan tó lu ẹnì kejì rẹ̀, tó sì pa á. Torí pé inú oko ló ká obìnrin náà mọ́, obìnrin tó ti ní àfẹ́sọ́nà yẹn sì kígbe, àmọ́ kò sẹ́ni tó lè gbà á sílẹ̀.”​—Diu. 22:​25-27.",jw Diu. 22:​25-27.,,,,,,,,,,,,,,,,,,,,,,,,,,,,,,,,,,,,,,,,,,,,,,,,,,,,
,bá sùn ,sleep with,sex,Sexual Activity,1,"Won ni bi ile ojo keji se mo lo le awon omo aburo e to ba sun moju naa sita, o ni eyi ti won se nile oun to, ki woôn gba ile iya won lo. ",http://www.alaroyeonline.com/articles_image/8812.pdf,,,,,,,,,,,,,,,,,,,,,,,,,,,,,,,,,,,,,,,,,,,,,,,,,,,,
,bá sùn ,sleep with,sex,Sexual Activity,0,"gbogbo awon ti won ba sun mo on naa n se, Akintoôla ko jo won loju rara. ",http://www.alaroyeonline.com/articles_image/8860.pdf,,,,,,,,,,,,,,,,,,,,,,,,,,,,,,,,,,,,,,,,,,,,,,,,,,,,
,bá sùn ,sleep with,sex,Sexual Activity,1,"Eyi toleju nipe nkan omokunrin mi to manro ti mo ba sun pelu iyawo mi, oti san bayi lehin ti mo lo ogun yin. ",http://www.anti-el7ad.com/site/play-13184.html,,,,,,,,,,,,,,,,,,,,,,,,,,,,,,,,,,,,,,,,,,,,,,,,,,,,
,bá sùn ,sleep with,sex,Sexual Activity,0,"Abbe ni ona meta ni eto naa, akoko ni ki awon ajagun ta naa gba aabo ti ijoba fe se, eekeji, ki won lo ko nnkan ija oloro owo won sile ni agbegbe ti won ya soto ti o ba sun mo won, iketa ni siso won domo. ",http://okikinewspapers.blogspot.cz/,,,,,,,,,,,,,,,,,,,,,,,,,,,,,,,,,,,,,,,,,,,,,,,,,,,,
,bá sùn ,sleep with,sex,Sexual Activity,0,"Ti ero iwe iroyin yii ba jo ti gbogbo onkawe yii patapata, e ni ti o ba sun mo awon ijoba, ki o so fun won ki won si n mi edo. ",http://okikinewspapers.blogspot.cz/2009_05_01_archive.html,,,,,,,,,,,,,,,,,,,,,,,,,,,,,,,,,,,,,,,,,,,,,,,,,,,,
,bá sùn ,sleep with,sex,Sexual Activity,1,Omo odun mejo kan toruko e n je Toyin ni Ogbeni Kamoru to je aro fipa ba sun ... ,http://www.alaroyeonline.com/searchi.php,,,,,,,,,,,,,,,,,,,,,,,,,,,,,,,,,,,,,,,,,,,,,,,,,,,,
,bá sùn ,sleep with,sex,Sexual Activity,1,Iyawo Ni Gbogbo Omo Ijo Ni Pasito Ti Fee Ba Sun Tan ,http://www.esinislam.com/MediaYoruba/modules.php?name=News&file=article&sid=132,,,,,,,,,,,,,,,,,,,,,,,,,,,,,,,,,,,,,,,,,,,,,,,,,,,,
,bá sùn ,sleep with,sex,Sexual Activity,0,"Nitori na nigba ti elomiran ba sun loru to dede ba ara e larin awon Ajoji loju ala tabi ki okunrin ma ba obinrin lasepo tabi obinrin ba okunrin lajo sepo to ba je wipe iru awon eni be yen ba nwo oju Olorun fun omo bibi, bi awon onitohun yen o ba sora gidigidi o ma soro fun iru awon eniyan be lati ri omo bi laye won. ",http://www.akedeoduduwaonline.com/asa.html,,,,,,,,,,,,,,,,,,,,,,,,,,,,,,,,,,,,,,,,,,,,,,,,,,,,
,bá sùn ,sleep with,sex,Sexual Activity,1,"Lati le dena bi won se n lo awon omo nilokulo, paapaa awon omo obinrin tojo ori won kere ti won maa n fipa ba sun , ... ",http://www.alaroyeonline.com/searchi.php,,,,,,,,,,,,,,,,,,,,,,,,,,,,,,,,,,,,,,,,,,,,,,,,,,,,
,bá sùn ,sleep with,sex,Sexual Activity,1,ohun è wò ni ki o̩ko̩ o̩lóko̩ máa bá aya aláya sùn,,,,,,,,,,,,,,,,,,,,,,,,,,,,,,,,,,,,,,,,,,,,,,,,,,,,,
,bá sùn ,sleep with,sex,Sexual Activity,1,"Wòlíì bá ọmọ ìyá méjì sùn nínú ìjọ rẹ̀, ọ̀kan níńú wọn ti lóyún",https://www.bbc.com/yoruba/articles/c1dgl50n455o,,,,,,,,,,,,,,,,,,,,,,,,,,,,,,,,,,,,,,,,,,,,,,,,,,,,
,bá sùn ,sleep with,sex,Sexual Activity,1,"Pẹ̀lú nǹkan tó ṣẹlẹ̀ yìí, àwọn adájọ́ gbà pé òótọ́ ni obìnrin náà sọ. Lọ́nà wo? Wọ́n gbà pé ó “kígbe, àmọ́ kò sẹ́ni tó lè gbà á sílẹ̀.” Torí náà, obìnrin náà ò ṣàgbèrè. Àmọ́ ọkùnrin yẹn máa jẹ̀bi pé ó fipá bá obìnrin tó ní àfẹ́sọ́nà lò pọ̀, ó sì ṣàgbèrè, torí pé ṣe ló “fi agbára mú un, tó sì bá a sùn.”",https://www.jw.org/yo,,,,,,,,,,,,,,,,,,,,,,,,,,,,,,,,,,,,,,,,,,,,,,,,,,,,
54,fọ́,break,sex,Sexual Activity,1,mo fomo yen pa,,i had sex with the girl,sometimes,,,,,,,,,,,,,,,,,,,,,,,,,,,,,,,,,,,,,,,,,,,,,,,,,,
,fọ́,break,sex,Sexual Activity,0,"ma beru o, ma lo ma fo",,,,,,,,,,,,,,,,,,,,,,,,,,,,,,,,,,,,,,,,,,,,,,,,,,,,,
,fọ́,break,sex,Sexual Activity,0,Awo ti mo sese ra ma ti fo,,,,,,,,,,,,,,,,,,,,,,,,,,,,,,,,,,,,,,,,,,,,,,,,,,,,,
,fọ́,break,sex,Sexual Activity,0,Gbogbo eyin ti fo,,,,,,,,,,,,,,,,,,,,,,,,,,,,,,,,,,,,,,,,,,,,,,,,,,,,,
,fọ́,break,sex,Sexual Activity,0,Igo ororo yen ti fo nigba ti tabili yen subu,,,,,,,,,,,,,,,,,,,,,,,,,,,,,,,,,,,,,,,,,,,,,,,,,,,,,
,fọ́,break,sex,Sexual Activity,1,bobo yen fo mi nigba ti a ba ra wa sun lale ana,,,,,,,,,,,,,,,,,,,,,,,,,,,,,,,,,,,,,,,,,,,,,,,,,,,,,
55,mọ́,to know,sex,Sexual Activity,0,Adamu sì mo ìyàwó re,Yoruba bible,,sometimes,,,,,,,,,,,,,,,,,,,,,,,,,,,,,,,,,,,,,,,,,,,,,,,,,,
,mọ́,to know,sex,Sexual Activity,0,ta lo mo e?,,who had sex or disvirgined you?,,,,,,,,,,,,,,,,,,,,,,,,,,,,,,,,,,,,,,,,,,,,,,,,,,,
,mọ́,to know,sex,Sexual Activity,0,"Se o mo mi ni, a jo losi CAC to wa lebute",,,,,,,,,,,,,,,,,,,,,,,,,,,,,,,,,,,,,,,,,,,,,,,,,,,,,
,mọ́,to know,sex,Sexual Activity,0,Baba yen mo mi nigba ti mo juwe ara mi fun won,,,,,,,,,,,,,,,,,,,,,,,,,,,,,,,,,,,,,,,,,,,,,,,,,,,,,
,mọ́,to know,sex,Sexual Activity,0,Mo mo ogbeni naa. O ma n ko wa ni St. James,,,,,,,,,,,,,,,,,,,,,,,,,,,,,,,,,,,,,,,,,,,,,,,,,,,,,
,mọ́,to know,sex,Sexual Activity,0,O dara ki okunrin mo ebi iyawo e,,,,,,,,,,,,,,,,,,,,,,,,,,,,,,,,,,,,,,,,,,,,,,,,,,,,,
,mọ́,to know,sex,Sexual Activity,1,Dafidi sì mo aya re,,,,,,,,,,,,,,,,,,,,,,,,,,,,,,,,,,,,,,,,,,,,,,,,,,,,,
,mọ́,to know,sex,Sexual Activity,0,Basira mo mi dele,,,,,,,,,,,,,,,,,,,,,,,,,,,,,,,,,,,,,,,,,,,,,,,,,,,,,
,mọ́,to know,sex,Sexual Activity,0,se bobo yen ti mo e koto di pe e ri ara yin?,,,,,,,,,,,,,,,,,,,,,,,,,,,,,,,,,,,,,,,,,,,,,,,,,,,,,
,mọ́,to know,sex,Sexual Activity,1,won ti mo ra won lale igbeyawo won,,they have had sex on their wedding night,,,,,,,,,,,,,,,,,,,,,,,,,,,,,,,,,,,,,,,,,,,,,,,,,,,
56,lò,use,sex,Sexual Activity,1,a ma lo rawa pa lale yi,,we will have sex tonight,sometimes,,,,,,,,,,,,,,,,,,,,,,,,,,,,,,,,,,,,,,,,,,,,,,,,,,
,lò,use,sex,Sexual Activity,1,o lò mi pupo,,he had sex with me too much,,,,,,,,,,,,,,,,,,,,,,,,,,,,,,,,,,,,,,,,,,,,,,,,,,,
,lò,use,sex,Sexual Activity,1,"Oju maa n ti awọn ọkunrin lati ro iru ẹjọ bẹ ẹ sita - wọn le fi ẹjọ iwa buruku iyawo wọn sun o, ṣugbọn wọn ko ni i sọ pe o n fi tabi fẹ ẹ fi ipa ba wọn lo pọ.",,,,,,,,,,,,,,,,,,,,,,,,,,,,,,,,,,,,,,,,,,,,,,,,,,,,,
,lò,use,sex,Sexual Activity,1,Ṣugbọn ti obinrin ba wa fi agidi mu ọkunrin lati ba a lo pọ nkọ?,,,,,,,,,,,,,,,,,,,,,,,,,,,,,,,,,,,,,,,,,,,,,,,,,,,,,
,lò,use,sex,Sexual Activity,0,Bose ya iwe mi lo ni o,,,,,,,,,,,,,,,,,,,,,,,,,,,,,,,,,,,,,,,,,,,,,,,,,,,,,
,lò,use,sex,Sexual Activity,0,Ta lo lo aso mi lana?,,,,,,,,,,,,,,,,,,,,,,,,,,,,,,,,,,,,,,,,,,,,,,,,,,,,,
,lò,use,sex,Sexual Activity,0,Bisi lo moto Taye nijeta,,,,,,,,,,,,,,,,,,,,,,,,,,,,,,,,,,,,,,,,,,,,,,,,,,,,,
,lò,use,sex,Sexual Activity,0,Mo lo bata to fun mi ,,,,,,,,,,,,,,,,,,,,,,,,,,,,,,,,,,,,,,,,,,,,,,,,,,,,,
,lò,use,sex,Sexual Activity,0,ma lo foonu mi fi sere,,,,,,,,,,,,,,,,,,,,,,,,,,,,,,,,,,,,,,,,,,,,,,,,,,,,,
,lò,use,sex,Sexual Activity,0,Kilode ti e fi n lo redio ti a sese ra?,,,,,,,,,,,,,,,,,,,,,,,,,,,,,,,,,,,,,,,,,,,,,,,,,,,,,
,lò,use,sex,Sexual Activity,0,Ba mi lo ose yen fi fo awon aso yen,,,,,,,,,,,,,,,,,,,,,,,,,,,,,,,,,,,,,,,,,,,,,,,,,,,,,
,lò,use,sex,Sexual Activity,0,Mo fe lo abo ati sibi e fi jeun,,,,,,,,,,,,,,,,,,,,,,,,,,,,,,,,,,,,,,,,,,,,,,,,,,,,,
,lò,use,sex,Sexual Activity,1,Bí ó bá ṣe obìnrin ló fi agídí mú ọ̀kùnrin bá a lò pọ̀ ńkọ́?,,,,,,,,,,,,,,,,,,,,,,,,,,,,,,,,,,,,,,,,,,,,,,,,,,,,,
57,pa,kill,sex,Sexual Activity,1,mo ma do e pa lale yi,,,sometimes,,,,,,,,,,,,,,,,,,,,,,,,,,,,,,,,,,,,,,,,,,,,,,,,,,
,pa,kill,sex,Sexual Activity,1,"Ara mi ti na, tani mo le do pa?",,,,,,,,,,,,,,,,,,,,,,,,,,,,,,,,,,,,,,,,,,,,,,,,,,,,,
,pa,kill,sex,Sexual Activity,1,Se lo kan n pariwo pe ki ma pa oun nigba ti a n sere ife,,,,,,,,,,,,,,,,,,,,,,,,,,,,,,,,,,,,,,,,,,,,,,,,,,,,,
,pa,kill,sex,Sexual Activity,1,Mo fe do obinrin kan pa lale yi,,,,,,,,,,,,,,,,,,,,,,,,,,,,,,,,,,,,,,,,,,,,,,,,,,,,,
,pa,kill,sex,Sexual Activity,1,Okunrin yen do mi pa,,,,,,,,,,,,,,,,,,,,,,,,,,,,,,,,,,,,,,,,,,,,,,,,,,,,,
,pa,kill,sex,Sexual Activity,0,A pa ejo yen nijeta,,,,,,,,,,,,,,,,,,,,,,,,,,,,,,,,,,,,,,,,,,,,,,,,,,,,,
,pa,kill,sex,Sexual Activity,0,Olopa pa Ogbeni George Floyd ni Minnesota,,,,,,,,,,,,,,,,,,,,,,,,,,,,,,,,,,,,,,,,,,,,,,,,,,,,,
,pa,kill,sex,Sexual Activity,0,Mo pa ayan yen ,,,,,,,,,,,,,,,,,,,,,,,,,,,,,,,,,,,,,,,,,,,,,,,,,,,,,
,pa,kill,sex,Sexual Activity,0,Bawo la se le pa awon efon ti won kii je ka rorun sun?,,,,,,,,,,,,,,,,,,,,,,,,,,,,,,,,,,,,,,,,,,,,,,,,,,,,,
,pa,kill,sex,Sexual Activity,0,O ye ki a pa maluu yen,,,,,,,,,,,,,,,,,,,,,,,,,,,,,,,,,,,,,,,,,,,,,,,,,,,,,
58,do ,punch or touch,sex,Sexual Activity,1,"Bí olókó nlá bá ń dó ni, gbíngbin làá gbin.",African Sexual Proverbs: Some Yoruba Examples - J. O. Ojoade,,sometimes,,,,,,,,,,,,,,,,,,,,,,,,,,,,,,,,,,,,,,,,,,,,,,,,,,
,do ,punch or touch,sex,Sexual Activity,1,sho fe do mi ni,,,,,,,,,,,,,,,,,,,,,,,,,,,,,,,,,,,,,,,,,,,,,,,,,,,,,
,do ,punch or touch,sex,Sexual Activity,1,Mélòó ni a máa dó l’óbò tí a fi máa máa gbà’dúrà pé kí ilẹ má mọ?,,,,,,,,,,,,,,,,,,,,,,,,,,,,,,,,,,,,,,,,,,,,,,,,,,,,,
,do ,punch or touch,sex,Sexual Activity,1,"Àti pé, bí olókó nlá bá ń dó ni, gbíngbin làá gbin.",https://english.fullerton.edu/publications/clnArchives/pdf/fakoya_a.pdf,,,,,,,,,,,,,,,,,,,,,,,,,,,,,,,,,,,,,,,,,,,,,,,,,,,,
,do ,punch or touch,sex,Sexual Activity,1,"Àwọn àgbà ní, ẹni t’ó d’óbò lẹẹkan t’ó jùú l’ẹsẹ, okó rẹ á tún le. ",,,,,,,,,,,,,,,,,,,,,,,,,,,,,,,,,,,,,,,,,,,,,,,,,,,,,
,do ,punch or touch,sex,Sexual Activity,1,"Ado re tan, wo ji o kun okoko, se o fe gbe mi ni? ",Postproverbial Constructions and Selected Sex-Related Yoruba Proverbs/ Proverbial Expressions,,,,,,,,,,,,,,,,,,,,,,,,,,,,,,,,,,,,,,,,,,,,,,,,,,,,
,do ,punch or touch,sex,Sexual Activity,1,"Bi oloko nla do ni, abe a ya perepere",Postproverbial Constructions and Selected Sex-Related Yoruba Proverbs/ Proverbial Expressions,,,,,,,,,,,,,,,,,,,,,,,,,,,,,,,,,,,,,,,,,,,,,,,,,,,,
,do ,punch or touch,sex,Sexual Activity,1,"Adoni l’aya o f’oju re woni, ale oni k’omo ma ku, orii baba omo ni o sun",Postproverbial Constructions and Selected Sex-Related Yoruba Proverbs/ Proverbial Expressions,,,,,,,,,,,,,,,,,,,,,,,,,,,,,,,,,,,,,,,,,,,,,,,,,,,,
,do ,punch or touch,sex,Sexual Activity,1,"Adoni l’aya o f’oju re woni, o sekoko ni o tete pa",Postproverbial Constructions and Selected Sex-Related Yoruba Proverbs/ Proverbial Expressions,,,,,,,,,,,,,,,,,,,,,,,,,,,,,,,,,,,,,,,,,,,,,,,,,,,,
,do ,punch or touch,sex,Sexual Activity,1," Adoni l’aya o jebi, aya yin ni e kilo fun",Postproverbial Constructions and Selected Sex-Related Yoruba Proverbs/ Proverbial Expressions,,,,,,,,,,,,,,,,,,,,,,,,,,,,,,,,,,,,,,,,,,,,,,,,,,,,
,do ,punch or touch,sex,Sexual Activity,1,"Adoni laya o jebi, iwo ni ko lo lo paraga",Postproverbial Constructions and Selected Sex-Related Yoruba Proverbs/ Proverbial Expressions,,,,,,,,,,,,,,,,,,,,,,,,,,,,,,,,,,,,,,,,,,,,,,,,,,,,
,do ,punch or touch,sex,Sexual Activity,1,Nkan n be leyin “ma do mi niso ,Postproverbial Constructions and Selected Sex-Related Yoruba Proverbs/ Proverbial Expressions,,,,,,,,,,,,,,,,,,,,,,,,,,,,,,,,,,,,,,,,,,,,,,,,,,,,
,do ,punch or touch,sex,Sexual Activity,1," Nkan n be leyin “ma do mi niso, maltina kan ati miliki meji laaje",Postproverbial Constructions and Selected Sex-Related Yoruba Proverbs/ Proverbial Expressions,,,,,,,,,,,,,,,,,,,,,,,,,,,,,,,,,,,,,,,,,,,,,,,,,,,,
,do ,punch or touch,sex,Sexual Activity,1,"Eni dobo leekan to gen lese, oko re a re ",Postproverbial Constructions and Selected Sex-Related Yoruba Proverbs/ Proverbial Expressions,,,,,,,,,,,,,,,,,,,,,,,,,,,,,,,,,,,,,,,,,,,,,,,,,,,,
,do ,punch or touch,sex,Sexual Activity,1,"Eni dobo lekan to gen lese, o ti lowo asewo lowo ni ",Postproverbial Constructions and Selected Sex-Related Yoruba Proverbs/ Proverbial Expressions,,,,,,,,,,,,,,,,,,,,,,,,,,,,,,,,,,,,,,,,,,,,,,,,,,,,
,do ,punch or touch,sex,Sexual Activity,1,Eekan l’atanido n tanido mo ,Postproverbial Constructions and Selected Sex-Related Yoruba Proverbs/ Proverbial Expressions,,,,,,,,,,,,,,,,,,,,,,,,,,,,,,,,,,,,,,,,,,,,,,,,,,,,
,do ,punch or touch,sex,Sexual Activity,1,"Eekan l’atanido n tanido mo, eyi ti ko smart niyen (",Postproverbial Constructions and Selected Sex-Related Yoruba Proverbs/ Proverbial Expressions,,,,,,,,,,,,,,,,,,,,,,,,,,,,,,,,,,,,,,,,,,,,,,,,,,,,
,do ,punch or touch,sex,Sexual Activity,1,Kini an do ninu obo taani kile oma mo ,Postproverbial Constructions and Selected Sex-Related Yoruba Proverbs/ Proverbial Expressions,,,,,,,,,,,,,,,,,,,,,,,,,,,,,,,,,,,,,,,,,,,,,,,,,,,,
,do ,punch or touch,sex,Sexual Activity,1,"Obo dido dara pupo lara awa okunrin, Eyin temi se loto ni",https://www.facebook.com/groups/152142266886956,,,,,,,,,,,,,,,,,,,,,,,,,,,,,,,,,,,,,,,,,,,,,,,,,,,,
,do ,punch or touch,sex,Sexual Activity,1,Ejoo OBO wo lo wanle latido ara mi ti kun mofe daa,https://www.facebook.com/groups/152142266886957,,,,,,,,,,,,,,,,,,,,,,,,,,,,,,,,,,,,,,,,,,,,,,,,,,,,
,do ,punch or touch,sex,Sexual Activity,1,OBO WUMI DO LARO YII,https://www.facebook.com/groups/152142266886958,,,,,,,,,,,,,,,,,,,,,,,,,,,,,,,,,,,,,,,,,,,,,,,,,,,,
,do ,punch or touch,sex,Sexual Activity,1,Emin na le do obo dada obinrin ti emin re ba gbe ko inbox mi pada,https://www.facebook.com/groups/152142266886959,,,,,,,,,,,,,,,,,,,,,,,,,,,,,,,,,,,,,,,,,,,,,,,,,,,,
,do ,punch or touch,sex,Sexual Activity,1,Ekaro eejo semori obo do ni ado moju,https://www.facebook.com/groups/152142266886960,,,,,,,,,,,,,,,,,,,,,,,,,,,,,,,,,,,,,,,,,,,,,,,,,,,,
,do ,punch or touch,sex,Sexual Activity,0," Nígbà tí wọn kọ́kọ́ dé, wọ́n do sí itòsí Olúmọ, olúkúlùkù ìlú sa ara wọn jọ, wọn do kiri Ẹ̀gbá Aké, Ẹ̀gbá òkè-ọnà àti Ẹ̀gbá Gbágùrá ló kọ́kọ́ dé sí Abẹ́òkúta. ",http://yo.wikipedia.org/wiki/Abẹ́òkúta,,,,,,,,,,,,,,,,,,,,,,,,,,,,,,,,,,,,,,,,,,,,,,,,,,,,
,do ,punch or touch,sex,Sexual Activity,0," Ilé-Ìyálóde: Obìnrin ni o te idile yi do , O gbé fáàrí O sit un je akikanju obinrin láàrin ìlú. ",http://yo.wikipedia.org/wiki/Orílẹ̀-edeé Yorùbá,,,,,,,,,,,,,,,,,,,,,,,,,,,,,,,,,,,,,,,,,,,,,,,,,,,,
,do ,punch or touch,sex,Sexual Activity,0, Ilé-Akogun: Jagunjagun naa ni o te adugbo yi do Akogun sit un je Oloye pàtàkì ni ìlú ,http://yo.wikipedia.org/wiki/Orílẹ̀-edeé Yorùbá,,,,,,,,,,,,,,,,,,,,,,,,,,,,,,,,,,,,,,,,,,,,,,,,,,,,
,do ,punch or touch,sex,Sexual Activity,0," Ilé-Onílù: Àwon àyàn ni o te ile yìí do , ìdílé onilu ni àwon wonyi je ",http://yo.wikipedia.org/wiki/Orílẹ̀-edeé Yorùbá,,,,,,,,,,,,,,,,,,,,,,,,,,,,,,,,,,,,,,,,,,,,,,,,,,,,
,do ,punch or touch,sex,Sexual Activity,0, APOLE: Eni ti o koko te àdúgbò yi do maa n mo ògiri yi àwon ilé ibè po. ,"http://yo.wikipedia.org/wiki/Orúkọ Àdúgbò ní Àkùngbá-Àkókó, Ìpínlẹ̀ Òndó, Nàìjíríà",,,,,,,,,,,,,,,,,,,,,,,,,,,,,,,,,,,,,,,,,,,,,,,,,,,,
,do ,punch or touch,sex,Sexual Activity,0, OKOGBO: Inú igbó ni bàbá àgbàlagbà ti o te àdúgbò yi do ń gbé kí àwon ènìyàn to de ba a nibe ìdí nìyí ti awon ènìyàn fi n pe àdúgbò náà ni okogbó. ,"http://yo.wikipedia.org/wiki/Orúkọ Àdúgbò ní Àkùngbá-Àkókó, Ìpínlẹ̀ Òndó, Nàìjíríà",,,,,,,,,,,,,,,,,,,,,,,,,,,,,,,,,,,,,,,,,,,,,,,,,,,,
,do ,punch or touch,sex,Sexual Activity,0, Ìtùmò: Ibí yìí ni ójúbo osi esi wà télètélè kí o to di pé won te ibè do tí o si dí àdúgbò ojúbo osi yìí si wa níbè títí dònìí. ,http://yo.wikipedia.org/wiki/Àwọn àdúgbò ìlú Ìjẹ̀bú-Òde,,,,,,,,,,,,,,,,,,,,,,,,,,,,,,,,,,,,,,,,,,,,,,,,,,,,
,do ,punch or touch,sex,Sexual Activity,0," Nígbà tí o, fé te àdúgbò náà do ó mú òpá yìí dá ni, Ìdí niyìí tó fi je pé won ń je oba ni àdúgbò náà títí di òní yìí ",http://yo.wikipedia.org/wiki/Àwọn àdúgbò ìlú Ìjẹ̀bú-Òde,,,,,,,,,,,,,,,,,,,,,,,,,,,,,,,,,,,,,,,,,,,,,,,,,,,,
,do ,punch or touch,sex,Sexual Activity,0, Ìtùmò: Ìtàn so fún wa pé omi nigbogbo àdúgbò yìí teletélè kí ó to dí pe wón te ibè do . ,http://yo.wikipedia.org/wiki/Àwọn àdúgbò ìlú Ìjẹ̀bú-Òde,,,,,,,,,,,,,,,,,,,,,,,,,,,,,,,,,,,,,,,,,,,,,,,,,,,,
,do ,punch or touch,sex,Sexual Activity,0," Ìtumò: Òmi kan wà ní àdúgbò yìí télè tí àwon ènìyàn ti máa ń do nnkan, torí omi yìí ni wón se so àdúgbò yìí ní Ìfofín. ",http://yo.wikipedia.org/wiki/Àwọn àdúgbò ìlú Iléṣà,,,,,,,,,,,,,,,,,,,,,,,,,,,,,,,,,,,,,,,,,,,,,,,,,,,,
