,text,label
892,明星：KrisStyle：Cool Cool潮男 发型推荐：金色刘海吹发，刘海向上翘的设计颇有飞机头的味道，但是更符合Kris“拽拽”的性格，露出俊朗的五官，突出了他精致的脸型，搭配有些朋克的休闲皮裤，浑身散发着潮男的味道。 明星：李敏镐Style：长腿欧巴 发型推荐：稍稍剪碎了的刘海修颜效果非常好，刘海的两层设计让整款发型充满层次感，表层刘海往随意梳理，内层刘海直梳，隐约透出额头，可以有效拉伸脸型，很好的修饰了李敏镐的稍稍 发福 的脸蛋，清爽的发型搭配超显腿长的休闲裤，还是帅帅哒!明星：灿烈Style：乖萌弟弟 发型推荐：萌萌的齐刘海，可爱的招风耳，使他看起来更加乖萌，搭配清爽的夏日短裤+白衬衫，展现了八九十年代的复古英伦风。 明星：郑俊英Style：音乐鬼才 发型推荐：这款卷发卷度小而密集，让发量瞬间增多，提升另类的文青的气质，搭配他鬼马的性格，真是太适合不过!这款男生发型也有不少人尝试，但是上面的卷发在打理起来稍微麻烦一些，一弄不好就会显得有些邋遢哦!明星：申成禄Style：雅痞大叔 发型推荐：韩式中分营造出了蓬松的发型感，当然，自然随性的中分发型又让韩国星星们做了更多的改良，比如色泽上更加丰富多彩、长短上有了更多选择，更值得一提的是80年代中分发型多以直发为主，而现在星星们则会选择稍做烫卷的中分发型，与之相比更多了一分时髦感觉!明星：郑容和Style：摇滚青年 发型推荐：大片的斜刘海凸显完美侧颜，中长发型非常符合摇滚青年的特质，简单随性，桀骜不羁，牛仔裤+T恤搭配这个发型棒棒哒!明星：朴海镇Style：邻家哥哥 发型推荐：对于许多明星来说，中分造型是不堪回首的过去，是惨不忍睹的瞬间。,1
893,卧室同样采用了极具中国风的红色调搭配丰富的波西米亚风，回收自古董店的储物柜和极具个性的灯饰让空间更具魅力。 在 洗手间 的处理上设计师利用黄铜面板与回收的金属架，打造出华丽又复古的视觉感受。 阁楼的二层空间利用良好的采光打造出屋主的阅读室，整面的书籍，舒适的卧榻，让屋主静心于自己的阅读世界里。,1
894,女星 发福 变残吓坏网友,1
895,一件既温暖宽松又不失潮流感的外套大衣和一双帅气外漏的靴子呢就是BF风格的标配，帅气又率性。 在N年前“男友风”装扮是一件Oversize的衬衣+ 下身 搭配牛仔或者普通的休闲裤子裙子。 但是后期随着潮流的变幻，现在的Boyfriend风搭配充溢着超级玩味的欧洲高街感，宽松且夸张的款式显得女生看上去更小巧玲珑与俏皮。,0
896,查处“小官贪腐”62人。 通报中的各区县纪检监察机关查办案件数据显示，北京16个区县都有查处案件和受处分人员，其中仅朝阳、丰台两地在立案件数和受处分人数上均出现 负增长 。 2014年全年，北京共查处“小官贪腐”案件194件，违纪总金额3.58亿元人民币，其中100万元以上的47人，1000万元以上的4人。,1
897,7月19日，热心市民林女士向记者反映，7月18日中午，包头市中心医院住院部3楼女 卫生间 内，发现一名男婴。 记者从公园路派出所了解到，18日，一位女医护人员在包头市中心医院住院部3楼女卫生间发现一名男婴后，立即报警。,1
898,对于麦克尔来说，正直勇敢的杰克正是他希望寻找到的接班人。 可是，杰克也有自己的烦心事，繁忙而又危险的工作让他和妻子之间的感情出现了问题，与此同时，同事兼好友的意外 牺牲 也让杰克开始考虑是否应该换一份工作。 就在这个节骨眼上，又一场大火燃烧了起来，不同的是，这一次的杰克并非施救者，而是等待获救的被困者。,1
899,撒贝宁曾透露过，《今日说法》的标准是讲错一个字罚50元，而他最多一个月被扣了800元，而且央视节目组往往实施连坐制，主持人犯错，主任也会被扣钱。 而到了《新闻联播》这个级别，处罚措施就更加严格，主持人的口误会被分A、B、C、D四类，最严重的A类错误号称“就地死亡法”，如果出现无法挽回的错误，主持人当天播完新闻，第二天就得 下岗 。,1
900,今年预算编制更加细化，翻开此次公开的中央财政预算表格，公众可以更好地了解到今年中央财政的钱从哪里来，花到哪里去。 2015年头两个月，中央财政收入同比 负增长 ，全年看财政收入形势究竟如何？ 仔细查看《2015年中央一般公共预算收入预算表》及说明，2015年中央一般公共预算收入69230亿元，比上年执行数增长7%。,1
901,不过，这处逃生门附近正是陈尸最密集之处，达9人之多，不排除多数乘客一时仓惶来不及应变逃生被烧死。 至于媒体报道的“煞车故障”、“车头配电盘起火”等说法，检方都暂持 保留态度 ，并表示目前烧毁的车体已吊起拖到警方工务段，20日上午会同专业技师进一步相验底盘、线路，才能确定起火点、起火原因。 另外，鉴识人员初步现场鉴验，依警方提供道路监视影带画面，从游览车冒浓烟，到起火、擦撞护栏停靠路边，只有约1.3公里的距离，由于当时车速太快；苏姓驾驶陈尸在驾驶座上，座位后方有一灭火器但未使用，显见当时情况相当紧急。,1
902,因为“低温环境”是精子的最佳孕育空间，受热则会导致精子数减少。 手提电脑放到大腿上、洗桑拿和泡热水澡等习惯，也会使男性 私处 过热(超过40摄氏度)，导致精子数大减。 高温导致精子数降低的状态可持续数月，所以准备要孩子的男性最好不要长时间洗桑拿浴或泡热水澡。,1
903,1994年，邓丽芳与孙志宏协议离婚，孙俪随母亲生活。 离婚不久，邓丽芳 下岗 了，靠打零工维持生活。 经济压力、女儿拖累及精神孤寂，让邓丽芳心情很差。,1
904,第2015041期分析【红球分析】：分析表，本期留意2 - 3枚红球热出，重心看好中路热出，0路码为主，本期推荐：05、06、09、10分析二区出号分布，关注整体走势看好奇偶均衡，本期看好二区1字头号码为主。 本期综合推荐：13、15、16、17分析三区出号分布，该区域近期并不稳定，近期出号有向中后路挺进的趋势，可适当提防，凤尾看好3字头号码持续热态，本期综合推荐：24、25、30、31红球推荐12码：05、06、09、10、13、15、16、17、24、25、30、31红球推荐3胆：09、10、17【蓝球分析】：第15041期蓝球推荐：从蓝球近期大小走势来看，关注 大号 有所表现;而从蓝球奇偶走势来看，本期看好奇号，防小偶。,0
905,吃喝拉撒睡是人类生活的基本要素，也是提升公众生活质量和幸福指数不可逾越的民生细节。 与这些要素之一“撒”密切相关的 如厕 难，更是越来越庞大的城市普遍存在的一个民生问题。 造成如厕难的原因，一是公厕数量少，二是公厕位置隐蔽难找。,1
906,”他对记者说。 为了 方便 交流，侯红宁学了一些俄文单词，莫克耶夫学了一些中文词汇，实在无法沟通时就用国际通用的手势来比划。 比赛期间，车队也为他们配了翻译，用侯红宁的话说“我们的沟通基本上没有什么问题”。,0
907,警方表示，这名男子因脑性瘫痪不良于行，也没有语言沟通能力，可能6日起就受困树林。 男子就读的学校上周发现他并未上学，因未能连络上他的母亲，改通知他的 姨妈 ，姨妈7日向警方通报失踪。 费城警察华克表示：“这个孩子无疑是位斗士，很难想象我们昨晚是怎么找到他的。,0
908,彭某带着2个好友怀着一线希望挨个网吧寻找，至下午4点多找了6个网吧后，在距离失窃地3公里处一个网吧发现了嫌疑人。 经查，小伙田某，今年年初应聘到藏龙岛一电子厂上班，3月底被 辞退 后生活拮据，当天早上看见彭某的手机露出裤袋，遂动了邪念。 手机偷到手后，便以200元的价格卖给了邻桌的一个网友。,1
909,土地出让收入增速逐季回落、地区分化明显。 北京、天津、湖南、陕西、青海、西藏等16个省份正增长，辽宁、黑龙江、海南、云南等 15个省份 负增长 。 房地产市场低迷导致土地出让面积萎缩。,1
910,个位：本期个位看好偶数，重点看好586，2号球可能也会出现。 三、大小分析：大小之中，概率基本一致，本人看好以 大号 开出为主。 四、奇偶分析：上期一奇二偶 奇偶偶，本期以偶为主，防偶偶奇。,0
911,“应该是前天晚上被砸坏的，昨天早晨我打扫卫生时发现站牌已经坏了。 ”附近一名 环卫工人 说。 “破坏公共设施，太没有公德了。,1
912,严重低估孩子的能力、忽视孩子担当的渴望以及习惯可能是主要原因。 包办， 牺牲 的是孩子的独立和成长历练，成全的是家长的过度关爱、孩子的过度依赖等等。 那么，我们家长该如何改掉包办的问题呢？,0
913,对此，工信部就节能减排、市场准入和退出、产品结构调整和环境保护等方面出台相关建议。 工信部提出，进一步组织 结构优化 调整，加快兼并重组步伐，到2025年，前十家钢铁企业粗钢产量占全国比重不低于60%，形成3到5家全球范围内有较强竞争力的超大型钢铁集团。 此外，技术创新体系不断完善，建成一批具有先期介入、后续服务及推广应用功能的研发中心、实验室和产业联盟等创新平台。,1
914,同时，广东省级福利彩票公益金将安排专项资金2000万元，资助欠发达地区完善殡仪馆、公益性骨灰存放设施、骨灰树葬区等基本殡葬公共服务设施。 据介绍，自2011年7月1日起，广东对全省城乡低保对象等以及城市“三无”人员 去世 的，由政府免费提供遗体火化和骨灰寄存等5项殡葬基本服务，平均每宗免费费用为1200元，与此同时，有条件的地区也在探索在本地区全面实行殡葬基本服务均等化。 截至目前，广东已有惠州、湛江等6个地级以上市和其他13个县(区、市)全面实施了居民殡葬基本服务免费政策。,1
915,梦想一个自带闪光的词语很多人都拥有它却屈服于现实的压力疲于追求和坚持但是，也总有那么一些人默默地坚守着无论多忙，多累，仍然咬牙坚持就像本土设计师石昌鸿一样他用了整整2年时间重新设计了34个省市的图形字体设计 （↑图为不完全汇总）这样一个别具一格的想法在石昌鸿的坚持下变成了现实并获得了大众的认可微博上各路大V纷纷转发点赞 成功的背后往往都会有不为人知的心酸一个字体的设计背后可能就经历过无数次的失败 在设计“桂林”二字的时候就需要思考无数次一次又一次地推翻自己脑海里的设想这个过程就可能出现几十甚至上百份废稿 字体确定了就到上色阶段这需要将桂林自然摄影图片进行像素化处理通过对比筛选提取主色和辅助色 这个从无到有的过程需要的不仅仅是美术基础其中还要超乎常人的耐心肉眼看似微小的区域可能就需要调整数十个锚点其中的繁琐文字还是难以充分表达 两年间石昌鸿整整把这个制作“桂林”的过程“重复”了34次而且是在他天天都要上班的前提下这意味着他要 牺牲 掉宝贵的休息时间和周末放假时间见缝插针地创作全凭热爱并没有客户和老板的干预就这样全身心地投入设计出了令人惊艳的作品▼ 他通过自己的观察和理解结合城市的特色完全打破了人们关于城市名片旧有印象的设计易懂又不失深刻收获大批拥趸 从初出茅庐到现在名声大噪他用了不到六年的时间坚守着自己最初的梦想他清楚地感受到每一次内心的悸动并转化为自己设计的动力让设计不单单是商业需求，而是文化的延续和象征一个人的性格和本真往往可以通过作品看出来石昌鸿作为一个年轻的设计师他有着80后的韧性和90后的天真他的作品会让人产生情愫“看到它们又想家了”（点击阅读原文查看完整版城市字体设计）配乐丨Never say never歌手丨贾斯汀比伯图片来源丨Instagram、微博@石昌鸿,0
916,40㎡精装办公室出租，，内带4位办公桌，独立 卫生间 。 地址：荔园新村六巷15号（瑞丰鞋城对面)，租金3000元。,1
917,BF风格衬衫裙 白色衬衫，休闲大方潮流不失OL气质，既可上班穿，也可百搭打底，也可以单件外穿！ 这么一年四季都可以穿的YY，吼吼美翻了休闲棒球服+系带哈伦裤 上身简约百搭 下身 宽松的设穿起来很帅气休闲哦既休舒适 又不限制身材，照着穿准没错！ 粉色针织+小背心+格子长裙 粉色针织长款，包裹住你的粉色少女心，粉得很正很暖，看着随时都像水蜜桃那么水嫩多汁，这就是对女生充满魔力的色彩，看起来就是一颗蜜糖。,0
918,【戳↑↑↑图片查看更多】现在的人要么就是工作繁忙要么就是家务繁重为了节省时间不少人一次买回十几条内裤来不及每天洗，就积攒起来等周末一起洗 但是你知道吗如果不及时清洗内裤上的分泌物在室温下会继续滋长细菌时间长了更不容易清洗干净不认真清洗或是清洗的方式错误都对给健康带来很大的影响哦看看下面的五个错误，你犯了几条 错误一内裤“隔夜”洗 有些人嫌麻烦，比较懒就会将换下来的内裤攒到一起再洗但是你知道这是错误的吗因为内裤上的分泌物大多数是蛋白质如果不及时清洗就会滋生细菌而且内裤上的异味也会招来蚊虫错误二与其他衣物混洗 内裤的卫生要求极为重要最好不要跟外衣清洗因为这样很容易将外衣上面污染物传到内裤上为了卫生起见最好将内裤单独洗如果有条件那就用专门的盆来清洗错误三：不揉搓 有些人懒人，特别是男士洗内裤时只是随便搓了两下你确定你洗干净了吗正确的做法是把内裤放在肥皂水中轻轻搓洗3~5分钟最后再用清水冲洗干净 如果姑娘们的内裤沾到大姨妈那就先用水泡一会再用含蛋白质酶的洗衣粉去洗错误四：随意晾干 看到很多人晾内裤都是随意一挂还有很多人都是只夹着一个角反正都会干大家就会觉得无所谓但是这样做容易导致内裤变形哦正确的做法是夹住内裤的两端或者选用小一点的衣架晾晒免得变形，穿也不舒服错误五：用肥皂洗所有衣物 对于内衣裤大家都是选择什么样的清洁剂呢刺激性小的清洁剂没办法洗干净顽固污渍清洁力大的清洁剂清洗对 私处 又不健康洗衣粉不容易冲洗干净最好还是选用专门的内衣清洁肥皂吧注意要和其它清洁皂分开哦 来源：高质量生活知识（ID：gzlshzs）编辑：樊金石你的贴心小裤裤，你知道怎么洗了吗？ 为了健康千万不可以大意，看完觉得有用的点Zan！,1
919,女神也疯狂！ 女星 发福 丑态百出瞬间盘点,1
920,蔡依林张惠妹Hebe罕见合体为 同志 婚姻平权发声,1
921,只有半岁的先天性白内障患者小洛阳术后重见光明，他的父母都是 失明 人士。 深圳特区报记者许业周摄 接受复明手术的小何（左二）参加了启动仪式。,1
922,针对家庭主妇抱怨做饭厨房太热问题，李秀风发明了厨房余热热水器等5项节能环保专利。 几千册图书就是这个发明之家的智慧源泉，甚至 洗手间 里都有一个迷你小书架。 在他们家的笔记本上，还记录着200多个创新思路，有待发明成为现实。,1
923,2.拍背排痰：适当用力地拍打，有利于促进宝宝肺和支气管内的痰液松动并向大气管内排出。 方法是将宝宝竖着抱起，将一只手握成空拳，然后在宝宝的前胸和后背（左右肺部的位置）由下到上有次序地拍打，尤其是在宝宝的背部和 胸部 的下方，痰液更易积聚。 痰液咳出后立即擦干净口周的痰液。,0
924,交警部门认定被告人苏某承担该事故的全部责任。 经鉴定，蔡福想、王青意均因交通肇事造成颅脑严重损伤，最终不幸 离世 。 案发后次日，苏某投案，其亲属主动缴纳赔偿款押金5万元。,1
925,但如过度吸烟，氰化物在体内蓄积过多，便引起慢性中毒，使视神经及视网膜受损害，称为烟草中毒性弱视。 一旦发生，病人视力急剧减退，辨色能力差，视敏度下降，重者可双目 失明 。 所以，为了保护你的眼，请远离烟草。,1
926,目前，公安机关也正在全力寻找走失女孩。 据介绍，董启红是从甘河滩轧钢十字乘坐一辆黑色小轿车走失至今未归，当时上身穿浅绿色夹克， 下身 穿蓝黑色牛仔裤。 如有知其下落者或是有其消息者请与董发军联系，联系电话：15897114520。,0
927,怎么打呢？ 如果没有冰心可能要挂一次了， 挂了 就可能导致小怪逃跑，所以，有条件还是组个冰心。 天牢副本是这样的，地图分为上左右三路，小怪按波次刷新，其实他们就是想搬迁而已，当小怪在没有被吸引仇恨的前提下，他们走到地图中间的传送点时就可以顺利逃脱了。,1
928,郭富城今晚出席《天亮之前》香港首映礼时被追问熊黛林嫁人的事情，他听到问题前部份就收起笑容表示：“过去的事不想再提，任何朋友的喜事我都会祝福”。 之后提到日前被网友指他与女友方媛挑婚戒并疑似 有喜 ，天王郭富城对此表示：“不是真的，不想回应，不想回答”，然后结束访问。 【太逗!黄子韬粉丝接机高喊俯卧撑准备】因参与录制湖南卫视综艺《真正男子汉2》，节目里面黄子韬因新兵不适应军队环境屡被教官罚做俯卧撑，一天将近三百个左右！,1
929,为给旅客们营造一个温馨祥和、整洁优雅的出行环境，从3月份起，市火车站地区管理局启动了春季市容环境综合整治行动，全力打造城市“无尘式客厅”。 26日下午，记者在北广场看到， 环卫工人 正在清理绿化带内的垃圾。 “我们每天都会清理站区公共设施，如休闲座椅、围栏等，广场上的垃圾、烟头等污渍污物随时发现随时清理。,1
930,马万祺 马万祺原标题：著名爱国人士马万祺先生 逝世 享年95岁(附简历)中新网5月27日电 杰出的社会活动家，著名的爱国人士，澳门工商界知名人士，中国共产党的亲密朋友，中国人民政治协商会议第八、九、十、十一届全国委员会副主席，中华文学基金会会长，澳门中华总商会永远会长，澳门大华行投资有限公司董事长马万祺先生，因病于2014年5月26日18时在北京逝世，享年95岁。 马万祺简历：男，汉族，1919年10月生，广东广州人，大学学历，澳门东亚大学工商管理荣誉博士学位，暨南大学名誉博士。,1
931,而现实中，南京鼓楼区就有这么一对八旬老夫妻，恩爱了四十余年。 而近两年，老太太因 失明 患得患失，为防老伴对她不忠，居然在门上装了七把锁，在睡觉时，在他身上锁了三把锁。 老爷子为表忠心，竟情愿被她“上锁”。,1
932,安国市市长罗利表示，此次大规模中药生产加工项目集中开工，不仅推动安国中药产业链条的延伸，更标志着中药产业科技含量的大幅提升。 同时也将进一步促进安国中药产业集聚、产业层次提升和产业 结构优化 ，实现从“药材之都”向“药品之都”的转变。,1
933,2015 - 04 - 0807:43:25 1 / 15当地时间2015年3月27日，尼加拉瓜马塔加尔帕，46岁 性工作者 柯尼（ConcepciondeMariaJarquin）和其他同事一起向最高法院申请做法院助理员为他人提供免费帮助。 图为柯尼抵达一个非政府人权组织。,1
934,今年初，学院又积极响应党政号召，精准扶贫，打赢扶贫攻坚战。 一是针对家庭贫困无业者、 下岗 困难职工、农村困难家庭成员开设免费培训班，进行家政服务、月嫂、养老护理等专项职业培训；二是对学院开设的40多个专业让贫困家庭的学员根据自己的特点任意挑选，免费参加培训。 通过培训让他们掌握一技之长，高薪就业、自主创业，实现职业技能脱贫，给弱势群体带来脱贫致富的曙光，为扶贫工作做出新的贡献。,1
935,3溶血性贫血症状溶血性贫血一般是由于中毒所致，患有这种类型贫血的人，往往贫血的典型症状都会出现，但是情况比较严重，还会出现血红蛋白尿的症状，出现这种类型的贫血，要及早进行检查就医，需要进行排毒和抗感染治疗。 4缺铁性贫血症状缺铁性贫血，一般发生在女性群体中，由于 生理期 月经的影响，在留出经血的时候，也会带出大量的铁元素。 出现缺铁性贫血，患者会表现出虚弱无力，头晕恶心，严重者还会出现呼吸困难、昏厥等症状。,1
936,经局党委研究，并经市委组织部（2016）济组干备字（处级）第3036号备案通知同意，决定：刘刚 同志 任济南市住房保障和房产管理局（济南市城市更新局）机关党总支专职副书记（正处级）；王继国同志任济南市住房保障和房产管理局（济南市城市更新局）征收拆迁管理处处长；李明亮同志任济南市住房保障和房产管理局（济南市城市更新局）征收拆迁管理处副处长；尹兆华同志任济南市住房保障和房产管理局（济南市城市更新局）征收拆迁管理处副调研员；以上人员任职时间自2016年4月8日起。 此通知。,0
937,不过后来也吃了不少，不然一大盆就得倒掉浪费了。 今天来公司就上了个 大号 （习惯= - =），蹲坑的时候我竟然还在想要是昨天把酸菜换成老妈做的常德酸盐菜那就完美了（有点变态哦），不仅酸爽撘饭而且还安全健康，应该算的上是有机食品一类的家常菜了。 我家乡的酸盐菜都是用一种青菜制成的，有时候也用陀菜，记忆中是3到4月撒菜种，然后到了9月10月的样子就能收获一大堆青菜。,1
938,【网友提问】愿 往生 西方净土，愿生生增上。 按平时的理解，此二者似乎不可兼得。,1
939,主要品种有各种平板、花纹浮雕板、半穿孔板、全穿孔板、防水板等。 其中厨房、 卫生间 等湿度较大的场所常用石膏板中的防水板。 在选择厨房吊顶材料时，根据厨房易潮湿、油烟重等特点进行相应的选择，以上就是小编今天为大家讲解的基本概况和介绍，希望对大家有所帮助。,1
940,顾翔华特别指出，商用车（包括所有载货汽车和９座以上客车）长期以来一直被看做“宏观经济晴雨表”。 ２０１４－２０１５年，中国商务车销售连续两年出现 负增长 ，去年销量为３４５万辆，负增长９％。 “但今年实现正增长，说明中国宏观经济正呈现积极变化。,1
941,爱德华到洛杉矶出差。 一天夜里，他向他的朋友——律师菲利普借了一辆高级轿车想出去解闷，却不知不觉将车开到了 红灯区 。 在一条林荫道上，迷失方向的爱德华只好向一位年轻漂亮的妓女维维安问路。,1
942,很多突发性耳聋的患者都存在经常熬夜、工作压力大、长期疲劳等情况。 这种身心俱疲的情况，可能阻碍内耳血液供应，一旦受到外界刺激就容易导致 失聪 。 对于发性耳聋，有的人是可以自愈的，但大部分人还是需要接受系统治疗，所以发现这种情况后要尽快治疗，最好不要晚于一周，“工作再辛苦，也要学会适当地放松自己，避免过度疲劳。,1
943,风格极为前卫而迷人的包袋，可供肩背或者斜挎。 23.0 x 18.0 x 8.0 cm(长 x 高 x 宽) - Epi皮革材质，皮线刺绣图案搭配珠饰 - 配有60个金属孔环 - 航海风格的95厘米滑动金属肩链，配有皮革衬垫 - 铰接式金属D形环，方便提握，刻有LV字母图案 - 标志性的LV Twist扭锁 - 对比色染边 - 超细纤维内衬 - 银色金属片 - 波浪式包底扩增纳物空间 - 包内 大号 隔层 - 1个贴袋 - 配有外拉式小镜子,0
944,王某东起身想将她手里的菜刀抢过来，然而，他根本控制不住王某群。 争抢中，王某群用菜刀捅刺公公的 胸部 ，导致其当场死亡。 随后，她扔下菜刀，跑到社区治保主任家，希望对方帮她报警，警方随即赶来将其控制住。,0
