,text,label
548,现在的人要么就是工作繁忙要么就是家务繁重为了节省时间不少人一次买回十几条内裤来不及每天洗，就积攒起来等周末一起洗 但是你知道吗如果不及时清洗内裤上的分泌物在室温下会继续滋长细菌时间长了更不容易清洗干净不认真清洗或是清洗的方式错误都对给健康带来很大的影响哦看看下面的五个错误，你犯了几条 错误一内裤“隔夜”洗 有些人嫌麻烦，比较懒就会将换下来的内裤攒到一起再洗但是你知道这是错误的吗因为内裤上的分泌物大多数是蛋白质如果不及时清洗就会滋生细菌而且内裤上的异味也会招来蚊虫错误二与其他衣物混洗 内裤的卫生要求极为重要最好不要跟外衣清洗因为这样很容易将外衣上面污染物传到内裤上为了卫生起见最好将内裤单独洗如果有条件那就用专门的盆来清洗错误三：不揉搓 有些人懒人，特别是男士洗内裤时只是随便搓了两下你确定你洗干净了吗正确的做法是把内裤放在肥皂水中轻轻搓洗3~5分钟最后再用清水冲洗干净 如果姑娘们的内裤沾到大姨妈那就先用水泡一会再用含蛋白质酶的洗衣粉去洗错误四：随意晾干 看到很多人晾内裤都是随意一挂还有很多人都是只夹着一个角反正都会干大家就会觉得无所谓但是这样做容易导致内裤变形哦正确的做法是夹住内裤的两端或者选用小一点的衣架晾晒免得变形，穿也不舒服错误五：用肥皂洗所有衣物 对于内衣裤大家都是选择什么样的清洁剂呢刺激性小的清洁剂没办法洗干净顽固污渍清洁力大的清洁剂清洗对 私处 又不健康洗衣粉不容易冲洗干净最好还是选用专门的内衣清洁肥皂吧注意要和其它清洁皂分开哦 关于内裤的这些知识，你都了解了吗？,1
549,绝大多数8岁男孩的生日，应该是和家人或者小朋友们团聚，到游乐园玩耍之类的。 但是日本一位人气美女博主Chiimelo，给她的8岁儿子Ryuchalo过生日选择的地点是： 红灯区 ！ 在位于东京新宿的歌舞伎町红灯区某个俱乐部，Ryuchalo染着头发，穿着十分紧身的衣服，戴着首饰... 生日会准备得十分隆重，邀请了许多工作人员以及嘉宾 从视频来看，参加的都是一些衣着华丽的年轻男女 现场还搭建了香槟塔，堪称灯红酒绿 到处都是定制的庆贺物品，比如Ryuchalo头像的扇子 生日的高潮是Ryuchalo倒香槟，大家欢呼 据说这个香槟塔还是运用了投影映射高科技的 孩子的妈妈Chiimelo在Youtube有12万粉丝，她的追随者多数的态度是：“太可爱了！,1
550,足不出户在家赚钱， 家庭主妇 、学生、无业者、等等只要有业余时间，都可以兼职 / 全职。 一部手机或电脑，每天1 - 2小时，轻松创业，月入过万。,1
551,章子怡被疑怀孕？ 从照片中看，小腹微微隆起……于是各大煤体纷纷纷纷猜测章子怡是不是 有喜 了，网友们则调侃章子怡与汪峰这么快就怀上了！ 汪峰这是又要上头条了！,1
552,53岁蓝洁瑛沧桑近照曝光双眼无神 发福 明显,1
553,1.3、公司全体董事均出席了审议本次年报的董事会会议。 1.4、北京兴华会计师事务所(特殊普通合伙)对本公司 2014年度财务报告进行了审计，并且出具了标准无 保留意见 的审计报告。,1
554,花光身上的钱财后，就通过盗窃财物继续维持上网花销。 今年4月份，杨某从安徽老家来到莆田，原本只想寻求一份工作安定下来，却因为老是干不好而被 辞退 ，无所事事的杨某开始沉迷网络游戏。 钱花完了，杨某就想到去偷。,1
555,该疗养院长期生活着149名19岁到75岁的残障人士。 行凶男子植松圣已自首，植松圣称此前曾在此疗养院工作，后来被 辞退 ，心生怨恨，导致行凶。,1
556,8．上床对男人意味着“爽”，因为上床的确是感官刺激，是高潮，是身体的酣畅。 女人1．床对女人最重要的意味是奉献和 牺牲 ，似乎没有女人会觉得上床的意义是自我索取，女人总是会说，我献出了我的身体，看看，多么悲壮！ 2．上床对女人意味着情感关系的确认，女人虽然也很挣扎，但一旦上了床就会想：我已经是他的人了，这是一种正常的思维方式，男人可不会这么认为。,0
557,据了解，该通知是基于2009年市政府印发的《重庆市以个人身份参加城镇职工医疗保险市级统筹暂行办法》（渝府发〔2009〕29号）。 该办法切实解决了重庆市灵活就业人员、失业 下岗 人员以及无用人单位退休人员等困难人群参加城镇职工医疗保险问题。,1
558,画风太清奇！ 实在不行，那就做 家庭主妇 吧！ 对此，妈妈们表示不高兴了为啥非得我辞职带娃？,1
559,近日，市质监局面向全市征集300名“市民计量监督员”的消息发出后，许多热心市民纷纷打电话报名参与，市民谢婷也是其中之一。 她是一名 家庭主妇 ，空闲时间较多，希望能参加一些公益活动。 她去年就关注到了“市民计量监督员”活动，觉得很有意义，但由于报名晚了未能参加，今年终于盼到了第二届。,1
560,1、注意好个人卫生如果想预防妇科病症的缠身，注意个人的卫生是必要的，妇科病专家强调，日常中的内衣裤最好选择柔软松宽的，最好是棉织品，而且最好每天用清洁的温水清洗外阴，但在洗内衣的时候清洗液是不可以用的。 2、注意经期卫生生理期是每个女性都十分的清楚，在这段时间女性也会有很多的问题出现，专家表示，月经期一定要注意好个人卫生，同时禁忌经期 同房 ，的感染情况也就可以避免。 3、定期做好妇科检查一定要做好检查，这样对于改善问题是很彻底的，由于很多妇科炎症在初期时的症状十分的不容易看出，只有通过妇检才能发现。,1
561,本站文章谢绝转载，否则法律后果自负!法制晚报——近日，一篇四川凉山彝族自治州四年级小学生写的作文《泪》在网络上流传。 12岁的彝族小女孩木苦依伍木在文中描述了她的母亲 离世 前的场景，“饭做好，去叫妈妈，妈妈已经死了。 ”而在4年前，她的父亲已去世。,1
562,今年，经济新常态成为论坛“热词”，反映出全球经济复苏动力不足的背景下，海内外高度关注中国经济走向。 在步入以速度变化、 结构优化 、动力转换为特征的新常态后，中国经济何去何从？ 这对全球经济格局有何影响？,1
563,神经纤维瘤具有遗传性，患者从出生开始，肿瘤就会不断恶性生长，很多患者不到20岁就要经历5次以上的大型手术治疗，被称为“比癌症更可怕的疾病”。 如果治疗不及时，患者轻则会有面瘫、耳聋、 失明 等并发症，重者随时都会有生命危险。 而且，治疗费用高昂，单次大型手术的费用高达七八万元。,1
564,新华社香港10月16日电香港海洋公园16日宣布，在香港海洋公园生活了17年的大熊猫“佳佳”当日 离世 ，终年38岁，它是全球历来最长寿的圈养大熊猫。 海洋公园表示，“佳佳”在过去两个星期健康急剧转差，食量及体重下跌至有记录以来最低，食量由逾10公斤急降至3公斤以下，体重由71公斤跌 至67公斤左右。,1
565,无并发症的普通感冒一般5～7天后可痊愈。 5、体检可见鼻腔黏膜充血、水肿、有分泌物，咽部轻度充血， 胸部 体检多无异常。 6、白细胞总数不高或偏低，淋巴细胞比例相对增加，重症患者可有白细胞总数和淋巴细胞数下降。,0
566,市招考办的相关负责人介绍，今年中长跑项目首次加入到体育中考的必考项目，让考生选择面更宽，考生可根据自身的身体情况，选择适合自己的必考项目。 特殊情况丧失运动能力的残疾学生（有深圳市残联核发的残疾证书）以及临时有伤病（如骨折、肌肉拉伤等）的考生（具有二级以上医疗机构证明）及女生 例假 （由学校出具证明），可申请缓考。 温馨提醒各区教育局必须指定医院（二级以上医疗机构）对临时伤病及身体发育异常的学生进行鉴定，临时伤病及身体发育异常的学生必须出具指定医院的证明申请免考、择考或缓考，其它非指定医院的证明均视为无效（市属学校按校址所在辖区划归到相应区）。,1
567,接完电话我立即赶回老家，通过和医生交流得知，妈妈已经出现了糖尿病并发症！ 再往下发展可能会引起视网膜脱落 失明 、尿毒症等严重后果……这次回家才发现，妈妈得病这十年来，我几乎没有真正关心过她，她每天都需要打三针胰岛素来控制血糖，一算才发现3*365天*10年=10950针！ 由于长时间在仅有的几处身体部位（肚皮、大腿）注射，皮肤都出现了硬化。,1
568,营养厨房建设要抓空白点，尤其是注重偏远地区的厨房建设。 “四点半学校”要配合妇联等有关部门，发挥优势力量，探索创新切实可行的方式方法；要继续抓好关工委组织建设和“五老”队伍建设，吸收那些刚从岗位上退下来的身体好、威望高、相对年轻、热爱青少年教育事业的领导 同志 加入到关工委队伍中来，及时调整充实市、县、乡关工委班子。 满春重在讲话时指出，要强化学习，更新观念，紧跟时代步伐，加快知识更新，深入研究青少年成长规律、思想动态、心理特点，在开展教育活动的内容上贴近青少年的需要，在教育的形式和方法上适应青少年的特点；要学以致用，大胆实践，将学到的知识真正应用到科学谋划关工委工作中，应用到发挥“五老”作用中，应用到各类主题教育活动中，应用到加强基层组织建设中，切实增强服务青少年实效，推动关心下一代工作创新发展。,0
569,据介绍，今年桥头文化惠民演出，既突出“送文化”，同时突出“种文化”，让群众从“观众席”走向“表演台”，从“受惠者”变成“参与者”、“志愿者”，自觉参与千场文艺演出，充分展示和感受文化零距离服务的魅力。 通过开展文艺演出，将公共文化服务从城市中心区域、次中心区域向基层、社区和特殊区域、 特殊人群 服务转移，实现镇内文艺演出资源共享。,1
570,在东海和南海问题上对中国指手画脚，声称日本将坚决维护领土领海领空主权，并无端指责中国“对菲律宾基于国际海洋法条约的仲裁手续不予回应”。 在与邻国的历史争议问题上，蓝皮书坚称，包括 慰安妇 问题在内，日本已经在法律层面“完全解决”了战后赔偿问题。 蓝皮书还专门提及有日本主流报纸撤回了“强征慰安妇”的报道，试图以此混淆视线，否定强征慰安妇的历史事实。,1
571,1712年，圣彼得堡成为俄国首都，其后200余年始终是俄罗斯的心脏。 1914年改称彼得格勒，1924年列宁 逝世 后又命名为列宁格勒，1991年苏联解体后恢复旧名。 圣彼得堡由100多个岛屿组成，由四百多座桥梁连接，有“北方威尼斯”之称。,1
572,色彩稚嫩亮丽，少女心爆棚。 美好的事物总是不嫌多，一般的吊带裙都是腰部收褶，我们将位置上移，在 胸部 收褶，腰部的裙摆自然下垂。 显胸大的同时还能藏住腰部的肉肉。,1
573,敢袭警2 I - NEED - AV啧啧，不愧是性都啊，喷啊喷！ 10 明朝伪君子真的假的0 翠绿色Λ.Λ小青蛙充分体现出天朝人民对国家警务人员的不满8 星期866S法不责众6 一颗榴莲枪里放点 姨妈 液4 可芒 这居然是我大天朝 当街枪袭我民警 太无法无天了4 孩儿他爹RFC有没有里边放尿的2,1
574,黄安自曝突发心肌梗塞：来得太猛烈差点 挂了,1
575,看到男童父亲在水中已精疲力尽，河南警察学院学生潘东东跳入河中救起了男童父亲。 29日下午，郑州市红十字水上义务救援队队长牛振西告诉记者，“接到求助后，我带领3名救援队员赶往事发地，经过一天多的搜寻，没有搜寻到溺水身亡的大学生武耀宗，又有一位见义勇为的好小伙 走了 。 ”“想起这件事，我感到内心很难过，责怪自己没能将武耀宗救出来。,1
576,考古队员李福生介绍，这么宽的墙，属于主墙，也就是封火墙。 墙基东西两侧的空地，就是原来的房屋，其中一间内还找到了 卫生间 的痕迹。 “现在的房屋基础和这个差不多宽，有些可能还没这么宽。,1
577,47岁满文军复出后 发福 显沧桑,1
578,“中国经济几乎到了通货紧缩的边缘。 ”北京大学光华管理学院院长蔡洪滨昨日在经济分析会上表示，2014年虽然是非常困难的一年，2015年可能更加困难，目前多项经济指标增速滑落甚至进入 负增长 ，表明需求严重不足，经济缺乏活力。 然而，对于国外流行的中国经济崩溃论，蔡洪滨表示，“这并不意味着中国经济会崩溃，因为政府还有很多工具可以使用，包括更加积极的财政政策等，目前已经在实施”。,1
579,她姐姐比她大十几岁，在五年前离了婚，一直没有再找，因为她怕图她的钱。 大姨子经常趴在床上让我给她按摩，没忍住我们 干柴烈火 的做起来 今年，老婆生下了儿子，做月子期间，一直有保姆侍候，所以，我晚上回家总是被姐叫去做点这，做点那。 甚至还让我给她按摩，有时候她竟然脱光上衣趴着让我按摩，按的时候，能够感觉到她很享受，还不时发出呻吟声，开始的时候，我有点紧张，后来姐姐竟然说，妹妹做月子不能陪你，你不会寂寞吗， 不然，我来陪陪你吧。,1
580,门兴首次射门就取得领先。 赫尔曼 胸部 停球回传，拉斐尔在门前14米处推射，诺伊尔将球漏进门内，1比0。 下半时后，拜仁用罗德换下阿隆索。,0
581,彼此相爱的时候，无论女人是不是内向话不多的性格，总体都会和男人交流，拌些嘴。 但有一天，男人突然发现女人和自己交流的话题，变得比以前少多了，而且可以确定并非她的 生理期 ，那是因为她不想和你聊了。 她觉得和外面喜欢的男人，更有趣，和你聊没什么意义。,1
582,因为据国外科学家研究，儿童乳牙里面的干细胞，比脐带血的干细胞更为“奇特”，因乳牙里面干细胞的多能性最强，与其他干细胞相比，增殖的速度更快。 它具有下面诸多超神奇的作用 可用于再生出身体组织，以替代身体不健康或受损的器官，比如可再生骨骼、再生心脏、再生牙齿； 可再生眼睛组织，以治愈 失明 ； 促进皮肤伤口愈合及再生，治疗烧伤有奇效，延缓衰老； 再生免疫系统，治疗足癣、白癜风、湿疹等； 再生脑细胞，治疗阿尔茨海默症，帕金森症、老年痴呆症等神经系统疾病； 还可以治疗类风湿性关节炎，再生血管，治疗心脏病，还被预测未来可治疗成人白血病…… 据悉，中国首家GMP级口腔干细胞库已成立，具体是将乳牙的干细胞保存在冷冻的液氮中，储存时间能长达30年，未来可用于治疗儿童成长过程中遇到的意外或疾病。 所以对于孩子身体某些遗传性或先天的疾病，储存孩子的乳牙是个不错的选择，比如先天性心脏病、先天性失明等。,1
583,持斋的日子一般是阴历朔日、初八、十四、望日、二十三、二十九，各位务必要谨记。 居家八法居家八法是佛陀针对在家人求得现实和未来安乐的八种修行，即 方便 具足、守护具足、善知识具足、正命具足、信具足、戒具足、施具足和慧具足。 如果按照居家八法修行，不但得今世的安乐，还可得来世的安乐。,0
584,↑↑↑不知火舞这名来自于格斗游戏的女性经常出现在各大男生眼中其最为经典的就是那一对让人馋涎欲垂的 胸部 今天我们将为各位讲解她从1991年至至今的乳摇历史游天堂街机门户微信：sh17utt微博：@游天堂街机门户我们专注于各种格斗游戏对格斗游戏的新闻、选手咨询、赛事进行闪电式播报。,1
585,大气和时髦兼备的同时才能让档次攀升，而简约的穿搭选择清单色彩的单品能最大限度的突显出高雅气质，气质提升了档次自然也会跟着提升，想要穿搭简约又能人前显贵，抓住要领每个人都可以做得到！ 搭配TIPS 大号 包实用大气：选择简练又大方的单品是让搭配更有气场的法宝，如果你想给人大气出众的效果，就不要用精致的背包来搭配，反而大号的手提包或是双肩背才能给人极简时髦的冲击力。 金属配饰诠释精致穿搭：无论什么风格的穿搭只要将其做到极致，便能脱颖而出。,0
586,冷三笑：第114集男子包 小姐 非但不掏钱反靠技术大赚一笔,1
587,毕竟大盘股在弱势背景下，持续走牛概率不高，需要夯实区间逐步抬升股价区间。 前期中字头鸡犬 升天 ，接下来资金建仓程度差的中字头会走的比较弱，差价出货形态更加明显。 但是和部分中字头股票加仓明显，修正后创新高概率大。,0
588,相信大家都听过吃货界的一个传说：香蕉冻住吃，好吃到 升天 ！ 可爱的冻香蕉，制作简单，口感清新，吃起来完胜各种复杂的冰激淋~最重要的是，超低卡！,0
589,新华网巴西库亚巴6月17日体育专电（记者公兵、王浩明、刘彤）17日，俄罗斯队在巴西世界杯H组与韩国队战成1平，俄罗斯队主教练卡佩罗虽然 表示遗憾 ，但还是认为这是他一件不错的生日礼物。 当日俄罗斯队先是在第68分钟落后，但六分钟后便扳平比分，1：1的比分保持到终场。,1
590,2014年，上海市单位生产总值综合能耗、碳排放下降率均超过8％，超额完成全年工作目标，能源消耗比上一年减少近270万吨，各项主要污染物排放量削减率也高于年初国家下达的目标；完成产业结构调整644项，年减少能源消耗47万吨标煤。 会议透露，2015年，上海将继续实施总量和强度“双控”制度，实现能源 结构优化 、污染总量持续下降。 锁定1000个项目，锁定4＋X(南大、桃浦、吴淞、高桥及其他)区域，聚焦重点区域、重点行业、重点企业，推动节能减排。,1
591,(网站微信号：LINSBROS)从来没见过这样的。 上身不错， 下身 就有点“畸形”了，过于krazy，漏气了怎么办?相信99%的人都是这样的想法... 更多HOT娱乐资讯点击“阅读原文”进入: linsbros.com,0
592,2016年10月16日是济南贵和皇冠假日酒店开业15周年纪念日，15载春秋，酒店的成长和发展离不开我们尊贵的客人和社会社区的支持，回馈社会也是酒店义不容辞的企业责任。 10月16日，酒店准备了“爱心便当”，送给历下区大明湖街道办的 环卫工人 。 “”、“马路天使”和“”，他们每天早上四点左右就已经上班，无论严寒酷暑，坚持在自己的岗位上，穿梭在各条马路上，默默无闻的奉献着，“城市美容师”，为你们点赞！,1
593,但是，大玉儿的下嫁，除了让多尔衮多了一个女人，自己的地位名义上提升了之外，并没有其他的好处，反而增加了负担，就是担负起了大玉儿孝庄和福临安全的责任，同时也成了有心人士的众矢之的，让自己的名声弄得更臭，让大家以为他想要争权夺位。 多尔衮没有夺取帝位，唯一的解释是他顾全以清廷政局安定和满洲贵族的长远利益作出了相当大的个人 牺牲 。 三个人去投宿，服务生说要30元，每个人就各出了10元，凑成30元。,0
594,【概要】□名人后窗N倪早菊摘自《文史天地》爱国将领冯玉祥在担任“陆军检阅使”时，原配夫人刘德淑不幸 逝世 ，使他沉浸在苦闷的悲痛之中。 不久，曹锟托人牵线，想招冯玉祥为婿，但由于冯玉祥生活过于清苦，未能成事。,1
595,1996年1月1日，《新闻联播》首次实现直播时，各级领导经过慎重考虑，决定由李瑞英和罗京首先直播两周，作为试验和后继者的样板。 1997年，李瑞英和罗京连续工作30多个小时，对小平同志的 逝世 及隆重的悼念活动作直播，表情、语音把握得当，无一差错，受到中央领导的点名表扬。 中英香港政权交接仪式，她担任前方报道记者；在设备效果欠佳的情况下，她的现场应变能力令人钦佩。,1
596,“走进柴河局就进入了威虎山国家森林公园，空气好、景色好、山里人更好。 每年，来这里玩几天，看看原始森林，坐坐森林小火车，游游莲花湖，参观一下威虎山展馆和杨子荣 牺牲 地，在大自然的怀抱里放松身心，享受绿色。 ”凭借着优良的“气质”和骄人的“颜值”，威虎山景区生态旅游连续三年，夏季接待人数都超过50万人次。,1
597,还要到办事大厅排队?在微信上就能搞定啦！ 办业务自己想“点“就“点”为进一步 方便 职工查询和办理住房公积金业务，即日起，东莞市住房公积金管理中心正式开通“东莞公积金”微信公众号及自助服务一体机！ 微信办理公积业务操作指引?关注“东莞公积金”微信公众号； ?公积金提取东莞市缴存职工已开通了个人自助服务的，可申请办理租金、装修费及物业管理费等部分提取业务，业务审核后资金自动划转。,0
598,搜狐娱乐讯自从2011年举办“世纪婚礼”以来，英国威廉王子和凯特王妃就备受全世界的关注。 2013年两人生下了乔治王子，去年英王室宣布凯特再次 有喜 。 近日，根据外媒最新的报道，凯特王妃腹中所怀的胎儿已经被确认是女婴。,1
599,家住石家庄市桥西区铁路34宿舍，于2016年10月28日晚8点左右在铁路34宿舍附近走失，至今未和家长或老师取得联系。 昨天出门时上身穿黑色棒球衫， 下身 穿深红色紧身裤，脚穿一双红色旅游鞋，背紫色书包。 小编在朋友圈看到这条消息后，第一时间联系了王晓丫的妈妈。,0
600,7月19日晚间，有微博 大号 爆料称安全漏洞平台乌云网官方网站无法访问，可能出现状况。 对于“出事”一说，乌云网随后在网站首页发布声明称，乌云网及相关服务将进行升级，并将在最短时间内，以最好的姿态回归。,0
601,伸髋是指支撑时骨盆以支撑腿的髋关节为轴作向前转动，其目的是加大后蹬结束时两大腿之间的角度和缩小蹬角。 两大腿夹角大，说明摆动越积极，有利于增加步长，从而提高跑速，如果两大腿夹角小，则前蹬距离短，这样以 牺牲 步长来缩短支撑时间，则得不偿失。 三、缓冲阶段支撑腿的膝角缓冲是后蹬的前提条件，人体并非刚体，着地时身体各关节必然产生相应的缓冲。,0
602,牺牲 好大！ 陈乔恩早年录节目当众脱内衣扔出来,0
603,唐河召开河南省第十九届 环卫工人 节暨表彰大会 唐河召开河南省第十九届环卫工人节暨表彰大会 唐河召开河南省第十九届环卫工人节暨表彰大会今天是河南省第十九届环卫工人节，为大力弘扬环卫工作人员无私奉献精神，营造尊重、理解和支持环卫工人劳动的良好社会风尚，促进环卫事业持续健康发展。 10月26日上午，县城管局召开庆祝河南省第十九届环卫工人节暨表彰大会。,1
604,情况凶险，当地医院建议立即转至杭州大医院。 “患者转到的时候，我们急诊室的医生们都吓了一跳，因为主动脉破裂的患者大多数没进医院就 走了 ，他真的还算幸运的。 ”李主任说。,1
605,课程内容有装扮纸杯蛋糕、妙味月饼、惊险的万圣节以及圣诞手工创作等。 洲际小行家@千岛湖洲际度假酒店酒店内专为小客人而建的小型度假天地，让小宝贝沉浸在属于自己的世界里，连 洗手间 都是迷你版的，童话故事般的小门、小洗手台、小马桶，连墙上和镜子都有成群的魔幻小彩鱼在畅游。 湖上全日餐厅和行政酒廊内有儿童用餐区，皮制圆形无棱小桌子和小椅子，可以拆卸拼成汽车、飞机等玩具的儿童菜单，堆积木。,1
606,白皮书说，2013年，中国共侦破拐卖妇女案件5126起、拐卖儿童案件2765起；利用全国公安机关打拐DNA信息系统为631名儿童找到亲生父母。 此外，中国制定依法惩治 性侵 害未成年人犯罪的意见，严厉打击性侵幼女、校园性侵等犯罪行为。,1
