,text,label
0,很多年轻人都追求运动，但又不想 牺牲 车辆的实用性，所以近些年各个厂家都纷纷推出了主打运动风格的车型，我们今天就介绍几款这样的车型。 一汽丰田 - 锐志 款装备了一台2.5L V6发动机，最大功率193马力，峰值扭矩236牛·米，参数与排量相近的四缸机相比，并没有太大优势，所以在加速测试中，它的成绩也没有太突出表现，属于同排量正常水平。,0
1,据悉，小米note2将采用5.7寸LG曲面屏幕，搭载骁龙821处理器，6+128G的存储组合。 并且将会有陶瓷后盖版本发布，预计价格会在4000元左右，讲道理，三星note7 挂了 。 现在安卓阵营还没有一款真正的安卓旗舰机，大家看好小米note2吗？,0
2,偶尔，会因为白天生活的繁忙或遇事不顺而失眠，闭着眼睛辗转反侧几次后，听些音乐才勉强入睡。 夜间，会因为睡前多喝了一杯水而起身去 洗手间 ，而每次都要瞎摸几次才能找到床头灯的开关，磕磕碰碰更是常事。 第二天闹钟的响起是新一天的开始，出门前总会用手机查一下今天的天气情况，好确定要不要带伞。,1
3,18日晚，《曲韵茶香—广州市粤曲茶座展演专场》在广州市南方剧院举行。 展演特邀了曾任广州越秀区 失明 曲艺队队长的失明艺人刘志刚，现场弹唱《碧海狂僧》。 展演以段落渐进的形式向观众展现各阶段茶座的发展及代表曲目，同时也注入了一些新的表现形式。,1
4,再往深里说，伊拉克战争也让人们看到美国式民主的失效。 一个布什、一个布莱尔，两个人就可以凭着谎言把两国青年推入战争去流血 牺牲 。 我认为，对霸权主义我们应该采取“文攻武卫”的战略对策。,1
5,人生如戏，全靠演技啊!当我小时候，说话还说不利索的时候，我馨爷已经在“爆金句”的道路上越走越远了。 家庭聚会被爷爷说“长得黑”自信的反驳 画画遇到小状况 挠头的样子好可爱 你 不在了 你要去哪啦~ 看到爸爸伤心，连忙补救不得不说 我馨爷情商高对爸爸的小把戏已近免疫啦给妈妈打电话，不忘记调侃你以为只有这些？ 那就大错特错了，馨爷的招牌必杀技是“抠脚大汉”！,0
6,”关于风险教育，行业协会对于从业机构的人员多次进行了培训，也与国内外港澳台进行了研究，区块链我们也在做，成立了研究组。 此外，互联网金融协会陆陆续续会成立专业委员会，专委会里边会邀请行业专家以及从业机构的相关 同志 ，都陆陆续续开展进一步的工作。 (记者 胡爱善),0
7,江西上饶鄱阳县私立博文中学一学生被三名教职人员殴打。 10月26日，澎湃新闻（www.thepaper.cn）从江西省上饶市鄱阳县教育体育局了解到，该学生与同学发生纠纷后，与班主任、政教处副主任、分管副校长发生冲突，三名教职人员存在对其轻度掌掴、脚踢等体罚行为，现已责令校方将三名涉事教职人员予以 辞退 ，并在全县通报。 据中国江西网10月25日报道，该学生被三名教职人员打得满脸是血。,1
8,青岛早报体育部主任马洪文23日因病抢救无效 离世 。 他众多的生前好友，都通过网络发表了纪念文章，寄托哀思。,1
9,据《粉球网》爆料，杰拉德前女友詹妮弗近日参加了一档电视节目，从曝光的画面来看，詹妮弗已经彻底 发福 ，并且变成一个胖女人。 本文转一比分快5秒的足球比分网：http: / / www.13322.com / 更多精彩内容，欢迎订阅关注【一比分】微信公众号：live13322 微信上点击添加朋友：一比分或live13322 即可关注,1
10,1、正对大街胡同、道路的不要买(正冲为箭，主伤人)2、高方不远处有高大建筑物的不要买(阻挡阳气，阴胜阳衰) 3、临近庙宇、骨灰堂、坟场、寺院、古墓的不要买(阴气太盛) 4“U”字楼不要买(U字楼形如亡字，常出人命案件) 5“口”字形的楼不要买(人在井中，不能 发福 发贵) 6、“T”字型楼不要买(不能藏风聚气，主贫寒) 7、“工”字形的楼不要买(这种楼难出富贵，主贫) 8、楼前空地窄狭若一条线者不要买(状如一线，财富不入门) 9、客厅窄狭的不要买(客厅窄狭不聚财) 10、人口少不要买太大的房子(房大人少叫宅克人，也叫“虚”，久居不吉利) 11、房间买单不买双(《宅书》云：“三间吉，四间少，五间就有一间空”) 12、缺西南角、西北角的不要买(对家人不好) 13、有儿子而正东方建成厕所的不要买(会影响儿子的身心健康和前途) 14、西北角作厕所、灶房的不要买(主凶) 十四点家装风水注意事项，快点收起来，千万不要以身犯险哟~[声明：本文由学点易经风水（yjfs8888）自网络搜集并整理发布，版权归原文作者所有，如侵犯到您的权益，请留言联系删除。 ]======随喜转载，功德无量======如果您喜欢此篇文章，记得发给好朋友哦！,1
11,网友@Sarah0831_W：为什么我只想笑，既不想评价那女的，也不想评价那些男的;网友@七七四拾玖：膜拜，膜拜，膜拜，史诗级多线程优化操作网友@LIEMOCH利马赫：我很想知道这20多个男朋友是怎么过的夜生活。 网友@我喵到你们了：还算有点良心，毕竟不是找每个男人要套房在事件酝酿爆发后，网友“傲娇的乔巴”在论坛爆料自己是小丽的公司同事，“事情发生之后公司的人都在讨论，我们都不敢想象她居然是这样的人，平时性格挺开朗的，人缘也蛮不错的，但是想不到居然为了钱可以做出这样的事情，听说公司打算 辞退 她了”。 目前，诸多媒体也开始对此次事件进行报道，不知道该女子的男友看到这一系列的新闻时会作何感想。,1
12,有次他一朋友失恋了，打电话给他聊天，他成功劝慰了朋友。 挂了 电话，问我们：我想不想个暖男？ 一女同事悠悠的说：就你的身高，也就算地暖！,0
13,方法虽好，但不要贪心！ 胸部 训练▼1：上斜哑铃卧推——3组30秒在时间内尽可能多的完成最多的次数 如果在这个时间里达到力竭，休息3秒后继续完成目标规定时间，如何判定力竭？ 当你动作形式变遭就算力竭，如果有小伙伴的话可以给与你一定的保护措施。,0
14,卡瓦略希望用自己的行动唤起人们对丧婴家庭的关注。 Sands Australia是一家非营利机构，旨在为那些经历过流产、死婴和婴儿在28天内 夭折 的家庭提供全天候特殊援助。 为了提高人们对丧婴家庭的关注，身为该机构首席执行官的卡瓦略将于24日在墨尔本Box Hill开始24小时不间断步行。,1
15,。 ” 10：办公区有两个 洗手间 ，一个近点一个远点。 一次遇见一同事从远点的那出来，就很奇怪的问她，为什么不就近要跑那么远，她原话是：“那边味道要好点。,1
16,该负责人表示，中方一贯尊重世贸组织规则，中方对相关原材料的出口关税和出口配额及相关管理措施是出于保护资源和环境的需要，是强化生态环境保护综合措施的组成部分，符合世贸组织规则。 中方对欧方对此提出磋商请求 表示遗憾 ，将根据世贸组织争端解决程序予以妥善处理。 来源中国证券网),1
17,新浪娱乐2015年03月26日07时54分03秒据台湾媒体报道，上周一傍晚，台湾查获一名涉嫌卖淫的金姓韩国籍女子，追查下发现金姓韩国籍女子所属应召网站，是一个专以LINE揽客的跨国卖淫集团，旗下 小姐 多为内地、香港、澳门、韩国、日本等地嫩模。 新浪娱乐 2015年03月26日 07时53分41秒应召网站赫见多名香港女星的照片，每小时至少索价3.5万元新台币（约7000人民币）。,1
18,” 带有多层抽屉的洗手池绝对是小浴室的必备法宝，合理地利用起洗手池下面的空间才是真正的收纳赢家。 如果抽屉里面还能分出功能隔断来那便是最 方便 的。 延伸至整面墙的抽屉柜和隔板可以根据使用者的需求任意组合，可以收纳各种高度的物件，还可以选择方便取用或是需要隐藏的物品。,0
19,痣生在脚趾位，代表该人聪明、有特殊天分及才能。 脚底下面长有吉痣，则表示地位高贵掌权之人，甚至连身边的人都可以沾光 发福 。 版权归原创者所有，如有侵权请及时联系!,1
20,冬天忙的时候，赵庆一天做了6场礼仪仪式。 当时，户外北风呼呼地吹个不停，因为礼仪师有着装要求，他上身只穿了衬衣、毛衣和一件外套， 下身 也只穿了一条保暖裤和一条长裤，在零下2℃的天气里笔直站着。 念悼词时，声音不停发抖。,0
21,旅游提示：1.海鲜很便宜，价格实惠量又足2.娱乐项目：摩托艇、spa、高空跳伞、打靶场（手枪、AK...）3.珊瑚岛不建议去，因为游客太多。 可以在当地临时组团包船去无人岛4.芭提雅的六街是 红灯区 （很乱）5.步行街（agogo是泰妹的色情表演，不推荐）危险和麻烦：1.泰国的警察相当不靠谱儿（骑摩托车时要当心）2.当心喝多了的老外,1
22,如果是涮着吃，鱼肉必须变成白色、不透明，有红肉的要变成暗红色。 烧熟煮透无疑是最保险的办法，虽然需要 牺牲 一点鲜嫩的口感，但还是健康更重要。 如果将鱼放在冰箱冷冻室1~7天，寄生虫也可以被杀死。,0
23,桃园市中坜一处民宅16日晚间发生火警。 台湾《中国时报》 / 赖佑维摄中新网10月17日电据台湾《中国时报》报道，郭姓 低收入 户一家7口上个月被台湾桃园市社会局安置在中坜区一处透天厝的2楼出租套房，16日晚间套房发生火警，消防队员全力灭火后，发现翁姓母亲和2名幼女、1名幼子逃至阳台，却被铁窗阻断生路，4人都被烧成焦尸，翁母手上还抱着不到2个月大女婴。 警消分析有可能是屋内电线老旧走火，火势延烧至幼童衣物一发不可收拾，详细起火原因有待调查。,1
24,邱淑贞是香港著名女演员，1987年，19岁的邱淑贞参选香港 小姐 ，期间因被爆曾整容而被迫退出。 后来，她在导演兼恋人王晶的安排下，放弃了清纯活泼的少女形象，改走性感路线，在三级片电影《赤裸羔羊》中奉献出了让人瞠目结舌的大胆演出，从此一跃成为香港娱乐圈里最着名的艳星。,0
25,"做一个骁勇善战的角色是每个男性的梦想，也是每个妻子对丈夫的期望.然而，总有人会因为自己打不了""持久战""而导致妻子不能心满意足，而作为丈夫也往往会无比失落，性生活这首美妙的乐曲因此出现一些不和谐的音符。 只要不能持久，男人自然会想到""早泄"".早泄算是一种病态，然而，真正患有早泄的人很少，千万不要给自己带上""早泄""的帽子，无谓增加心理压力.目前关于早泄还没有统一的定义，一般来说，医生将做爱短于1分钟(从进入阴道开始计时)即发生不可控制的射精现象称为早泄，实际上，真正患有早泄的人非常少.专家认为自己早泄的人只有不到1 / 10是真正的早泄，多数只是对自己射精过早不满而已，并不符合早泄的诊断标准.归纳起来，困扰男性的问题集中在以下三个方面:1、一直存在 房事 时间过短，每次都是意犹未尽甚至""一触即发"";2、以前做爱时间长，近来缩短;3、每次妻子还没有感觉或者兴致刚起即射精，女方难有性高潮.专家指出，男性性交时间的长短与心境、环境、年龄、体质以及性经验、双方配合密切相关，不可仅仅归咎于自己""不厉害""而忧心忡忡，譬如初次性交、久别重逢一般都会很快射精，这些经过一段时间调整即可延长性交时间，不必总是担心再次失败.想了解更多相关知识，还可以阅读：《 男人的早泄治疗期间需要注意什么?》。",1
26,福布斯2016中国富豪排行榜Top50世界晋商网全球晋商新闻、财经、思想、商务最大平台全球晋商干货资讯、山西猛料一网打尽！ 超过百万晋商悦读的晋商微信第一 大号 ！ 广受全球晋商推崇的山西财经门户网站！,0
27,朴有天被第四女起诉 性侵 警方已受理,1
28,”华夏民族自称是“龙的传人”或“龙的子孙”，中国的龙，具有图腾的基本特征，它是华夏各民族共同崇奉的图腾神。 神话传说黄帝乘龙 升天 ，颛顼[zhuānxū]乘龙而至四海。 那么，有没有文物说明龙的形象和来源呢？,0
29,百仁贷负责人认为，在新常态下，投资者要做到外察大势，内省己需，做好配置，趋利避害，把握机遇。 投资者在选择投资产品的时候需要充分考虑投资产品的收益性、风险性以及流动性，通过资产配置 结构优化 取得最佳平衡。 如何用有限的资本选择合适的投资渠道？,1
30,向Ella的经纪公司华研国际音乐求证，公司回复称：没有接获怀孕消息，平日工作也都在正常进行中，若有好消息会跟大分享。 Ella疑似怀孕已结婚四年的S.H.E成员Ella（陈嘉桦）近日被拍到身着宽松衣物和平底鞋，老公陪伴左右，疑似终于 有喜 ，获得不少网友祝福。 Ella的经纪公司华研国际音乐称：没有接获怀孕消息，平日工作也都在正常进行中，若有好消息会跟大分享。,1
31,桃花也是一味中药，药性是味苦，平，功用是主除水气，利大小便，下三虫，其实就是一种轻泻药，泄下速度非常快，但是这个泄下和一般的泻药还不同，不是拉稀，根本就是拉水，但是速度真的比任何泻药快，可是药力不算很猛，不会让人拉个不停，或者拉的很厉害，不过会让人脱水。 本草纲目云:桃花，性走泄下降，利大肠甚快...，若久服，即耗人阴血，损元气，所以桃花茶不是越喝越漂亮，健康，而是越来越虚弱，难看，损害阴血元气，女孩子尤其不可以喝，因为会影响 例假 和内分泌，会使皮肤越来越暗沉、难看。 喝桃花茶减肥更加不可能，虽然是一种泻药，不过排泄的主要是水分，一点意义也没有，而且拉肚子减肥必然会引起反弹和损害肠胃，造成依赖型的减肥。,1
32,据新华社电近期个税改革再度成为热点，针对有观点称“年收入12万元以上被定为高收入群体，要加税”，多位熟知个税改革的财税专家昨日回应说，这一观点是误读，纯属谣言，12万元不是划分高 低收入 人群的界限。 国家税务总局税收科学研究所所长李万甫说，被热炒的“年所得12万元”概念实际出自我国实施10年的个税纳税人自行申报制度。,1
33,如今，周某提起离婚诉讼，秀英法院受理该案。 周某诉称，两人相识时间短，缺乏了解就匆匆结婚，2000年马某 下岗 后，无固定工作，她为此身兼多职以抚养孩子，维持家庭开支，马某还对她实施家庭暴力，两次用刀架在她脖子上，声称要杀害她。 2012年周某被施暴后逃出，从此居住在娘家两年多，期间双方无过多联系，亦未履行夫妻间的权利和义务。,1
34,【环球网综合报道】据韩联社6月19日消息，日本政府将于20日公布对承认日军强征 慰安妇 历史的《河野谈话》进行核查的结果。 而结果将直接影响今后的韩日关系。,1
35,妈妈说，他有钱，有能力，有魄力。 妈妈 走了 ，带着多年辛苦积攒的嫁妆，带着我的眷恋和不舍。 我也走了，回头看着妈妈的背影越来越远，越来越模糊…… 作者（崔健你好)！,1
36,为了自己以后的生活，希望流产之后的妈妈善待自己。 第四条：注意不要生气，多多的卧床休息，多吃一些补血补气的东西，一个月内不要 同房 。 有疑问，咨询公众号：qdhfz - fk第五条：青岛红房子提醒：注意避孕，以免再孕。,1
37,但是央视的记者赶到本溪体育馆却发现，情况并不像俱乐部预期的那样。 早上9点的本溪体育馆门前，庞大的购票大军已经 不在了 。 这几天，俱乐部收回之前预订门票并加价出售的行为，批评声不断。,0
38,陈乔恩郭采洁郭采洁想靠胸器抢镜，可这奇葩的造型真是不给力，还一副心机女的表情，陈乔恩笑容好甜美。 范玮琪和林依晨范玮琪在林依晨订婚宴上戴上了假发，瞬间有林依晨 姨妈 即视感。 刘雯尚雯婕刘雯不愧是国际超模，气质甩假脸尚雯婕几条街。,0
39,昨天下午1点多，朝阳区建外SOHO附近的通用国际中心A座22层一 洗手间 发生火灾，造成近百人疏散。 洗手间内起火的是十几瓶白酒。,1
40,【概要】被抓后获刑5年半京华时报讯（记者杨凤临）因为轻信马路上散发的招嫖小广告，外地出差来京的彭某遭遇“仙人跳”。 “ 小姐 ”引来劫匪，彭某不仅遭遇殴打，还被抢走财物。 其中劫匪被抓，法院判其5年6个月。,0
41,女子因为男友和前女友联系大发醋意，男友为了表示自己是真心的，竟将前女友“送”去当“三陪 小姐 ”！ 日前，相关涉案人员被哈尔滨警方刑事拘留。,1
42,精索静脉曲张病情在发展的每个阶段，都有不同的表现症状，只要能认准早期的症状就能及时制止病情发展，病彻底治愈。 精索静脉曲张早期表现症状：1、阴囊坠胀不适出现睾丸疼痛的情况，有些时候在进行 房事 、长途行走症状加重，平卧休息后症状较轻。 2、睾丸位置变化患上精索静脉曲张后会发现睾丸位置变低，精索粗大，触及静脉团。,1
43,三月是女人节蛮多女生的节日都在这个月份的作为新的一年的开始妆容方面也要好好努力今年也要美美的哦 Miss hana花娜 小姐 底妆气垫粉饼 超好用的 简单的韩系妆容最重要的就是底妆啦 一定要清透才会有超好的气色哦我选择的是明亮色打底这款气垫粉饼的海绵能更好的吸住粉底液 轻轻拍打皮肤就会有细致又不厚重的光感底妆啦 ~~ 眼影我选的就是Miss hana花娜小姐 恒星双用眼影霜 啦是很Q的胶状 感觉比粉状的持久度更好 更不容易晕染哦选择这次主要的色系是 粉色 和 玫瑰金先用粉色涂满整个眼窝 涂一次就好啦 这个妆容讲究的就是清淡和剔透感啦 之后再在卧蚕处淡淡的刷一层然后在用金色涂在双眼皮的褶皱处 也会涂一点点就好啦这样简单的几下就能勾勒出立体的眼妆啦 这个妆容最重要的就是眼线啦Miss Hana花娜小姐不晕染防水防晕眼线笔用起来很顺手 分别入手的是 银河黑 星光棕 亮瞳棕三个色 ~~笔头是胶状质地的 在手背上试了下色 不会晕染哦 颜色能保持蛮久的我选了棕色用来画眼线 真心轻轻画下就很明显了颜色真的超浓 这支当初在台湾可是卖到翻掉的商品 沿着上眼线轻轻画上一道 适当的宽一点点就可以啦 很提眼型的 ~~ 这个妆容没有用假睫毛哦 是自己的睫毛所以眼妆看起来会更加清爽 睫毛膏的提亮眼神效果就分外重要啦睫毛膏是Miss hana花娜小姐 全日纤长卷翘睫毛膏 这支刷完绝对是根根分明 一点都不会黏在一起 里面的极细纤维越刷越轻翘的感觉真心好 ~~,0
44,一年后，丈夫钱钟书临终，一眼未合好，她附他耳边说：“你放心，有我！ ”杨先生不无凄凉：“钟书逃 走了 ，我也想逃走，但是逃到哪里去呢？ 我压根儿不能逃，得留在人世间，打扫现场，尽我应尽的责任。,1
45,微信公众号：趣味说（搜索umifun），每天分享这个世界最奇妙有趣的事情。 1. 小姐 你桌上的东西要不要先收拾一下？ 2.后面的镜子完全出卖你了… “哈哈，我女友趁我在睡觉时拍了这张照片，我好爱她哟！,0
46,很多人看到这条微博的时候吓了一跳，不知道发生了什么。 后来大家才知道，原来是晓明哥曾经救助过的一个白血病女孩儿 离世 了... 这个女孩儿叫张小雨，今天早上小雨的爸爸也用女儿的微博感谢了大家，证实了女儿已经离世了消息。 橘子君曾经见过一次小雨，她是一个长得很漂亮、笑起来又很甜的姑娘。,1
47,与男人的腰酸背痛对照，男人只要改善坐姿、在运动前加强暖身运动，就可以大幅改善腰酸背痛的症状。 但是女人的腰酸背痛，还涉及 生理期 的保养、鞋子的选择，以及厨房活动空间设计等。 那么，作为女人我们该如何缓解腰酸背痛？,1
48,据了解，此次集中签约投资项目70个，预计总投资177.64亿元，主要涉及生物医药、智能制造机器人、汽车部件、大数据、金融服务、众创平台、互联网科技、教育培训等领域，包括世界500强企业本特勒汽车部件、北京大墨智能机器人、上海美吉生物医药等高层级优质项目。 区领导孙剑楠、李文运、刘东海出席，区相关部门和镇街园区负责 同志 参加。,0
49,而通过选择拍摄韩式婚纱照风格，便可以满足许多准新娘心中的韩剧梦，亲身体验那种唯美。 7、英式风凯特王妃的风潮已经过去了，但《唐顿庄园》第三季里玛丽 小姐 的婚礼以及婚纱，都将会对来年的婚礼产生巨大的影响。 8、科技风新人们在科技世界里互相较劲，用INSTAGRAM婚礼相册记录婚礼、视频宾客指南招待客人、二维码保存日期、还有虚拟客人(通过直播婚礼现场)，也有华丽的婚礼网站，来进行民意调查、播放视频、列出一周尊贵客人等等。,0
50,霍建华林心如大婚将至，霍建华哥哥接受采访时表示只见过林心如一面，但已经认定林心如是“家人”，并表示会出席巴厘岛婚礼。 霍建华林心如将大婚 霍建华林心如据台湾媒体报道，霍建华和林心如520认爱后，一路赶进度，不止曝出女方 有喜 ，更决定7月31日巴厘岛大婚，演艺圈众多好友都送上祝福。 随着日期接近，霍建华、林心如二人将在巴厘岛宝格丽酒店举行婚礼、8月2日在台北办婚宴等消息都遭曝光。,1
51,保罗 - 路德（中）与伊娃 - 门德斯（右一）宣布最佳编剧奖时，罗莎里奥 - 道森（左一）激动的欢呼。 演员保罗 - 路德（左）抓住女演员伊娃 - 门德斯（右）的 胸部 。 罗莎里奥 - 道森（左一）激动的欢呼时，保罗 - 路德（中）当众摸了罗莎里奥 - 道森（左一）的胸部，罗莎里奥 - 道森随后反击。,1
52,9岁女童非正常死亡母亲失踪生前遭多次 性侵,1
53,图片来源：Gizmag你认为这项服务靠谱么？ 1.太希望大型超市能提供这种送货服务了2.我发现了问题（评论里聊聊）3.外卖小哥要 下岗 了…… 正在加载 ...除非注明，文章均为设计癖原创，转载请注明「来自设计癖」，并给出设计癖原文链接。 侵权必究。,1
54,夫妻两人因此发生争吵，妻子富明并未接受丈夫的道歉。 她等到丈夫睡熟后，持刀连刺丈夫 胸部 ，导致其死亡。 行凶后，富明还打电话给警方自首。,0
55,”杨燕怡说。 参加此次画展的俄罗斯“功勋艺术家”米哈伊尔说，在战火中死去的人们不能白白 牺牲 ，他们所做的一切是为了如今的和平。 艺术虽然不能解决政治和经济问题，但它能触动人类灵魂，使之更敏感、更向善。,1
56,一位画家失去了视力就等于失去了这份职业，但是在JohnBramblitt看来， 失明 其实给了他从事艺术的灵感。 JohnBramblitt从2001年开始绘画，同一年里他因为癫痫失去了视力。,1
57,4.运动时最好换上专用运动内裤，这种内裤穿20次就应该扔掉了。 5. 生理期 一定要有专用内裤，使用了15次就可以扔掉了。 内裤穿太久会引起皮肤病穿过了“保质期的”旧内裤会带来卫生问题，不仅仅会造成妇科病隐患，还可能导致各类接触性皮肤病或者皮肤敏感。,1
58,而《欢乐颂》中的关关饰演荀皇后的侄女荀安如。 故事始于靖王之子、大梁新帝登基十余年后，靖王和梅长苏均已 仙逝 。 琅琊榜2如果有胡歌王凯吴磊刘涛等原班人马，收视率绝对高。,1
59,这样更适合搭配而且换衣服也比较方便。 3、如果选择的婚纱是短款的露腿的，那么 下身 可能就必须穿与肤色同色的长袜了，虽不抵寒，但至少比不穿好一点点！ 4、上身无论如何都不要选择套头的，尤其是高领，因为在你穿脱之间很容易把脸上的妆面弄花影响造型，在选择开衫的最好的。,0
